編號,成語,注音,漢語拼音
2627.0,一念之誤,ㄧ　ㄋㄧㄢˋ　ㄓ　ㄨˋ　（變）　ㄧˊ　ㄋㄧㄢˋ　ㄓ　ㄨˋ,yī niàn zhī wù （變） yí niàn zhī wù
2628.0,一籌不畫,ㄧ　ㄔㄡˊ　ㄅㄨˋ　ㄏㄨㄚˋ　（變）　ㄧˋ　ㄔㄡˊ　ㄅㄨˊ　ㄏㄨㄚˋ,yī chóu bù huà （變） yì chóu bú huà
2629.0,一塵不受,ㄧ　ㄔㄣˊ　ㄅㄨˋ　ㄕㄡˋ　（變）　ㄧˋ　ㄔㄣˊ　ㄅㄨˊ　ㄕㄡˋ,yī chén bù shòu （變） yì chén bú shòu
2630.0,一跌不振,ㄧ　ㄉㄧㄝˊ　ㄅㄨˋ　ㄓㄣˋ　（變）　ㄧˋ　ㄉㄧㄝˊ　ㄅㄨˊ　ㄓㄣˋ,yī dié bù zhèn （變） yì dié bú zhèn
2631.0,一塵不到,ㄧ　ㄔㄣˊ　ㄅㄨˋ　ㄉㄠˋ　（變）　ㄧˋ　　ㄔㄣˊ　ㄅㄨˊ　ㄉㄠˋ,yī chén bù dào （變） yì chén bú dào
2632.0,一堂和氣,ㄧ　ㄊㄤˊ　ㄏㄜˊ　ㄑㄧˋ　（變）　ㄧˋ　ㄊㄤˊ　ㄏㄜˊ　ㄑㄧˋ,yī táng hé qì （變） yì táng hé qì
2633.0,一塵不涉,ㄧ　ㄔㄣˊ　ㄅㄨˋ　ㄕㄜˋ　（變）　ㄧˋ　ㄔㄣˊ　ㄅㄨˊ　ㄕㄜˋ,yī chén bù shè （變） yì chén bú shè
2634.0,一舉兩利,ㄧ　ㄐㄩˇ　ㄌㄧㄤˇ　ㄌㄧˋ　（變）　ㄧˋ　　ㄐㄩˇ　ㄌㄧㄤˇ　ㄌㄧˋ,yī jǔ liǎng lì （變） yì jǔ liǎng lì
2635.0,三面開網,ㄙㄢ　ㄇㄧㄢˋ　ㄎㄞ　ㄨㄤˇ,sān miàn kāi wǎng
2636.0,三緘口,ㄙㄢ　ㄐㄧㄢ　ㄎㄡˇ,sān jiān kǒu
2637.0,一隙不通,ㄧ　ㄒㄧˋ　ㄅㄨˋ　ㄊㄨㄥ　（變）　ㄧˊ　ㄒㄧˋ　ㄅㄨˋ　ㄊㄨㄥ,yī xì bù tōng （變） yí xì bù tōng
2638.0,一呼再諾,ㄧ　ㄏㄨ　ㄗㄞˋ　ㄋㄨㄛˋ　（變）　ㄧˋ　ㄏㄨ　ㄗㄞˋ　ㄋㄨㄛˋ,yī hū zài nuò （變） yì hū zài nuò
2639.0,三絕韋編,ㄙㄢ　ㄐㄩㄝˊ　ㄨㄟˊ　ㄅㄧㄢ,sān jué wéi biān
2640.0,三眼一板,ㄙㄢ　ㄧㄢˇ　ㄧ　ㄅㄢˇ　（變）　ㄙㄢ　ㄧㄢˇ　ㄧˋ　ㄅㄢˇ,sān yǎn yī bǎn （變） sān yǎn yì bǎn
2641.0,一網無遺,ㄧ　ㄨㄤˇ　ㄨˊ　ㄧˊ　（變）　ㄧˋ　ㄨㄤˇ　ㄨˊ　ㄧˊ,yī wǎng wú yí （變） yì wǎng wú yí
2642.0,一隙之見,ㄧ　ㄒㄧˋ　ㄓ　ㄐㄧㄢˋ　（變）　ㄧˊ　ㄒㄧˋ　ㄓ　ㄐㄧㄢˋ,yī xì zhī jiàn （變） yí xì zhī jiàn
2643.0,三寸舌,ㄙㄢ　ㄘㄨㄣˋ　ㄕㄜˊ,sān cùn shé
2644.0,三秋一日,ㄙㄢ　ㄑㄧㄡ　ㄧ　ㄖˋ　（變）　ㄙㄢ　ㄑㄧㄡ　ㄧˊ　ㄖˋ,sān qiū yī rì （變） sān qiū yí rì
2645.0,三章約,ㄙㄢ　ㄓㄤ　ㄩㄝ,sān zhāng yuē
2646.0,一揮千金,ㄧ　ㄏㄨㄟ　ㄑㄧㄢ　ㄐㄧㄣ　（變）　ㄧˋ　ㄏㄨㄟ　ㄑㄧㄢ　ㄐㄧㄣ,yī huī qiān jīn （變） yì huī qiān jīn
2647.0,五十步,ㄨˇ　ㄕˊ　ㄅㄨˋ,wǔ shí bù
2648.0,正中其懷,ㄓㄥˋ　ㄓㄨㄥˋ　ㄑㄧˊ　ㄏㄨㄞˊ,zhèng zhòng qí huái
2649.0,五日尹,ㄨˇ　ㄖˋ　ㄧㄣˇ,wǔ rì yǐn
2650.0,五十笑百,ㄨˇ　ㄕˊ　ㄒㄧㄠˋ　ㄅㄞˇ,wǔ shí xiào bǎi
2651.0,五裂四分,ㄨˇ　ㄌㄧㄝˋ　ㄙˋ　ㄈㄣ,wǔ liè sì fēn
2652.0,三盲摸象,ㄙㄢ　ㄇㄤˊ　ㄇㄛ　ㄒㄧㄤˋ,sān máng mō xiàng
2653.0,一口道破,ㄧ　ㄎㄡˇ　ㄉㄠˋ　ㄆㄛˋ　（變）　ㄧˋ　ㄎㄡˇ　ㄉㄠˋ　ㄆㄛˋ,yī kǒu dào pò （變） yì kǒu dào pò
2654.0,一事未成,ㄧ　ㄕˋ　ㄨㄟˋ　ㄔㄥˊ　（變）　ㄧˊ　ㄕˋ　ㄨㄟˋ　ㄔㄥˊ,yī shì wèi chéng （變） yí shì wèi chéng
2655.0,五令三申,ㄨˇ　ㄌㄧㄥˋ　ㄙㄢ　ㄕㄣ,wǔ lìng sān shēn
2656.0,三千世界,ㄙㄢ　ㄑㄧㄢ　ㄕˋ　ㄐㄧㄝˋ,sān qiān shì jiè
2657.0,三編絕,ㄙㄢ　ㄅㄧㄢ　ㄐㄩㄝˊ,sān biān jué
2658.0,玉映珠聯,ㄩˋ　ㄧㄥˋ　ㄓㄨ　ㄌㄧㄢˊ,yù yìng zhū lián
2659.0,玉粒桂薪,ㄩˋ　ㄌㄧˋ　ㄍㄨㄟˋ　ㄒㄧㄣ,yù lì guì xīn
2660.0,三謁茅廬,ㄙㄢ　ㄧㄝˋ　ㄇㄠˊ　ㄌㄨˊ,sān yè máo lú
2661.0,三長四短,ㄙㄢ　ㄔㄤˊ　ㄙˋ　ㄉㄨㄢˇ,sān cháng sì duǎn
2662.0,雪中之炭,ㄒㄩㄝˇ　ㄓㄨㄥ　ㄓ　ㄊㄢˋ,xuě zhōng zhī tàn
2663.0,一貧似水,ㄧ　ㄆㄧㄣˊ　ㄙˋ　ㄕㄨㄟˇ　（變）　ㄧˋ　　ㄆㄧㄣˊ　ㄙˋ　ㄕㄨㄟˇ,yī pín sì shuǐ （變） yì pín sì shuǐ
2664.0,駭人視聽,ㄏㄞˋ　ㄖㄣˊ　ㄕˋ　ㄊㄧㄥ,hài rén shì tīng
2665.0,嚴聲厲色,ㄧㄢˊ　ㄕㄥ　ㄌㄧˋ　ㄙㄜˋ,yán shēng lì sè
2666.0,一劍兩段,ㄧ　ㄐㄧㄢˋ　ㄌㄧㄤˇ　ㄉㄨㄢˋ　（變）　ㄧˊ　ㄐㄧㄢˋ　ㄌㄧㄤˇ　ㄉㄨㄢˋ,yī jiàn liǎng duàn （變） yí jiàn liǎng duàn
2667.0,三春寸草,ㄙㄢ　ㄔㄨㄣ　ㄘㄨㄣˋ　ㄘㄠˇ,sān chūn cùn cǎo
2668.0,三夫成虎,ㄙㄢ　ㄈㄨ　ㄔㄥˊ　ㄏㄨˇ,sān fū chéng hǔ
2669.0,死有餘咎,ㄙˇ　ㄧㄡˇ　ㄩˊ　ㄐㄧㄡˋ,sǐ yǒu yú jiù
2670.0,一目即了,ㄧ　ㄇㄨˋ　ㄐㄧˊ　ㄌㄧㄠˇ　（變）　ㄧˊ　ㄇㄨˋ　ㄐㄧˊ　ㄌㄧㄠˇ,yī mù jí liǎo （變） yí mù jí liǎo
2671.0,死心落地,ㄙˇ　ㄒㄧㄣ　ㄌㄨㄛˋ　ㄉㄧˋ,sǐ xīn luò dì
2672.0,一目數行,ㄧ　ㄇㄨˋ　ㄕㄨˋ　ㄏㄤˊ　（變）　ㄧˊ　ㄇㄨˋ　ㄕㄨˋ　ㄏㄤˊ,yī mù shù háng （變） yí mù shù háng
2673.0,一目五行,ㄧ　ㄇㄨˋ　ㄨˇ　ㄏㄤˊ　（變）　ㄧˊ　ㄇㄨˋ　ㄨˇ　ㄏㄤˊ,yī mù wǔ háng （變） yí mù wǔ háng
2674.0,一枕槐安,ㄧ　ㄓㄣˇ　ㄏㄨㄞˊ　ㄢ　（變）　ㄧˋ　ㄓㄣˇ　ㄏㄨㄞˊ　ㄢ,yī zhěn huái ān （變） yì zhěn huái ān 
2675.0,萬千氣象,ㄨㄢˋ　ㄑㄧㄢ　ㄑㄧˋ　ㄒㄧㄤˋ,wàn qiān qì xiàng
2676.0,霽月光風,ㄐㄧˋ　ㄩㄝˋ　ㄍㄨㄤ　ㄈㄥ,jì yuè guāng fēng
2677.0,萬象新,ㄨㄢˋ　ㄒㄧㄤˋ　ㄒㄧㄣ,wàn xiàng xīn
2678.0,萬紅千翠,ㄨㄢˋ　ㄏㄨㄥˊ　ㄑㄧㄢ　ㄘㄨㄟˋ,wàn hóng qiān cuì
2679.0,萬頭千緒,ㄨㄢˋ　ㄊㄡˊ　ㄑㄧㄢ　ㄒㄩˋ,wàn tóu qiān xù
2680.0,萬化千變,ㄨㄢˋ　ㄏㄨㄚˋ　ㄑㄧㄢ　ㄅㄧㄢˋ,wàn huà qiān biàn
2681.0,萬里鵝毛,ㄨㄢˋ　ㄌㄧˇ　ㄜˊ　ㄇㄠˊ,wàn lǐ é máo
2682.0,一夢南柯,ㄧ　ㄇㄥˋ　ㄋㄢˊ　ㄎㄜ　（變）　ㄧˊ　ㄇㄥˋ　ㄋㄢˊ　ㄎㄜ,yī mèng nán kē （變） yí mèng nán kē
2683.0,萬貫腰纏,ㄨㄢˋ　ㄍㄨㄢˋ　ㄧㄠ　ㄔㄢˊ,wàn guàn yāo chán
2684.0,萬年遺臭,ㄨㄢˋ　ㄋㄧㄢˊ　ㄧˊ　ㄔㄡˋ,wàn nián yí chòu
2685.0,萬籟俱息,ㄨㄢˋ　ㄌㄞˋ　ㄐㄩˋ　ㄒㄧˊ,wàn lài jù xí
2686.0,萬籟俱空,ㄨㄢˋ　ㄌㄞˋ　ㄐㄩˋ　ㄎㄨㄥ,wàn lài jù kōng
2687.0,雨覆雲翻,ㄩˇ　ㄈㄨˋ　ㄩㄣˊ　ㄈㄢ,yǔ fù yún fān
2688.0,正義嚴辭,ㄓㄥˋ　ㄧˋ　ㄧㄢˊ　ㄘˊ,zhèng yì yán cí
2689.0,萬事無成,ㄨㄢˋ　ㄕˋ　ㄨˊ　ㄔㄥˊ,wàn shì wú chéng
2690.0,惡盈釁滿,ㄜˋ　ㄧㄥˊ　ㄒㄧㄣˋ　ㄇㄢˇ,è yíng xìn mǎn
2691.0,焉用牛刀,ㄧㄢ　ㄩㄥˋ　ㄋㄧㄡˊ　ㄉㄠ,yān yòng niú dāo
2692.0,平步青天,ㄆㄧㄥˊ　ㄅㄨˋ　ㄑㄧㄥ　ㄊㄧㄢ,píng bù qīng tiān
2693.0,平心定意,ㄆㄧㄥˊ　ㄒㄧㄣ　ㄉㄧㄥˋ　ㄧˋ,píng xīn dìng yì
2694.0,於安思危,ㄩˊ　ㄢ　ㄙ　ㄨㄟˊ,yú ān sī wéi 
2695.0,平地風濤,ㄆㄧㄥˊ　ㄉㄧˋ　ㄈㄥ　ㄊㄠˊ,píng dì fēng táo
2696.0,平風靜浪,ㄆㄧㄥˊ　ㄈㄥ　ㄐㄧㄥˋ　ㄌㄤˋ,píng fēng jìng làng
2697.0,於事無濟,ㄩˊ　ㄕˋ　ㄨˊ　ㄐㄧˋ,yú shì wú jì
2698.0,兩端首鼠,ㄌㄧㄤˇ　ㄉㄨㄢ　ㄕㄡˇ　ㄕㄨˇ,liǎng duān shǒu shǔ
2699.0,無可奈,ㄨˊ　ㄎㄜˇ　ㄋㄞˋ,wú kě nài
2700.0,兩小無嫌,ㄌㄧㄤˇ　ㄒㄧㄠˇ　ㄨˊ　ㄒㄧㄢˊ,liǎng xiǎo wú xián
2701.0,無忌憚,ㄨˊ　ㄐㄧˋ　ㄉㄢˋ,wú jì dàn
2702.0,耳目更新,ㄦˇ　ㄇㄨˋ　ㄍㄥ　ㄒㄧㄣ,ěr mù gēng xīn
2703.0,耳目濡染,ㄦˇ　ㄇㄨˋ　ㄖㄨˊ　ㄖㄢˇ,ěr mù rú rǎn
2704.0,無能為技,ㄨˊ　ㄋㄥˊ　ㄨㄟˊ　ㄐㄧˋ,wú néng wéi jì
2705.0,乾澤而漁,ㄍㄢ　ㄗㄜˊ　ㄦˊ　ㄩˊ,gān zé ér yú
2706.0,無穴可入,ㄨˊ　ㄒㄩㄝˋ　ㄎㄜˇ　ㄖㄨˋ,wú xuè kě rù
2707.0,無適從,ㄨˊ　ㄕˋ　ㄘㄨㄥˊ,wú shì cóng
2708.0,無倫比,ㄨˊ　ㄌㄨㄣˊ　ㄅㄧˇ,wú lún bǐ
2709.0,無縫天衣,ㄨˊ　ㄈㄥˋ　ㄊㄧㄢ　ㄧ,wú fèng tiān yī
2710.0,難以枚舉,ㄋㄢˊ　ㄧˇ　ㄇㄟˊ　ㄐㄩˇ,nán yǐ méi jǔ
2711.0,無足挂齒,ㄨˊ　ㄗㄨˊ　ㄍㄨㄚˋ　ㄔˇ,wú zú guà chǐ
2712.0,無脛而至,ㄨˊ　ㄐㄧㄥˋ　ㄦˊ　ㄓˋ,wú jìng ér zhì
2713.0,無類之教,ㄨˊ　ㄌㄟˋ　ㄓ　ㄐㄧㄠˋ,wú lèi zhī jiào
2714.0,無益於事,ㄨˊ　ㄧˋ　ㄩˊ　ㄕˋ,wú yì yú shì
2715.0,兩短三長,ㄌㄧㄤˇ　ㄉㄨㄢˇ　ㄙㄢ　ㄔㄤˊ,liǎng duǎn sān cháng
2716.0,難弟難兄,ㄋㄢˊ　ㄉㄧˋ　ㄋㄢˊ　ㄒㄩㄥ,nán dì nán xiōng
2717.0,無妄之愆,ㄨˊ　ㄨㄤˋ　ㄓ　ㄑㄧㄢ,wú wàng zhī qiān
2718.0,無全牛,ㄨˊ　ㄑㄩㄢˊ　ㄋㄧㄡˊ,wú quán niú
2719.0,開門延盜,ㄎㄞ　ㄇㄣˊ　ㄧㄢˊ　ㄉㄠˋ,kāi mén yán dào
2720.0,開門納寇,ㄎㄞ　ㄇㄣˊ　ㄋㄚˋ　ㄎㄡˋ,kāi mén nà kòu
2721.0,平心氣,ㄆㄧㄥˊ　ㄒㄧㄣ　ㄑㄧˋ,píng xīn qì
2722.0,平心易氣,ㄆㄧㄥˊ　ㄒㄧㄣ　ㄧˋ　ㄑㄧˋ,píng xīn yì qì
2723.0,開門納狼,ㄎㄞ　ㄇㄣˊ　ㄋㄚˋ　ㄌㄤˊ,kāi mén nà láng
2724.0,無所可否,ㄨˊ　ㄙㄨㄛˇ　ㄎㄜˇ　ㄈㄡˇ,wú suǒ kě fǒu
2725.0,開門納賊,ㄎㄞ　ㄇㄣˊ　ㄋㄚˋ　ㄗㄟˊ,kāi mén nà zéi
2726.0,弄孫含飴,ㄋㄨㄥˋ　ㄙㄨㄣ　ㄏㄢˊ　ㄧˊ,nòng sūn hán yí
2727.0,弄沙成塔,ㄋㄨㄥˋ　ㄕㄚ　ㄔㄥˊ　ㄊㄚˇ,nòng shā chéng tǎ
2728.0,無能為謀,ㄨˊ　ㄋㄥˊ　ㄨㄟˊ　ㄇㄡˊ,wú néng wéi móu
2729.0,再見天日,ㄗㄞˋ　ㄐㄧㄢˋ　ㄊㄧㄢ　ㄖˋ,zài jiàn tiān rì
2730.0,無出其上,ㄨˊ　ㄔㄨ　ㄑㄧˊ　ㄕㄤˋ,wú chū qí shàng
2731.0,霸道橫行,ㄅㄚˋ　ㄉㄠˋ　ㄏㄥˊ　ㄒㄧㄥˊ,bà dào héng xíng 
2732.0,石爛江枯,ㄕˊ　ㄌㄢˋ　ㄐㄧㄤ　ㄎㄨ,shí làn jiāng kū
2733.0,石點頭,ㄕˊ　ㄉㄧㄢˇ　ㄊㄡˊ,shí diǎn tóu
2734.0,無微不到,ㄨˊ　ㄨㄟˊ　ㄅㄨˋ　ㄉㄠˋ　（變）　ㄨˊ　ㄨㄟˊ　ㄅㄨˊ　ㄉㄠˋ,wú wéi bù dào （變） wú wéi bú dào
2735.0,百無忌憚,ㄅㄞˇ　ㄨˊ　ㄐㄧˋ　ㄉㄢˋ,bǎi wú jì dàn
2736.0,百發穿楊,ㄅㄞˇ　ㄈㄚ　ㄔㄨㄢ　ㄧㄤˊ,bǎi fā chuān yáng
2737.0,百結鶉衣,ㄅㄞˇ　ㄐㄧㄝˊ　ㄔㄨㄣˊ　ㄧ,bǎi jié chún yī
2738.0,百出不窮,ㄅㄞˇ　ㄔㄨ　ㄅㄨˋ　ㄑㄩㄥˊ,bǎi chū bù qióng
2739.0,無計所奈,ㄨˊ　ㄐㄧˋ　ㄙㄨㄛˇ　ㄋㄞˋ,wú jì suǒ nài
2740.0,百金一諾,ㄅㄞˇ　ㄐㄧㄣ　ㄧ　ㄋㄨㄛˋ　（變）　ㄅㄞˇ　ㄐㄧㄣ　ㄧˊ　ㄋㄨㄛˋ,bǎi jīn yī nuò （變） bǎi jīn yí nuò
2741.0,百折不磨,ㄅㄞˇ　ㄓㄜˊ　ㄅㄨˋ　ㄇㄛˊ,bǎi zhé bù mó
2742.0,面面皆到,ㄇㄧㄢˋ　ㄇㄧㄢˋ　ㄐㄧㄝ　ㄉㄠˋ,miàn miàn jiē dào
2743.0,無地自厝,ㄨˊ　ㄉㄧˋ　ㄗˋ　ㄘㄨㄛˋ,wú dì zì cuò
2744.0,兩得益彰,ㄌㄧㄤˇ　ㄉㄜˊ　ㄧˋ　ㄓㄤ,liǎng dé yì zhāng 
2745.0,百挫不折,ㄅㄞˇ　ㄘㄨㄛˋ　ㄅㄨˋ　ㄓㄜˊ,bǎi cuò bù zhé
2746.0,雲驥行空,ㄩㄣˊ　ㄐㄧˋ　ㄒㄧㄥˊ　ㄎㄨㄥ,yún jì xíng kōng
2747.0,面紅過耳,ㄇㄧㄢˋ　ㄏㄨㄥˊ　ㄍㄨㄛˋ　ㄦˇ,miàn hóng guò ěr
2748.0,天空地闊,ㄊㄧㄢ　ㄎㄨㄥ　ㄉㄧˋ　ㄎㄨㄛˋ,tiān kōng dì kuò
2749.0,天涯地隅,ㄊㄧㄢ　ㄧㄚˊ　ㄉㄧˋ　ㄩˊ,tiān yá dì yú
2750.0,雷動風行,ㄌㄟˊ　ㄉㄨㄥˋ　ㄈㄥ　ㄒㄧㄥˊ,léi dòng fēng xíng
2751.0,磊落光明,ㄌㄟˇ　ㄌㄨㄛˋ　ㄍㄨㄤ　ㄇㄧㄥˊ,lěi luò guāng míng
2752.0,不言而明,ㄅㄨˋ　ㄧㄢˊ　ㄦˊ　ㄇㄧㄥˊ,bù yán ér míng
2753.0,不病而呻,ㄅㄨˋ　ㄅㄧㄥˋ　ㄦˊ　ㄕㄣ　（變）　ㄅㄨˊ　ㄅㄧㄥˋ　ㄦˊ　ㄕㄣ,bù bìng ér shēn （變） bú bìng ér shēn
2754.0,面紅頸赤,ㄇㄧㄢˋ　ㄏㄨㄥˊ　ㄐㄧㄥˇ　ㄔˋ,miàn hóng jǐng chì
2755.0,面垢頭蓬,ㄇㄧㄢˋ　ㄍㄡˋ　ㄊㄡˊ　ㄆㄥˊ,miàn gòu tóu péng
2756.0,天生地設,ㄊㄧㄢ　ㄕㄥ　ㄉㄧˋ　ㄕㄜˋ,tiān shēng dì shè
2757.0,西食東眠,ㄒㄧ　ㄕˊ　ㄉㄨㄥ　ㄇㄧㄢˊ,xī shí dōng mián
2758.0,不取一芥,ㄅㄨˋ　ㄑㄩˇ　ㄧ　ㄐㄧㄝˋ　（變）　ㄅㄨˋ　ㄑㄩˇ　ㄧˊ　ㄐㄧㄝˋ,bù qǔ yī jiè （變） bù qǔ yí jiè
2759.0,天地誅滅,ㄊㄧㄢ　ㄉㄧˋ　ㄓㄨ　ㄇㄧㄝˋ,tiān dì zhū miè
2760.0,不能為力,ㄅㄨˋ　ㄋㄥˊ　ㄨㄟˊ　ㄌㄧˋ,bù néng wéi lì
2761.0,不發聲色,ㄅㄨˋ　ㄈㄚ　ㄕㄥ　ㄙㄜˋ,bù fā shēng sè
2762.0,不待思索,ㄅㄨˋ　ㄉㄞˋ　ㄙ　ㄙㄨㄛˇ　（變）　ㄅㄨˊ　ㄉㄞˋ　ㄙ　ㄙㄨㄛˇ,bù dài sī suǒ （變） bú dài sī suǒ
2763.0,不謀同辭,ㄅㄨˋ　ㄇㄡˊ　ㄊㄨㄥˊ　ㄘˊ,bù móu tóng cí
2764.0,不染一塵,ㄅㄨˋ　ㄖㄢˇ　ㄧ　ㄔㄣˊ　（變）　ㄅㄨˋ　ㄖㄢˇ　ㄧˋ　ㄔㄣˊ,bù rǎn yī chén （變） bù rǎn yì chén
2765.0,不假思量,ㄅㄨˋ　ㄐㄧㄚˇ　ㄙ　ㄌㄧㄤˊ,bù jiǎ sī liáng
2766.0,不遺寸草,ㄅㄨˋ　ㄧˊ　ㄘㄨㄣˋ　ㄘㄠˇ,bù yí cùn cǎo
2767.0,不識丁,ㄅㄨˋ　ㄕˋ　ㄉㄧㄥ　（變）　ㄅㄨˊ　ㄕˋ　ㄉㄧㄥ,bù shì dīng （變） bú shì dīng
2768.0,不寒而冽,ㄅㄨˋ　ㄏㄢˊ　ㄦˊ　ㄌㄧㄝˋ,bù hán ér liè
2769.0,不速客,ㄅㄨˋ　ㄙㄨˋ　ㄎㄜˋ　（變）　ㄅㄨˊ　ㄙㄨˋ　ㄎㄜˋ,bù sù kè （變） bú sù kè
2770.0,不通一竅,ㄅㄨˋ　ㄊㄨㄥ　ㄧ　ㄑㄧㄠˋ　（變）　ㄅㄨˋ　ㄊㄨㄥ　ㄧˊ　ㄑㄧㄠˋ,bù tōng yī qiào （變） bù tōng yí qiào
2771.0,不假思慮,ㄅㄨˋ　ㄐㄧㄚˇ　ㄙ　ㄌㄩˋ,bù jiǎ sī lǜ
2772.0,不飾邊幅,ㄅㄨˋ　ㄕˋ　ㄅㄧㄢ　ㄈㄨˊ　（變）　ㄅㄨˊ　ㄕˋ　ㄅㄧㄢ　ㄈㄨˊ,bù shì biān fú （變） bú shì biān fú
2773.0,面紅耳熱,ㄇㄧㄢˋ　ㄏㄨㄥˊ　ㄦˇ　ㄖㄜˋ,miàn hóng ěr rè
2774.0,不加可否,ㄅㄨˋ　ㄐㄧㄚ　ㄎㄜˇ　ㄈㄡˇ,bù jiā kě fǒu
2775.0,不事邊幅,ㄅㄨˋ　ㄕˋ　ㄅㄧㄢ　ㄈㄨˊ　（變）　ㄅㄨˊ　ㄕˋ　ㄅㄧㄢ　ㄈㄨˊ,bù shì biān fú （變） bú shì biān fú
2776.0,不犯秋毫,ㄅㄨˋ　ㄈㄢˋ　ㄑㄧㄡ　ㄏㄠˊ　（變）　ㄅㄨˊ　ㄈㄢˋ　ㄑㄧㄡ　ㄏㄠˊ,bù fàn qiū háo （變） bú fàn qiū háo 
2777.0,不妄言笑,ㄅㄨˋ　ㄨㄤˋ　ㄧㄢˊ　ㄒㄧㄠˋ　（變）　ㄅㄨˊ　ㄨㄤˋ　ㄧㄢˊ　ㄒㄧㄠˋ,bù wàng yán xiào （變） bú wàng yán xiào
2778.0,不成一事,ㄅㄨˋ　ㄔㄥˊ　ㄧ　ㄕˋ　（變）　ㄅㄨˋ　ㄔㄥˊ　ㄧˊ　ㄕˋ,bù chéng yī shì （變） bù chéng yí shì
2779.0,不學無識,ㄅㄨˋ　ㄒㄩㄝˊ　ㄨˊ　ㄕˋ,bù xué wú shì
2780.0,玩物溺志,ㄨㄢˋ　ㄨˋ　ㄋㄧˋ　ㄓˋ,wàn wù nì zhì
2781.0,不學無文,ㄅㄨˋ　ㄒㄩㄝˊ　ㄨˊ　ㄨㄣˊ,bù xué wú wén
2782.0,不慚大言,ㄅㄨˋ　ㄘㄢˊ　ㄉㄚˋ　ㄧㄢˊ,bù cán dà yán
2783.0,不屑一世,ㄅㄨˋ　ㄒㄩㄝˋ　ㄧ　ㄕˋ　（變）　ㄅㄨˊ　ㄒㄩㄝˋ　ㄧˊ　ㄕˋ,bù xuè yī shì （變） bú xuè yí shì
2784.0,不同凡調,ㄅㄨˋ　ㄊㄨㄥˊ　ㄈㄢˊ　ㄉㄧㄠˋ,bù tóng fán diào
2785.0,玩兵黷武,ㄨㄢˊ　ㄅㄧㄥ　ㄉㄨˊ　ㄨˇ,wán bīng dú wǔ
2786.0,不屈撓,ㄅㄨˋ　ㄑㄩ　ㄋㄠˊ,bù qū náo
2787.0,不展愁眉,ㄅㄨˋ　ㄓㄢˇ　ㄔㄡˊ　ㄇㄟˊ,bù zhǎn chóu méi
2788.0,不留餘力,ㄅㄨˋ　ㄌㄧㄡˊ　ㄩˊ　ㄌㄧˋ,bù liú yú lì
2789.0,不息自強,ㄅㄨˋ　ㄒㄧˊ　ㄗˋ　ㄑㄧㄤˊ,bù xí zì qiáng
2790.0,巧取強奪,ㄑㄧㄠˇ　ㄑㄩˇ　ㄑㄧㄤˊ　ㄉㄨㄛˊ,qiǎo qǔ qiáng duó
2791.0,頑冥不靈,ㄨㄢˊ　ㄇㄧㄥˊ　ㄅㄨˋ　ㄌㄧㄥˊ,wán míng bù líng
2792.0,巧逾造化,ㄑㄧㄠˇ　ㄩˊ　ㄗㄠˋ　ㄏㄨㄚˋ,qiǎo yú zào huà
2793.0,巧奪造化,ㄑㄧㄠˇ　ㄉㄨㄛˊ　ㄗㄠˋ　ㄏㄨㄚˋ,qiǎo duó zào huà
2794.0,不阿不撓,ㄅㄨˋ　ㄜ　ㄅㄨˋ　ㄋㄠˊ,bù ē bù náo
2795.0,不同凡流,ㄅㄨˋ　ㄊㄨㄥˊ　ㄈㄢˊ　ㄌㄧㄡˊ,bù tóng fán liú
2796.0,巧絕天工,ㄑㄧㄠˇ　ㄐㄩㄝˊ　ㄊㄧㄢ　ㄍㄨㄥ,qiǎo jué tiān gōng
2797.0,不同天地,ㄅㄨˋ　ㄊㄨㄥˊ　ㄊㄧㄢ　ㄉㄧˋ,bù tóng tiān dì
2798.0,北轅適越,ㄅㄟˇ　ㄩㄢˊ　ㄕˋ　ㄩㄝˋ,běi yuán shì yuè
2799.0,不墮箕裘,ㄅㄨˋ　ㄉㄨㄛˋ　ㄐㄧ　ㄑㄧㄡˊ　（變）　ㄅㄨˊ　ㄉㄨㄛˋ　ㄐㄧ　ㄑㄧㄡˊ,bù duò jī qiú （變） bú duò jī qiú
2800.0,引玉拋磚,ㄧㄣˇ　ㄩˋ　ㄆㄠ　ㄓㄨㄢ,yǐn yù pāo zhuān
2801.0,班門取罪,ㄅㄢ　ㄇㄣˊ　ㄑㄩˇ　ㄗㄨㄟˋ,bān mén qǔ zuì
2802.0,不暇暖席,ㄅㄨˋ　ㄒㄧㄚˊ　ㄋㄨㄢˇ　ㄒㄧˊ,bù xiá nuǎn xí
2803.0,引經據禮,ㄧㄣˇ　ㄐㄧㄥ　ㄐㄩˋ　ㄌㄧˇ,yǐn jīng jù lǐ
2804.0,引經據義,ㄧㄣˇ　ㄐㄧㄥ　ㄐㄩˋ　ㄧˋ,yǐn jīng jù yì
2805.0,引盜入闥,ㄧㄣˇ　ㄉㄠˋ　ㄖㄨˋ　ㄊㄚˋ,yǐn dào rù tà
2806.0,不探虎穴，安得虎子,ㄅㄨˋ　ㄊㄢˋ　ㄏㄨˇ　ㄒㄩㄝˋ　ㄢ　ㄉㄜˊ　ㄏㄨˇ　ㄗˇ　（變）　ㄅㄨˊ　ㄊㄢˋ　ㄏㄨˇ　ㄒㄩㄝˋ　ㄢ　ㄉㄜˊ　ㄏㄨˇ　ㄗˇ,bù tàn hǔ xuè ān dé hǔ zǐ （變） bú tàn hǔ xuè ān dé hǔ zǐ
2807.0,北轅南轍,ㄅㄟˇ　ㄩㄢˊ　ㄋㄢˊ　ㄔㄜˋ,běi yuán nán chè
2808.0,背馳於道,ㄅㄟˋ　ㄔˊ　ㄩˊ　ㄉㄠˋ,bèi chí yú dào
2809.0,背道而行,ㄅㄟˋ　ㄉㄠˋ　ㄦˊ　ㄒㄧㄥˊ,bèi dào ér xíng
2810.0,背本逐末,ㄅㄟˋ　ㄅㄣˇ　ㄓㄨˊ　ㄇㄛˋ,bèi běn zhú mò
2811.0,驥伏櫪,ㄐㄧˋ　ㄈㄨˊ　ㄌㄧˋ,jì fú lì
2812.0,蜚流之言,ㄈㄟ　ㄌㄧㄡˊ　ㄓ　ㄧㄢˊ,fēi liú zhī yán
2813.0,不脛而馳,ㄅㄨˋ　ㄐㄧㄥˋ　ㄦˊ　ㄔˊ　（變）　ㄅㄨˊ　ㄐㄧㄥˋ　ㄦˊ　ㄔˊ,bù jìng ér chí （變） bú jìng ér chí
2814.0,引虎入室,ㄧㄣˇ　ㄏㄨˇ　ㄖㄨˋ　ㄕˋ,yǐn hǔ rù shì
2815.0,背邪向正,ㄅㄟˋ　ㄒㄧㄝˊ　ㄒㄧㄤˋ　ㄓㄥˋ,bèi xié xiàng zhèng
2816.0,張膽明目,ㄓㄤ　ㄉㄢˇ　ㄇㄧㄥˊ　ㄇㄨˋ,zhāng dǎn míng mù
2817.0,巧舌花脣,ㄑㄧㄠˇ　ㄕㄜˊ　ㄏㄨㄚ　ㄔㄨㄣˊ,qiǎo shé huā chún
2818.0,巧侔造化,ㄑㄧㄠˇ　ㄇㄡˊ　ㄗㄠˋ　ㄏㄨㄚˋ,qiǎo móu zào huà
2819.0,刊陳出新,ㄎㄢ　ㄔㄣˊ　ㄔㄨ　ㄒㄧㄣ,kān chén chū xīn
2820.0,形槁心灰,ㄒㄧㄥˊ　ㄍㄠˇ　ㄒㄧㄣ　ㄏㄨㄟ,xíng gǎo xīn huī
2821.0,引賊入家,ㄧㄣˇ　ㄗㄟˊ　ㄖㄨˋ　ㄐㄧㄚ,yǐn zéi rù jiā
2822.0,引人勝地,ㄧㄣˇ　ㄖㄣˊ　ㄕㄥˋ　ㄉㄧˋ,yǐn rén shèng dì
2823.0,孤行一意,ㄍㄨ　ㄒㄧㄥˊ　ㄧ　ㄧˋ　（變）　ㄍㄨ　ㄒㄧㄥˊ　ㄧˊ　ㄧˋ,gū xíng yī yì （變） gū xíng yí yì 
2824.0,孤詣苦心,ㄍㄨ　ㄧˋ　ㄎㄨˇ　ㄒㄧㄣ,gū yì kǔ xīn
2825.0,孤標峻節,ㄍㄨ　ㄅㄧㄠ　ㄐㄩㄣˋ　ㄐㄧㄝˊ,gū biāo jùn jié
2826.0,孤芳自愛,ㄍㄨ　ㄈㄤ　ㄗˋ　ㄞˋ,gū fāng zì ài
2827.0,不暇應接,ㄅㄨˋ　ㄒㄧㄚˊ　ㄧㄥˋ　ㄐㄧㄝ,bù xiá yìng jiē
2828.0,水乳之合,ㄕㄨㄟˇ　ㄖㄨˇ　ㄓ　ㄏㄜˊ,shuǐ rǔ zhī hé
2829.0,水乳相和,ㄕㄨㄟˇ　ㄖㄨˇ　ㄒㄧㄤ　ㄏㄜˊ,shuǐ rǔ xiāng hé
2830.0,水息不通,ㄕㄨㄟˇ　ㄒㄧˊ　ㄅㄨˋ　ㄊㄨㄥ,shuǐ xí bù tōng
2831.0,水闊天空,ㄕㄨㄟˇ　ㄎㄨㄛˋ　ㄊㄧㄢ　ㄎㄨㄥ,shuǐ kuò tiān kōng
2832.0,水淺長流,ㄕㄨㄟˇ　ㄑㄧㄢˇ　ㄔㄤˊ　ㄌㄧㄡˊ,shuǐ qiǎn cháng liú
2833.0,水清石出,ㄕㄨㄟˇ　ㄑㄧㄥ　ㄕˊ　ㄔㄨ,shuǐ qīng shí chū
2834.0,水涸石出,ㄕㄨㄟˇ　ㄏㄜˊ　ㄕˊ　ㄔㄨ,shuǐ hé shí chū
2835.0,水深火烈,ㄕㄨㄟˇ　ㄕㄣ　ㄏㄨㄛˇ　ㄌㄧㄝˋ,shuǐ shēn huǒ liè
2836.0,殘息奄奄,ㄘㄢˊ　ㄒㄧˊ　ㄧㄢ　ㄧㄢ,cán xí yān yān
2837.0,武陵世外,ㄨˇ　ㄌㄧㄥˊ　ㄕˋ　ㄨㄞˋ,wǔ líng shì wài
2838.0,戮力一意,ㄌㄨˋ　ㄌㄧˋ　ㄧ　ㄧˋ　（變）　ㄌㄨˋ　ㄌㄧˋ　ㄧˊ　ㄧˋ,lù lì yī yì （變） lù lì yí yì
2839.0,戮力同德,ㄌㄨˋ　ㄌㄧˋ　ㄊㄨㄥˊ　ㄉㄜˊ,lù lì tóng dé
2840.0,駿馬加鞭,ㄐㄩㄣˋ　ㄇㄚˇ　ㄐㄧㄚ　ㄅㄧㄢ,jùn mǎ jiā biān
2841.0,馳驥過欞,ㄔˊ　ㄐㄧˋ　ㄍㄨㄛˋ　ㄌㄧㄥˊ,chí jì guò líng
2842.0,馳風掣電,ㄔˊ　ㄈㄥ　ㄔㄜˋ　ㄉㄧㄢˋ,chí fēng chè diàn
2843.0,珠璧相映,ㄓㄨ　ㄅㄧˋ　ㄒㄧㄤ　ㄧㄥˋ,zhū bì xiāng yìng
2844.0,珠遺滄海,ㄓㄨ　ㄧˊ　ㄘㄤ　ㄏㄞˇ,zhū yí cāng hǎi
2845.0,珠米桂薪,ㄓㄨ　ㄇㄧˇ　ㄍㄨㄟˋ　ㄒㄧㄣ,zhū mǐ guì xīn
2846.0,殊轍同歸,ㄕㄨ　ㄔㄜˋ　ㄊㄨㄥˊ　ㄍㄨㄟ,shū chè tóng guī
2847.0,勁節高風,ㄐㄧㄥˋ　ㄐㄧㄝˊ　ㄍㄠ　ㄈㄥ,jìng jié gāo fēng
2848.0,孤恩負義,ㄍㄨ　ㄣ　ㄈㄨˋ　ㄧˋ,gū ēn fù yì
2849.0,珠生老蚌,ㄓㄨ　ㄕㄥ　ㄌㄠˇ　ㄅㄤˋ,zhū shēng lǎo bàng
2850.0,理足氣壯,ㄌㄧˇ　ㄗㄨˊ　ㄑㄧˋ　ㄓㄨㄤˋ,lǐ zú qì zhuàng
2851.0,強食弱肉,ㄑㄧㄤˊ　ㄕˊ　ㄖㄨㄛˋ　ㄖㄡˋ,qiáng shí ruò ròu
2852.0,珠聯玉映,ㄓㄨ　ㄌㄧㄢˊ　ㄩˋ　ㄧㄥˋ,zhū lián yù yìng
2853.0,強愎自用,ㄑㄧㄤˊ　ㄅㄧˋ　ㄗˋ　ㄩㄥˋ,qiáng bì zì yòng
2854.0,動常得咎,ㄉㄨㄥˋ　ㄔㄤˊ　ㄉㄜˊ　ㄐㄧㄡˋ,dòng cháng dé jiù
2855.0,強詞昧理,ㄑㄧㄤˇ　ㄘˊ　ㄇㄟˋ　ㄌㄧˇ,qiǎng cí mèi lǐ
2856.0,對驢彈琴,ㄉㄨㄟˋ　ㄌㄩˊ　ㄊㄢˊ　ㄑㄧㄣˊ,duì lǘ tán qín
2857.0,魂不著體,ㄏㄨㄣˊ　ㄅㄨˋ　ㄓㄨㄛˊ　ㄊㄧˇ,hún bù zhuó tǐ
2858.0,動輒見咎,ㄉㄨㄥˋ　ㄓㄜˊ　ㄐㄧㄢˋ　ㄐㄧㄡˋ,dòng zhé jiàn jiù
2859.0,魂飛膽喪,ㄏㄨㄣˊ　ㄈㄟ　ㄉㄢˇ　ㄙㄤˋ,hún fēi dǎn sàng
2860.0,破浪乘風,ㄆㄛˋ　ㄌㄤˋ　ㄔㄥˊ　ㄈㄥ,pò làng chéng fēng
2861.0,弓開得勝,ㄍㄨㄥ　ㄎㄞ　ㄉㄜˊ　ㄕㄥˋ,gōng kāi dé shèng
2862.0,勁草疾風,ㄐㄧㄥˋ　ㄘㄠˇ　ㄐㄧˊ　ㄈㄥ,jìng cǎo jí fēng
2863.0,理得心安,ㄌㄧˇ　ㄉㄜˊ　ㄒㄧㄣ　ㄢ,lǐ dé xīn ān
2864.0,對門當戶,ㄉㄨㄟˋ　ㄇㄣˊ　ㄉㄤ　ㄏㄨˋ,duì mén dāng hù
2865.0,馬耳射東風,ㄇㄚˇ　ㄦˇ　ㄕㄜˋ　ㄉㄨㄥ　ㄈㄥ,mǎ ěr shè dōng fēng
2866.0,馬跡蛛絲,ㄇㄚˇ　ㄐㄧ　ㄓㄨ　ㄙ,mǎ jī zhū sī
2867.0,強弩末,ㄑㄧㄤˊ　ㄋㄨˇ　ㄇㄛˋ,qiáng nǔ mò
2868.0,馬首前瞻,ㄇㄚˇ　ㄕㄡˇ　ㄑㄧㄢˊ　ㄓㄢ,mǎ shǒu qián zhān
2869.0,對牛鼓簧,ㄉㄨㄟˋ　ㄋㄧㄡˊ　ㄍㄨˇ　ㄏㄨㄤˊ,duì niú gǔ huáng
2870.0,功墜垂成,ㄍㄨㄥ　ㄓㄨㄟˋ　ㄔㄨㄟˊ　ㄔㄥˊ,gōng zhuì chuí chéng
2871.0,強詞奪正,ㄑㄧㄤˇ　ㄘˊ　ㄉㄨㄛˊ　ㄓㄥˋ,qiǎng cí duó zhèng
2872.0,對證處方,ㄉㄨㄟˋ　ㄓㄥˋ　ㄔㄨˇ　ㄈㄤ,duì zhèng chǔ fāng
2873.0,功倍事半,ㄍㄨㄥ　ㄅㄟˋ　ㄕˋ　ㄅㄢˋ,gōng bèi shì bàn
2874.0,鷸蚌相持,ㄩˋ　ㄅㄤˋ　ㄒㄧㄤ　ㄔˊ,yù bàng xiāng chí
2875.0,北調南腔,ㄅㄟˇ　ㄉㄧㄠˋ　ㄋㄢˊ　ㄑㄧㄤ,běi diào nán qiāng
2876.0,碧玉小家,ㄅㄧˋ　ㄩˋ　ㄒㄧㄠˇ　ㄐㄧㄚ,bì yù xiǎo jiā
2877.0,功廢垂成,ㄍㄨㄥ　ㄈㄟˋ　ㄔㄨㄟˊ　ㄔㄥˊ,gōng fèi chuí chéng
2878.0,聚沙為塔,ㄐㄩˋ　ㄕㄚ　ㄨㄟˊ　ㄊㄚˇ,jù shā wéi tǎ
2879.0,聚沙之塔,ㄐㄩˋ　ㄕㄚ　ㄓ　ㄊㄚˇ,jù shā zhī tǎ
2880.0,聚會精神,ㄐㄩˋ　ㄏㄨㄟˋ　ㄐㄧㄥ　ㄕㄣˊ,jù huì jīng shén 
2881.0,弓藏鳥盡,ㄍㄨㄥ　ㄘㄤˊ　ㄋㄧㄠˇ　ㄐㄧㄣˋ,gōng cáng niǎo jìn
2882.0,忍不可忍,ㄖㄣˇ　ㄅㄨˋ　ㄎㄜˇ　ㄖㄣˇ,rěn bù kě rěn
2883.0,觀止之嘆,ㄍㄨㄢ　ㄓˇ　ㄓ　ㄊㄢˋ,guān zhǐ zhī tàn
2884.0,馬牛風,ㄇㄚˇ　ㄋㄧㄡˊ　ㄈㄥ,mǎ niú fēng
2885.0,勇退急流,ㄩㄥˇ　ㄊㄨㄟˋ　ㄐㄧˊ　ㄌㄧㄡˊ,yǒng tuì jí liú
2886.0,雙瞳如豆,ㄕㄨㄤ　ㄊㄨㄥˊ　ㄖㄨˊ　ㄉㄡˋ,shuāng tóng rú dòu
2887.0,異軫同歸,ㄧˋ　ㄓㄣˇ　ㄊㄨㄥˊ　ㄍㄨㄟ,yì zhěn tóng guī
2888.0,異趣同歸,ㄧˋ　ㄑㄩ　ㄊㄨㄥˊ　ㄍㄨㄟ,yì qū tóng guī
2889.0,司空慣見,ㄙ　ㄎㄨㄥ　ㄍㄨㄢˋ　ㄐㄧㄢˋ,sī kōng guàn jiàn
2890.0,司空經慣,ㄙ　ㄎㄨㄥ　ㄐㄧㄥ　ㄍㄨㄢˋ,sī kōng jīng guàn
2891.0,歌遏行雲,ㄍㄜ　ㄜˋ　ㄒㄧㄥˊ　ㄩㄣˊ,gē è xíng yún
2892.0,已精求精,ㄧˇ　ㄐㄧㄥ　ㄑㄧㄡˊ　ㄐㄧㄥ,yǐ jīng qiú jīng
2893.0,桑田滄海,ㄙㄤ　ㄊㄧㄢˊ　ㄘㄤ　ㄏㄞˇ,sāng tián cāng hǎi
2894.0,飄風過耳,ㄆㄧㄠ　ㄈㄥ　ㄍㄨㄛˋ　ㄦˇ,piāo fēng guò ěr
2895.0,飄風吹馬耳,ㄆㄧㄠ　ㄈㄥ　ㄔㄨㄟ　ㄇㄚˇ　ㄦˇ,piāo fēng chuī mǎ ěr
2896.0,歌頌功德,ㄍㄜ　ㄙㄨㄥˋ　ㄍㄨㄥ　ㄉㄜˊ,gē sòng gōng dé
2897.0,信手拈出,ㄒㄧㄣˋ　ㄕㄡˇ　ㄋㄧㄢˊ　ㄔㄨ,xìn shǒu nián chū
2898.0,信手拈得,ㄒㄧㄣˋ　ㄕㄡˇ　ㄋㄧㄢˊ　ㄉㄜˊ,xìn shǒu nián dé
2899.0,雌黃信口,ㄘ　ㄏㄨㄤˊ　ㄒㄧㄣˋ　ㄎㄡˇ,cī huáng xìn kǒu
2900.0,垂不朽,ㄔㄨㄟˊ　ㄅㄨˋ　ㄒㄧㄡˇ,chuí bù xiǔ
2901.0,依然故吾,ㄧ　ㄖㄢˊ　ㄍㄨˋ　ㄨˊ,yī rán gù wú
2902.0,殫精覃思,ㄉㄢ　ㄐㄧㄥ　ㄊㄢˊ　ㄙ,dān jīng tán sī
2903.0,刃有餘地,ㄖㄣˋ　ㄧㄡˇ　ㄩˊ　ㄉㄧˋ,rèn yǒu yú dì
