編號,成語,注音,漢語拼音
4100.0,永傳不朽,ㄩㄥˇ　ㄔㄨㄢˊ　ㄅㄨˋ　ㄒㄧㄡˇ,yǒng chuán bù xiǔ
4101.0,玄機妙算,ㄒㄩㄢˊ　ㄐㄧ　ㄇㄧㄠˋ　ㄙㄨㄢˋ,xuán jī miào suàn
4102.0,立命安身,ㄌㄧˋ　ㄇㄧㄥˋ　ㄢ　ㄕㄣ,lì mìng ān shēn
4103.0,司空眼慣,ㄙ　ㄎㄨㄥ　ㄧㄢˇ　ㄍㄨㄢˋ,sī kōng yǎn guàn
4104.0,再接再礪,ㄗㄞˋ　ㄐㄧㄝ　ㄗㄞˋ　ㄌㄧˋ,zài jiē zài lì
4105.0,西山日迫,ㄒㄧ　ㄕㄢ　ㄖˋ　ㄆㄛˋ,xī shān rì pò
4106.0,民生塗炭,ㄇㄧㄣˊ　ㄕㄥ　ㄊㄨˊ　ㄊㄢˋ,mín shēng tú tàn
4107.0,耳紅面赤,ㄦˇ　ㄏㄨㄥˊ　ㄇㄧㄢˋ　ㄔˋ,ěr hóng miàn chì
4108.0,耳聞不如眼見,ㄦˇ　ㄨㄣˊ　ㄅㄨˋ　ㄖㄨˊ　ㄧㄢˇ　ㄐㄧㄢˋ,ěr wén bù rú yǎn jiàn
4109.0,老而益壯,ㄌㄠˇ　ㄦˊ　ㄧˋ　ㄓㄨㄤˋ,lǎo ér yì zhuàng
4110.0,死心搭地,ㄙˇ　ㄒㄧㄣ　ㄉㄚ　ㄉㄧˋ,sǐ xīn dā dì
4111.0,達權知變,ㄉㄚˊ　ㄑㄩㄢˊ　ㄓ　ㄅㄧㄢˋ,dá quán zhī biàn
4112.0,半塗而廢,ㄅㄢˋ　ㄊㄨˊ　ㄦˊ　ㄈㄟˋ,bàn tú ér fèi
4113.0,半塗而罷,ㄅㄢˋ　ㄊㄨˊ　ㄦˊ　ㄅㄚˋ,bàn tú ér bà
4114.0,耳染目濡,ㄦˇ　ㄖㄢˇ　ㄇㄨˋ　ㄖㄨˊ,ěr rǎn mù rú
4115.0,百世流芳,ㄅㄞˇ　ㄕˋ　ㄌㄧㄡˊ　ㄈㄤ,bǎi shì liú fāng
4116.0,百中百發,ㄅㄞˇ　ㄓㄨㄥˋ　ㄅㄞˇ　ㄈㄚ,bǎi zhòng bǎi fā
4117.0,百計千謀,ㄅㄞˇ　ㄐㄧˋ　ㄑㄧㄢ　ㄇㄡˊ,bǎi jì qiān móu
4118.0,百計千心,ㄅㄞˇ　ㄐㄧˋ　ㄑㄧㄢ　ㄒㄧㄣ,bǎi jì qiān xīn
4119.0,百謀千計,ㄅㄞˇ　ㄇㄡˊ　ㄑㄧㄢ　ㄐㄧˋ,bǎi móu qiān jì
4120.0,吊譽沽名,ㄉㄧㄠˋ　ㄩˋ　ㄍㄨ　ㄇㄧㄥˊ,diào yù gū míng
4121.0,肉林酒池,ㄖㄡˋ　ㄌㄧㄣˊ　ㄐㄧㄡˇ　ㄔˊ,ròu lín jiǔ chí
4122.0,因公行私,ㄧㄣ　ㄍㄨㄥ　ㄒㄧㄥˊ　ㄙ,yīn gōng xíng sī
4123.0,同心僇力,ㄊㄨㄥˊ　ㄒㄧㄣ　ㄌㄨˋ　ㄌㄧˋ,tóng xīn lù lì
4124.0,肌無完膚,ㄐㄧ　ㄨˊ　ㄨㄢˊ　ㄈㄨ,jī wú wán fū
4125.0,同志合道,ㄊㄨㄥˊ　ㄓˋ　ㄏㄜˊ　ㄉㄠˋ,tóng zhì hé dào
4126.0,全無忌憚,ㄑㄩㄢˊ　ㄨˊ　ㄐㄧˋ　ㄉㄢˋ,quán wú jì dàn
4127.0,同舟而濟,ㄊㄨㄥˊ　ㄓㄡ　ㄦˊ　ㄐㄧˋ,tóng zhōu ér jì
4128.0,血氣方壯,ㄒㄧㄝˇ　ㄑㄧˋ　ㄈㄤ　ㄓㄨㄤˋ,xiě qì fāng zhuàng
4129.0,血氣方盛,ㄒㄧㄝˇ　ㄑㄧˋ　ㄈㄤ　ㄕㄥˋ,xiě qì fāng shèng
4130.0,伐異黨同,ㄈㄚ　ㄧˋ　ㄉㄤˇ　ㄊㄨㄥˊ,fā yì dǎng tóng
4131.0,名不虛行,ㄇㄧㄥˊ　ㄅㄨˋ　ㄒㄩ　ㄒㄧㄥˊ,míng bù xū xíng
4132.0,名實相稱,ㄇㄧㄥˊ　ㄕˊ　ㄒㄧㄤ　ㄔㄥˋ,míng shí xiāng chèng
4133.0,名實相符,ㄇㄧㄥˊ　ㄕˊ　ㄒㄧㄤ　ㄈㄨˊ,míng shí xiāng fú
4134.0,眾望所積,ㄓㄨㄥˋ　ㄨㄤˋ　ㄙㄨㄛˇ　ㄐㄧ,zhòng wàng suǒ jī
4135.0,眾散親離,ㄓㄨㄥˋ　ㄙㄢˋ　ㄑㄧㄣ　ㄌㄧˊ,zhòng sàn qīn lí
4136.0,殺生與奪,ㄕㄚ　ㄕㄥ　ㄩˇ　ㄉㄨㄛˊ,shā shēng yǔ duó
4137.0,殺人如芥,ㄕㄚ　ㄖㄣˊ　ㄖㄨˊ　ㄐㄧㄝˋ,shā rén rú jiè
4138.0,刎頸至交,ㄨㄣˇ　ㄐㄧㄥˇ　ㄓˋ　ㄐㄧㄠ,wěn jǐng zhì jiāo
4139.0,名韁利索,ㄇㄧㄥˊ　ㄐㄧㄤ　ㄌㄧˋ　ㄙㄨㄛˇ,míng jiāng lì suǒ
4140.0,眾望有歸,ㄓㄨㄥˋ　ㄨㄤˋ　ㄧㄡˇ　ㄍㄨㄟ,zhòng wàng yǒu guī
4141.0,殺人如蓺,ㄕㄚ　ㄖㄣˊ　ㄖㄨˊ　ㄧˋ,shā rén rú yì
4142.0,殺衣縮食,ㄕㄞˋ　ㄧ　ㄙㄨㄛ　ㄕˊ,shài yī suō shí
4143.0,汗流洽背,ㄏㄢˋ　ㄌㄧㄡˊ　ㄒㄧㄚˊ　ㄅㄟˋ,hàn liú xiá bèi
4144.0,汗馬之績,ㄏㄢˋ　ㄇㄚˇ　ㄓ　ㄐㄧ,hàn mǎ zhī jī
4145.0,汗馬功績,ㄏㄢˋ　ㄇㄚˇ　ㄍㄨㄥ　ㄐㄧ,hàn mǎ gōng jī
4146.0,汗馬勛勞,ㄏㄢˋ　ㄇㄚˇ　ㄒㄩㄣ　ㄌㄠˊ,hàn mǎ xūn láo
4147.0,軍不血刃,ㄐㄩㄣ　ㄅㄨˋ　ㄒㄧㄝˇ　ㄖㄣˋ,jūn bù xiě rèn
4148.0,守道安貧,ㄕㄡˇ　ㄉㄠˋ　ㄢ　ㄆㄧㄣˊ,shǒu dào ān pín
4149.0,安坐待斃,ㄢ　ㄗㄨㄛˋ　ㄉㄞˋ　ㄅㄧˋ,ān zuò dài bì
4150.0,安若泰山,ㄢ　ㄖㄨㄛˋ　ㄊㄞˋ　ㄕㄢ,ān ruò tài shān
4151.0,後恭前倨,ㄏㄡˋ　ㄍㄨㄥ　ㄑㄧㄢˊ　ㄐㄩˋ,hòu gōng qián jù
4152.0,衣豐食飽,ㄧ　ㄈㄥ　ㄕˊ　ㄅㄠˇ,yī fēng shí bǎo
4153.0,齊驅並驟,ㄑㄧˊ　ㄑㄩ　ㄅㄧㄥˋ　ㄗㄡˋ,qí qū bìng zòu
4154.0,眾心如城,ㄓㄨㄥˋ　ㄒㄧㄣ　ㄖㄨˊ　ㄔㄥˊ,zhòng xīn rú chéng
4155.0,衣錦之榮,ㄧˋ　ㄐㄧㄣˇ　ㄓ　ㄖㄨㄥˊ,yì jǐn zhī róng
4156.0,衣冠沐猴,ㄧ　ㄍㄨㄢ　ㄇㄨˋ　ㄏㄡˊ,yī guān mù hóu
4157.0,衣錦故鄉,ㄧˋ　ㄐㄧㄣˇ　ㄍㄨˋ　ㄒㄧㄤ,yì jǐn gù xiāng
4158.0,衣裳楚楚,ㄧ　ㄔㄤˊ　ㄔㄨˇ　ㄔㄨˇ,yī cháng chǔ chǔ
4159.0,衣錦過鄉,ㄧˋ　ㄐㄧㄣˇ　ㄍㄨㄛˋ　ㄒㄧㄤ,yì jǐn guò xiāng
4160.0,防萌杜漸,ㄈㄤˊ　ㄇㄥˊ　ㄉㄨˋ　ㄐㄧㄢˋ,fáng méng dù jiàn
4161.0,江郎才掩,ㄐㄧㄤ　ㄌㄤˊ　ㄘㄞˊ　ㄧㄢˇ,jiāng láng cái yǎn
4162.0,好事天慳,ㄏㄠˇ　ㄕˋ　ㄊㄧㄢ　ㄑㄧㄢ,hǎo shì tiān qiān
4163.0,如芒在背,ㄖㄨˊ　ㄇㄤˊ　ㄗㄞˋ　ㄅㄟˋ,rú máng zài bèi
4164.0,汗馬之功,ㄏㄢˋ　ㄇㄚˇ　ㄓ　ㄍㄨㄥ,hàn mǎ zhī gōng
4165.0,興師見罪,ㄒㄧㄥ　ㄕ　ㄐㄧㄢˋ　ㄗㄨㄟˋ,xīng shī jiàn zuì
4166.0,如虎得翼,ㄖㄨˊ　ㄏㄨˇ　ㄉㄜˊ　ㄧˋ,rú hǔ dé yì
4167.0,如雷灌耳,ㄖㄨˊ　ㄌㄟˊ　ㄍㄨㄢˋ　ㄦˇ,rú léi guàn ěr
4168.0,如膠如漆,ㄖㄨˊ　ㄐㄧㄠ　ㄖㄨˊ　ㄑㄧ,rú jiāo rú qī
4169.0,好事多慳,ㄏㄠˇ　ㄕˋ　ㄉㄨㄛ　ㄑㄧㄢ,hǎo shì duō qiān
4170.0,盡瘁鞠躬,ㄐㄧㄣˋ　ㄘㄨㄟˋ　ㄐㄩˊ　ㄍㄨㄥ,jìn cuì jú gōng
4171.0,勵兵秣馬,ㄌㄧˋ　ㄅㄧㄥ　ㄇㄛˋ　ㄇㄚˇ,lì bīng mò mǎ
4172.0,壽陵匍匐,ㄕㄡˋ　ㄌㄧㄥˊ　ㄆㄨˊ　ㄈㄨˊ,shòu líng pú fú
4173.0,壽陵失步,ㄕㄡˋ　ㄌㄧㄥˊ　ㄕ　ㄅㄨˋ,shòu líng shī bù
4174.0,軒昂氣宇,ㄒㄩㄢ　ㄤˊ　ㄑㄧˋ　ㄩˇ,xuān áng qì yǔ
4175.0,否極生泰,ㄆㄧˇ　ㄐㄧˊ　ㄕㄥ　ㄊㄞˋ,pǐ jí shēng tài
4176.0,克儉克勤,ㄎㄜˋ　ㄐㄧㄢˇ　ㄎㄜˋ　ㄑㄧㄣˊ,kè jiǎn kè qín
4177.0,否終而泰,ㄆㄧˇ　ㄓㄨㄥ　ㄦˊ　ㄊㄞˋ,pǐ zhōng ér tài
4178.0,如魚似水,ㄖㄨˊ　ㄩˊ　ㄙˋ　ㄕㄨㄟˇ,rú yú sì shuǐ
4179.0,如膠投漆,ㄖㄨˊ　ㄐㄧㄠ　ㄊㄡˊ　ㄑㄧ,rú jiāo tóu qī
4180.0,志同心合,ㄓˋ　ㄊㄨㄥˊ　ㄒㄧㄣ　ㄏㄜˊ,zhì tóng xīn hé
4181.0,如荼如火,ㄖㄨˊ　ㄊㄨˊ　ㄖㄨˊ　ㄏㄨㄛˇ,rú tú rú huǒ
4182.0,歡忻鼓舞,ㄏㄨㄢ　ㄒㄧㄣ　ㄍㄨˇ　ㄨˇ,huān xīn gǔ wǔ
4183.0,亥豕魯魚,ㄏㄞˋ　ㄕˇ　ㄌㄨˇ　ㄩˊ,hài shǐ lǔ yú
4184.0,聲名狼籍,ㄕㄥ　ㄇㄧㄥˊ　ㄌㄤˊ　ㄐㄧˊ,shēng míng láng jí
4185.0,杞國憂天,ㄑㄧˇ　ㄍㄨㄛˊ　ㄧㄡ　ㄊㄧㄢ,qǐ guó yōu tiān
4186.0,弄法舞文,ㄋㄨㄥˋ　ㄈㄚˇ　ㄨˇ　ㄨㄣˊ,nòng fǎ wǔ wén
4187.0,杜漸除微,ㄉㄨˋ　ㄐㄧㄢˋ　ㄔㄨˊ　ㄨㄟˊ,dù jiàn chú wéi
4188.0,束手旁觀,ㄕㄨˋ　ㄕㄡˇ　ㄆㄤˊ　ㄍㄨㄢ,shù shǒu páng guān
4189.0,走頭無路,ㄗㄡˇ　ㄊㄡˊ　ㄨˊ　ㄌㄨˋ,zǒu tóu wú lù
4190.0,走筆成文,ㄗㄡˇ　ㄅㄧˇ　ㄔㄥˊ　ㄨㄣˊ,zǒu bǐ chéng wén
4191.0,形單影單,ㄒㄧㄥˊ　ㄉㄢ　ㄧㄥˇ　ㄉㄢ,xíng dān yǐng dān
4192.0,連珠合璧,ㄌㄧㄢˊ　ㄓㄨ　ㄏㄜˊ　ㄅㄧˋ,lián zhū hé bì
4193.0,花閉月羞,ㄏㄨㄚ　ㄅㄧˋ　ㄩㄝˋ　ㄒㄧㄡ,huā bì yuè xiū
4194.0,花枝招颭,ㄏㄨㄚ　ㄓ　ㄓㄠ　ㄓㄢˇ,huā zhī zhāo zhǎn
4195.0,花簇錦攢,ㄏㄨㄚ　ㄘㄨˋ　ㄐㄧㄣˇ　ㄘㄨㄢˊ,huā cù jǐn cuán
4196.0,求劍刻舟,ㄑㄧㄡˊ　ㄐㄧㄢˋ　ㄎㄜˋ　ㄓㄡ,qiú jiàn kè zhōu
4197.0,吹毛索疵,ㄔㄨㄟ　ㄇㄠˊ　ㄙㄨㄛˇ　ㄘ,chuī máo suǒ cī
4198.0,嘔心吐膽,ㄡˇ　ㄒㄧㄣ　ㄊㄨˇ　ㄉㄢˇ,ǒu xīn tǔ dǎn
4199.0,餘妙繞梁,ㄩˊ　ㄇㄧㄠˋ　ㄖㄠˋ　ㄌㄧㄤˊ,yú miào rào liáng
4200.0,猶豫未決,ㄧㄡˊ　ㄩˋ　ㄨㄟˋ　ㄐㄩㄝˊ,yóu yù wèi jué
4201.0,利鎖名牽,ㄌㄧˋ　ㄙㄨㄛˇ　ㄇㄧㄥˊ　ㄑㄧㄢ,lì suǒ míng qiān
4202.0,兵無血刃,ㄅㄧㄥ　ㄨˊ　ㄒㄧㄝˇ　ㄖㄣˋ,bīng wú xiě rèn
4203.0,返老歸童,ㄈㄢˇ　ㄌㄠˇ　ㄍㄨㄟ　ㄊㄨㄥˊ,fǎn lǎo guī tóng
4204.0,猶魚得水,ㄧㄡˊ　ㄩˊ　ㄉㄜˊ　ㄕㄨㄟˇ,yóu yú dé shuǐ
4205.0,作福作威,ㄗㄨㄛˋ　ㄈㄨˊ　ㄗㄨㄛˋ　ㄨㄟ,zuò fú zuò wēi
4206.0,坐而待斃,ㄗㄨㄛˋ　ㄦˊ　ㄉㄞˋ　ㄅㄧˋ,zuò ér dài bì
4207.0,忘年之好,ㄨㄤˋ　ㄋㄧㄢˊ　ㄓ　ㄏㄠˇ,wàng nián zhī hǎo 
4208.0,良莠不一,ㄌㄧㄤˊ　ㄧㄡˋ　ㄅㄨˋ　ㄧ,liáng yòu bù yī
4209.0,良莠淆雜,ㄌㄧㄤˊ　ㄧㄡˋ　ㄧㄠˊ　ㄗㄚˊ,liáng yòu yáo zá
4210.0,忘恩失義,ㄨㄤˋ　ㄣ　ㄕ　ㄧˋ,wàng ēn shī yì
4211.0,忘恩背義,ㄨㄤˋ　ㄣ　ㄅㄟˋ　ㄧˋ,wàng ēn bèi yì
4212.0,沐猴衣冠,ㄇㄨˋ　ㄏㄡˊ　ㄧ　ㄍㄨㄢ,mù hóu yī guān
4213.0,瀝血叩心,ㄌㄧˋ　ㄒㄧㄝˇ　ㄎㄡˋ　ㄒㄧㄣ,lì xiě kòu xīn
4214.0,滄桑之變,ㄘㄤ　ㄙㄤ　ㄓ　ㄅㄧㄢˋ,cāng sāng zhī biàn
4215.0,沐猴冠冕,ㄇㄨˋ　ㄏㄡˊ　ㄍㄨㄢˋ　ㄇㄧㄢˇ,mù hóu guàn miǎn
4216.0,應規蹈矩,ㄧㄥˋ　ㄍㄨㄟ　ㄉㄠˋ　ㄐㄩˇ,yìng guī dào jǔ
4217.0,補殘守缺,ㄅㄨˇ　ㄘㄢˊ　ㄕㄡˇ　ㄑㄩㄝ,bǔ cán shǒu quē
4218.0,應權通變,ㄧㄥˋ　ㄑㄩㄢˊ　ㄊㄨㄥ　ㄅㄧㄢˋ,yìng quán tōng biàn
4219.0,言不由中,ㄧㄢˊ　ㄅㄨˋ　ㄧㄡˊ　ㄓㄨㄥ,yán bù yóu zhōng
4220.0,言從計行,ㄧㄢˊ　ㄘㄨㄥˊ　ㄐㄧˋ　ㄒㄧㄥˊ,yán cóng jì xíng
4221.0,詞嚴義正,ㄘˊ　ㄧㄢˊ　ㄧˋ　ㄓㄥˋ,cí yán yì zhèng
4222.0,言聽計行,ㄧㄢˊ　ㄊㄧㄥ　ㄐㄧˋ　ㄒㄧㄥˊ,yán tīng jì xíng
4223.0,改張易調,ㄍㄞˇ　ㄓㄤ　ㄧˋ　ㄉㄧㄠˋ,gǎi zhāng yì diào
4224.0,勢鈞力敵,ㄕˋ　ㄐㄩㄣ　ㄌㄧˋ　ㄉㄧˊ,shì jūn lì dí
4225.0,臥鼓偃旗,ㄨㄛˋ　ㄍㄨˇ　ㄧㄢˇ　ㄑㄧˊ,wò gǔ yǎn qí
4226.0,言類懸河,ㄧㄢˊ　ㄌㄟˋ　ㄒㄩㄢˊ　ㄏㄜˊ,yán lèi xuán hé
4227.0,枉突徙薪,ㄨㄤˇ　ㄊㄨˊ　ㄒㄧˇ　ㄒㄧㄣ,wǎng tú xǐ xīn
4228.0,苞藏禍心,ㄅㄠ　ㄘㄤˊ　ㄏㄨㄛˋ　ㄒㄧㄣ,bāo cáng huò xīn
4229.0,紙貴洛城,ㄓˇ　ㄍㄨㄟˋ　ㄌㄨㄛˋ　ㄔㄥˊ,zhǐ guì luò chéng
4230.0,若喪考妣,ㄖㄨㄛˋ　ㄙㄤˋ　ㄎㄠˇ　ㄅㄧˇ,ruò sàng kǎo bǐ
4231.0,英雄短氣,ㄧㄥ　ㄒㄩㄥˊ　ㄉㄨㄢˇ　ㄑㄧˋ,yīng xióng duǎn qì
4232.0,青過於藍,ㄑㄧㄥ　ㄍㄨㄛˋ　ㄩˊ　ㄌㄢˊ,qīng guò yú lán
4233.0,轉輾反側,ㄓㄨㄢˇ　ㄓㄢˇ　ㄈㄢˇ　ㄘㄜˋ,zhuǎn zhǎn fǎn cè
4234.0,拔類超群,ㄅㄚˊ　ㄌㄟˋ　ㄔㄠ　ㄑㄩㄣˊ,bá lèi chāo qún
4235.0,抱薪救焚,ㄅㄠˋ　ㄒㄧㄣ　ㄐㄧㄡˋ　ㄈㄣˊ,bào xīn jiù fén
4236.0,抱殘守闕,ㄅㄠˋ　ㄘㄢˊ　ㄕㄡˇ　ㄑㄩㄝ,bào cán shǒu quē
4237.0,迥乎不同,ㄐㄩㄥˇ　ㄏㄨ　ㄅㄨˋ　ㄊㄨㄥˊ,jiǒng hū bù tóng
4238.0,披古通今,ㄆㄧ　ㄍㄨˇ　ㄊㄨㄥ　ㄐㄧㄣ,pī gǔ tōng jīn
4239.0,拔萃出群,ㄅㄚˊ　ㄘㄨㄟˋ　ㄔㄨ　ㄑㄩㄣˊ,bá cuì chū qún
4240.0,披毛求疵,ㄆㄧ　ㄇㄠˊ　ㄑㄧㄡˊ　ㄘ,pī máo qiú cī
4241.0,易於反掌,ㄧˋ　ㄩˊ　ㄈㄢˇ　ㄓㄤˇ,yì yú fǎn zhǎng
4242.0,鳴鍾列鼎,ㄇㄧㄥˊ　ㄓㄨㄥ　ㄌㄧㄝˋ　ㄉㄧㄥˇ,míng zhōng liè dǐng
4243.0,明珠生蚌,ㄇㄧㄥˊ　ㄓㄨ　ㄕㄥ　ㄅㄤˋ,míng zhū shēng bàng
4244.0,憑河暴虎,ㄆㄧㄥˊ　ㄏㄜˊ　ㄅㄠˋ　ㄏㄨˇ,píng hé bào hǔ
4245.0,朋比作奸,ㄆㄥˊ　ㄅㄧˋ　ㄗㄨㄛˋ　ㄐㄧㄢ,péng bì zuò jiān
4246.0,釣譽沽名,ㄉㄧㄠˋ　ㄩˋ　ㄍㄨ　ㄇㄧㄥˊ,diào yù gū míng
4247.0,覓柳尋花,ㄇㄧˋ　ㄌㄧㄡˇ　ㄒㄩㄣˊ　ㄏㄨㄚ,mì liǔ xún huā
4248.0,物至則反,ㄨˋ　ㄓˋ　ㄗㄜˊ　ㄈㄢˇ,wù zhì zé fǎn
4249.0,魚游釜底,ㄩˊ　ㄧㄡˊ　ㄈㄨˇ　ㄉㄧˇ,yú yóu fǔ dǐ
4250.0,狗盜雞鳴,ㄍㄡˇ　ㄉㄠˋ　ㄐㄧ　ㄇㄧㄥˊ,gǒu dào jī míng
4251.0,狗續貂尾,ㄍㄡˇ　ㄒㄩˋ　ㄉㄧㄠ　ㄨㄟˇ,gǒu xù diāo wěi
4252.0,舍本問末,ㄕㄜˇ　ㄅㄣˇ　ㄨㄣˋ　ㄇㄛˋ,shě běn wèn mò
4253.0,依本畫葫蘆,ㄧ　ㄅㄣˇ　ㄏㄨㄚˋ　ㄏㄨˊ　ㄌㄨˊ,yī běn huà hú lú
4254.0,知今博古,ㄓ　ㄐㄧㄣ　ㄅㄛˊ　ㄍㄨˇ,zhī jīn bó gǔ
4255.0,金屋貯嬌,ㄐㄧㄣ　ㄨ　ㄓㄨˇ　ㄐㄧㄠ,jīn wū zhǔ jiāo
4256.0,炙手而熱,ㄓˋ　ㄕㄡˇ　ㄦˊ　ㄖㄜˋ,zhì shǒu ér rè
4257.0,刻骨鏤心,ㄎㄜˋ　ㄍㄨˇ　ㄌㄡˋ　ㄒㄧㄣ,kè gǔ lòu xīn
4258.0,沾沾自足,ㄓㄢ　ㄓㄢ　ㄗˋ　ㄗㄨˊ,zhān zhān zì zú
4259.0,沽名吊譽,ㄍㄨ　ㄇㄧㄥˊ　ㄉㄧㄠˋ　ㄩˋ,gū míng diào yù
4260.0,沽名邀譽,ㄍㄨ　ㄇㄧㄥˊ　ㄧㄠ　ㄩˋ,gū míng yāo yù
4261.0,物極必返,ㄨˋ　ㄐㄧˊ　ㄅㄧˋ　ㄈㄢˇ,wù jí bì fǎn
4262.0,變風改俗,ㄅㄧㄢˋ　ㄈㄥ　ㄍㄞˇ　ㄙㄨˊ,biàn fēng gǎi sú
4263.0,變起蕭牆,ㄅㄧㄢˋ　ㄑㄧˇ　ㄒㄧㄠ　ㄑㄧㄤˊ,biàn qǐ xiāo qiáng
4264.0,怙惡不改,ㄏㄨˋ　ㄜˋ　ㄅㄨˋ　ㄍㄞˇ,hù è bù gǎi
4265.0,巷議街談,ㄒㄧㄤˋ　ㄧˋ　ㄐㄧㄝ　ㄊㄢˊ,xiàng yì jiē tán
4266.0,草廬三顧,ㄘㄠˇ　ㄌㄨˊ　ㄙㄢ　ㄍㄨˋ,cǎo lú sān gù
4267.0,按兵不舉,ㄢˋ　ㄅㄧㄥ　ㄅㄨˋ　ㄐㄩˇ,àn bīng bù jǔ
4268.0,赴湯投火,ㄈㄨˋ　ㄊㄤ　ㄊㄡˊ　ㄏㄨㄛˇ,fù tāng tóu huǒ
4269.0,指日而待,ㄓˇ　ㄖˋ　ㄦˊ　ㄉㄞˋ,zhǐ rì ér dài
4270.0,鴉雀無聞,ㄧㄚ　ㄑㄩㄝˋ　ㄨˊ　ㄨㄣˊ,yā què wú wén
4271.0,鴉鵲無聲,ㄧㄚ　ㄑㄩㄝˋ　ㄨˊ　ㄕㄥ,yā què wú shēng
4272.0,指桑說槐,ㄓˇ　ㄙㄤ　ㄕㄨㄛ　ㄏㄨㄞˊ,zhǐ sāng shuō huái
4273.0,標新取異,ㄅㄧㄠ　ㄒㄧㄣ　ㄑㄩˇ　ㄧˋ,biāo xīn qǔ yì
4274.0,枯木死灰,ㄎㄨ　ㄇㄨˋ　ㄙˇ　ㄏㄨㄟ,kū mù sǐ huī
4275.0,赴湯跳火,ㄈㄨˋ　ㄊㄤ　ㄊㄧㄠˋ　ㄏㄨㄛˇ,fù tāng tiào huǒ
4276.0,相得恨晚,ㄒㄧㄤ　ㄉㄜˊ　ㄏㄣˋ　ㄨㄢˇ,xiāng dé hèn wǎn
4277.0,星眸皓齒,ㄒㄧㄥ　ㄇㄡˊ　ㄏㄠˋ　ㄔˇ,xīng móu hào chǐ
4278.0,背生芒刺,ㄅㄟˋ　ㄕㄥ　ㄇㄤˊ　ㄘˋ,bèi shēng máng cì
4279.0,臨深履冰,ㄌㄧㄣˊ　ㄕㄣ　ㄌㄩˇ　ㄅㄧㄥ,lín shēn lǚ bīng
4280.0,臨渴穿井,ㄌㄧㄣˊ　ㄎㄜˇ　ㄔㄨㄢ　ㄐㄧㄥˇ,lín kě chuān jǐng
4281.0,指鹿作馬,ㄓˇ　ㄌㄨˋ　ㄗㄨㄛˋ　ㄇㄚˇ,zhǐ lù zuò mǎ
4282.0,怨聲盈路,ㄩㄢˋ　ㄕㄥ　ㄧㄥˊ　ㄌㄨˋ,yuàn shēng yíng lù
4283.0,膽驚心戰,ㄉㄢˇ　ㄐㄧㄥ　ㄒㄧㄣ　ㄓㄢˋ,dǎn jīng xīn zhàn
4284.0,盈篇累牘,ㄧㄥˊ　ㄆㄧㄢ　ㄌㄟˇ　ㄉㄨˊ,yíng piān lěi dú
4285.0,信口開喝,ㄒㄧㄣˋ　ㄎㄡˇ　ㄎㄞ　ㄏㄜˋ,xìn kǒu kāi hè 
4286.0,膽顫心驚,ㄉㄢˇ　ㄓㄢˋ　ㄒㄧㄣ　ㄐㄧㄥ,dǎn zhàn xīn jīng
4287.0,膽驚心顫,ㄉㄢˇ　ㄐㄧㄥ　ㄒㄧㄣ　ㄓㄢˋ,dǎn jīng xīn zhàn
4288.0,怨聲載路,ㄩㄢˋ　ㄕㄥ　ㄗㄞˋ　ㄌㄨˋ,yuàn shēng zài lù
4289.0,說梅止渴,ㄕㄨㄛ　ㄇㄟˊ　ㄓˇ　ㄎㄜˇ,shuō méi zhǐ kě
4290.0,惱羞變怒,ㄋㄠˇ　ㄒㄧㄡ　ㄅㄧㄢˋ　ㄋㄨˋ,nǎo xiū biàn nù
4291.0,哀鴻遍地,ㄞ　ㄏㄨㄥˊ　ㄅㄧㄢˋ　ㄉㄧˋ,āi hóng biàn dì
4292.0,逆耳忠言,ㄋㄧˋ　ㄦˇ　ㄓㄨㄥ　ㄧㄢˊ,nì ěr zhōng yán
4293.0,逆行倒施,ㄋㄧˋ　ㄒㄧㄥˊ　ㄉㄠˋ　ㄕ,nì xíng dào shī
4294.0,前功盡滅,ㄑㄧㄢˊ　ㄍㄨㄥ　ㄐㄧㄣˋ　ㄇㄧㄝˋ,qián gōng jìn miè
4295.0,前功皆棄,ㄑㄧㄢˊ　ㄍㄨㄥ　ㄐㄧㄝ　ㄑㄧˋ,qián gōng jiē qì
4296.0,養虎留患,ㄧㄤˇ　ㄏㄨˇ　ㄌㄧㄡˊ　ㄏㄨㄢˋ,yǎng hǔ liú huàn
4297.0,神機妙用,ㄕㄣˊ　ㄐㄧ　ㄇㄧㄠˋ　ㄩㄥˋ,shén jī miào yòng
4298.0,前倨後卑,ㄑㄧㄢˊ　ㄐㄩˋ　ㄏㄡˋ　ㄅㄟ,qián jù hòu bēi
4299.0,神術妙法,ㄕㄣˊ　ㄕㄨˋ　ㄇㄧㄠˋ　ㄈㄚˇ,shén shù miào fǎ
4300.0,屋下蓋屋,ㄨ　ㄒㄧㄚˋ　ㄍㄞˋ　ㄨ,wū xià gài wū
4301.0,神謀妙策,ㄕㄣˊ　ㄇㄡˊ　ㄇㄧㄠˋ　ㄘㄜˋ,shén móu miào cè
4302.0,神術妙策,ㄕㄣˊ　ㄕㄨˋ　ㄇㄧㄠˋ　ㄘㄜˋ,shén shù miào cè
4303.0,神機妙術,ㄕㄣˊ　ㄐㄧ　ㄇㄧㄠˋ　ㄕㄨˋ,shén jī miào shù
4304.0,駱驛不絕,ㄌㄨㄛˋ　ㄧˋ　ㄅㄨˋ　ㄐㄩㄝˊ,luò yì bù jué
4305.0,眉歡眼笑,ㄇㄟˊ　ㄏㄨㄢ　ㄧㄢˇ　ㄒㄧㄠˋ,méi huān yǎn xiào
4306.0,矜矜業業,ㄐㄧㄣ　ㄐㄧㄣ　ㄧㄝˋ　ㄧㄝˋ,jīn jīn yè yè
4307.0,柔懦寡斷,ㄖㄡˊ　ㄋㄨㄛˋ　ㄍㄨㄚˇ　ㄉㄨㄢˋ,róu nuò guǎ duàn
4308.0,退徙三舍,ㄊㄨㄟˋ　ㄒㄧˇ　ㄙㄢ　ㄕㄜˋ,tuì xǐ sān shè
4309.0,洞如觀火,ㄉㄨㄥˋ　ㄖㄨˊ　ㄍㄨㄢ　ㄏㄨㄛˇ,dòng rú guān huǒ
4310.0,秦庭朗鏡,ㄑㄧㄣˊ　ㄊㄧㄥˊ　ㄌㄤˇ　ㄐㄧㄥˋ,qín tíng lǎng jìng
4311.0,泰來否往,ㄊㄞˋ　ㄌㄞˊ　ㄆㄧˇ　ㄨㄤˇ,tài lái pǐ wǎng
4312.0,絡驛不絕,ㄌㄨㄛˋ　ㄧˋ　ㄅㄨˋ　ㄐㄩㄝˊ,luò yì bù jué
4313.0,捕風弄月,ㄅㄨˇ　ㄈㄥ　ㄋㄨㄥˋ　ㄩㄝˋ,bǔ fēng nòng yuè
4314.0,捕影拿風,ㄅㄨˇ　ㄧㄥˇ　ㄋㄚˊ　ㄈㄥ,bǔ yǐng ná fēng
4315.0,惡稔禍盈,ㄜˋ　ㄖㄣˇ　ㄏㄨㄛˋ　ㄧㄥˊ,è rěn huò yíng
4316.0,惡稔罪盈,ㄜˋ　ㄖㄣˇ　ㄗㄨㄟˋ　ㄧㄥˊ,è rěn zuì yíng
4317.0,惡稔貫盈,ㄜˋ　ㄖㄣˇ　ㄍㄨㄢˋ　ㄧㄥˊ,è rěn guàn yíng
4318.0,損本逐末,ㄙㄨㄣˇ　ㄅㄣˇ　ㄓㄨˊ　ㄇㄛˋ,sǔn běn zhú mò
4319.0,恐後爭先,ㄎㄨㄥˇ　ㄏㄡˋ　ㄓㄥ　ㄒㄧㄢ,kǒng hòu zhēng xiān
4320.0,珠沉滄海,ㄓㄨ　ㄔㄣˊ　ㄘㄤ　ㄏㄞˇ,zhū chén cāng hǎi
4321.0,莫逆之友,ㄇㄛˋ　ㄋㄧˋ　ㄓ　ㄧㄡˇ,mò nì zhī yǒu
4322.0,礪兵秣馬,ㄌㄧˋ　ㄅㄧㄥ　ㄇㄛˋ　ㄇㄚˇ,lì bīng mò mǎ
4323.0,殊致同歸,ㄕㄨ　ㄓˋ　ㄊㄨㄥˊ　ㄍㄨㄟ,shū zhì tóng guī
4324.0,莫逆之契,ㄇㄛˋ　ㄋㄧˋ　ㄓ　ㄑㄧˋ,mò nì zhī qì
4325.0,殊方同致,ㄕㄨ　ㄈㄤ　ㄊㄨㄥˊ　ㄓˋ,shū fāng tóng zhì
4326.0,莫措手足,ㄇㄛˋ　ㄘㄨㄛˋ　ㄕㄡˇ　ㄗㄨˊ,mò cuò shǒu zú
4327.0,破鏡重合,ㄆㄛˋ　ㄐㄧㄥˋ　ㄔㄨㄥˊ　ㄏㄜˊ,pò jìng chóng hé
4328.0,逢場作樂,ㄈㄥˊ　ㄔㄤˇ　ㄗㄨㄛˋ　ㄌㄜˋ,féng chǎng zuò lè
4329.0,倒屣而迎,ㄉㄠˋ　ㄒㄧˇ　ㄦˊ　ㄧㄥˊ,dào xǐ ér yíng
4330.0,倒屣迎賓,ㄉㄠˋ　ㄒㄧˇ　ㄧㄥˊ　ㄅㄧㄣ,dào xǐ yíng bīn
4331.0,倒屐相迎,ㄉㄠˋ　ㄐㄧ　ㄒㄧㄤ　ㄧㄥˊ,dào jī xiāng yíng
4332.0,透古通今,ㄊㄡˋ　ㄍㄨˇ　ㄊㄨㄥ　ㄐㄧㄣ,tòu gǔ tōng jīn
4333.0,鐵打心腸,ㄊㄧㄝˇ　ㄉㄚˇ　ㄒㄧㄣ　ㄔㄤˊ,tiě dǎ xīn cháng
4334.0,剖肝瀝膽,ㄆㄡˇ　ㄍㄢ　ㄌㄧˋ　ㄉㄢˇ,pǒu gān lì dǎn
4335.0,益無忌憚,ㄧˋ　ㄨˊ　ㄐㄧˋ　ㄉㄢˋ,yì wú jì dàn
4336.0,冤家路狹,ㄩㄢ　ㄐㄧㄚ　ㄌㄨˋ　ㄒㄧㄚˊ,yuān jiā lù xiá
4337.0,袖手傍觀,ㄒㄧㄡˋ　ㄕㄡˇ　ㄆㄤˊ　ㄍㄨㄢ,xiù shǒu páng guān
4338.0,病染膏肓,ㄅㄧㄥˋ　ㄖㄢˇ　ㄍㄠ　ㄏㄨㄤ,bìng rǎn gāo huāng
4339.0,疾聲大呼,ㄐㄧˊ　ㄕㄥ　ㄉㄚˋ　ㄏㄨ,jí shēng dà hū
4340.0,塗炭生民,ㄊㄨˊ　ㄊㄢˋ　ㄕㄥ　ㄇㄧㄣˊ,tú tàn shēng mín
4341.0,流汗浹背,ㄌㄧㄡˊ　ㄏㄢˋ　ㄐㄧㄚˊ　ㄅㄟˋ,liú hàn jiá bèi
4342.0,流芳萬古,ㄌㄧㄡˊ　ㄈㄤ　ㄨㄢˋ　ㄍㄨˇ,liú fāng wàn gǔ
4343.0,高枕不虞,ㄍㄠ　ㄓㄣˇ　ㄅㄨˋ　ㄩˊ,gāo zhěn bù yú
4344.0,高枕安臥,ㄍㄠ　ㄓㄣˇ　ㄢ　ㄨㄛˋ,gāo zhěn ān wò
4345.0,高節清風,ㄍㄠ　ㄐㄧㄝˊ　ㄑㄧㄥ　ㄈㄥ,gāo jié qīng fēng
4346.0,勒馬懸崖,ㄌㄜˋ　ㄇㄚˇ　ㄒㄩㄢˊ　ㄧㄞˊ,lè mǎ xuán yái
4347.0,高譚清論,ㄍㄠ　ㄊㄢˊ　ㄑㄧㄥ　ㄌㄨㄣˋ,gāo tán qīng lùn
4348.0,通時達變,ㄊㄨㄥ　ㄕˊ　ㄉㄚˊ　ㄅㄧㄢˋ,tōng shí dá biàn
4349.0,蕭牆禍起,ㄒㄧㄠ　ㄑㄧㄤˊ　ㄏㄨㄛˋ　ㄑㄧˇ,xiāo qiáng huò qǐ
4350.0,萍水相遭,ㄆㄧㄥˊ　ㄕㄨㄟˇ　ㄒㄧㄤ　ㄗㄠ,píng shuǐ xiāng zāo
4351.0,高枕勿憂,ㄍㄠ　ㄓㄣˇ　ㄨˋ　ㄧㄡ,gāo zhěn wù yōu
4352.0,萍水相遇,ㄆㄧㄥˊ　ㄕㄨㄟˇ　ㄒㄧㄤ　ㄩˋ,píng shuǐ xiāng yù
4353.0,夢裡南柯,ㄇㄥˋ　ㄌㄧˇ　ㄋㄢˊ　ㄎㄜ,mèng lǐ nán kē
4354.0,接應不暇,ㄐㄧㄝ　ㄧㄥˋ　ㄅㄨˋ　ㄒㄧㄚˊ,jiē yìng bù xiá
4355.0,推心致腹,ㄊㄨㄟ　ㄒㄧㄣ　ㄓˋ　ㄈㄨˋ,tuī xīn zhì fù
4356.0,推誠布信,ㄊㄨㄟ　ㄔㄥˊ　ㄅㄨˋ　ㄒㄧㄣˋ,tuī chéng bù xìn
4357.0,推誠置腹,ㄊㄨㄟ　ㄔㄥˊ　ㄓˋ　ㄈㄨˋ,tuī chéng zhì fù
4358.0,展轉反側,ㄓㄢˇ　ㄓㄨㄢˇ　ㄈㄢˇ　ㄘㄜˋ,zhǎn zhuǎn fǎn cè
4359.0,排患解紛,ㄆㄞˊ　ㄏㄨㄢˋ　ㄐㄧㄝˇ　ㄈㄣ,pái huàn jiě fēn
4360.0,釁起蕭牆,ㄒㄧㄣˋ　ㄑㄧˇ　ㄒㄧㄠ　ㄑㄧㄤˊ,xìn qǐ xiāo qiáng
4361.0,銖銖校量,ㄓㄨ　ㄓㄨ　ㄐㄧㄠˋ　ㄌㄧㄤˋ,zhū zhū jiào liàng
4362.0,高枕無虞,ㄍㄠ　ㄓㄣˇ　ㄨˊ　ㄩˊ,gāo zhěn wú yú
4363.0,逸以待勞,ㄧˋ　ㄧˇ　ㄉㄞˋ　ㄌㄠˊ,yì yǐ dài láo
4364.0,釁發蕭牆,ㄒㄧㄣˋ　ㄈㄚ　ㄒㄧㄠ　ㄑㄧㄤˊ,xìn fā xiāo qiáng
4365.0,掩耳偷鈴,ㄧㄢˇ　ㄦˇ　ㄊㄡ　ㄌㄧㄥˊ,yǎn ěr tōu líng
4366.0,偃旗臥鼓,ㄧㄢˇ　ㄑㄧˊ　ㄨㄛˋ　ㄍㄨˇ,yǎn qí wò gǔ
4367.0,欲蓋而彰,ㄩˋ　ㄍㄞˋ　ㄦˊ　ㄓㄤ,yù gài ér zhāng 
4368.0,黃袍加體,ㄏㄨㄤˊ　ㄆㄠˊ　ㄐㄧㄚ　ㄊㄧˇ,huáng páo jiā tǐ
4369.0,得寸思尺,ㄉㄜˊ　ㄘㄨㄣˋ　ㄙ　ㄔˇ,dé cùn sī chǐ
4370.0,惜香憐玉,ㄒㄧˊ　ㄒㄧㄤ　ㄌㄧㄢˊ　ㄩˋ,xí xiāng lián yù
4371.0,驚弦之鳥,ㄐㄧㄥ　ㄒㄧㄢˊ　ㄓ　ㄋㄧㄠˇ,jīng xián zhī niǎo
4372.0,望風而靡,ㄨㄤˋ　ㄈㄥ　ㄦˊ　ㄇㄧˇ,wàng fēng ér mǐ
4373.0,清原正本,ㄑㄧㄥ　ㄩㄢˊ　ㄓㄥˋ　ㄅㄣˇ,qīng yuán zhèng běn
4374.0,情孚意合,ㄑㄧㄥˊ　ㄈㄨˊ　ㄧˋ　ㄏㄜˊ,qíng fú yì hé
4375.0,深惡痛嫉,ㄕㄣ　ㄨˋ　ㄊㄨㄥˋ　ㄐㄧˊ,shēn wù tòng jí
4376.0,深謀遠猷,ㄕㄣ　ㄇㄡˊ　ㄩㄢˇ　ㄧㄡˊ,shēn móu yuǎn yóu
4377.0,深謀遠略,ㄕㄣ　ㄇㄡˊ　ㄩㄢˇ　ㄌㄩㄝˋ,shēn móu yuǎn lüè
4378.0,禍興蕭牆,ㄏㄨㄛˋ　ㄒㄧㄥ　ㄒㄧㄠ　ㄑㄧㄤˊ,huò xīng xiāo qiáng
4379.0,禍稔蕭牆,ㄏㄨㄛˋ　ㄖㄣˇ　ㄒㄧㄠ　ㄑㄧㄤˊ,huò rěn xiāo qiáng
4380.0,深圖遠慮,ㄕㄣ　ㄊㄨˊ　ㄩㄢˇ　ㄌㄩˋ,shēn tú yuǎn lǜ
4381.0,隨波逐塵,ㄙㄨㄟˊ　ㄅㄛ　ㄓㄨˊ　ㄔㄣˊ,suí bō zhú chén
4382.0,禍首罪魁,ㄏㄨㄛˋ　ㄕㄡˇ　ㄗㄨㄟˋ　ㄎㄨㄟˊ,huò shǒu zuì kuí
4383.0,殫心竭慮,ㄉㄢ　ㄒㄧㄣ　ㄐㄧㄝˊ　ㄌㄩˋ,dān xīn jié lǜ
4384.0,禍發蕭牆,ㄏㄨㄛˋ　ㄈㄚ　ㄒㄧㄠ　ㄑㄧㄤˊ,huò fā xiāo qiáng
4385.0,殫精畢力,ㄉㄢ　ㄐㄧㄥ　ㄅㄧˋ　ㄌㄧˋ,dān jīng bì lì
4386.0,清貧如洗,ㄑㄧㄥ　ㄆㄧㄣˊ　ㄖㄨˊ　ㄒㄧˇ,qīng pín rú xǐ
4387.0,情不自堪,ㄑㄧㄥˊ　ㄅㄨˋ　ㄗˋ　ㄎㄢ　（變）　ㄑㄧㄥˊ　ㄅㄨˊ　ㄗˋ　ㄎㄢ,qíng bù zì kān （變） qíng bú zì kān
4388.0,淹淹一息,ㄧㄢ　ㄧㄢ　ㄧ　ㄒㄧˊ　（變）　ㄧㄢ　ㄧㄢ　ㄧˋ　ㄒㄧˊ,yān yān yī xí （變） yān yān yì xí
4389.0,欺世釣譽,ㄑㄧ　ㄕˋ　ㄉㄧㄠˋ　ㄩˋ,qī shì diào yù
4390.0,斯文委地,ㄙ　ㄨㄣˊ　ㄨㄟˇ　ㄉㄧˋ,sī wén wěi dì
4391.0,超類絕倫,ㄔㄠ　ㄌㄟˋ　ㄐㄩㄝˊ　ㄌㄨㄣˊ,chāo lèi jué lún
4392.0,朝四暮三,ㄓㄠ　ㄙˋ　ㄇㄨˋ　ㄙㄢ,zhāo sì mù sān
4393.0,殫精畢思,ㄉㄢ　ㄐㄧㄥ　ㄅㄧˋ　ㄙ,dān jīng bì sī
4394.0,掣襟肘見,ㄔㄜˋ　ㄐㄧㄣ　ㄓㄡˇ　ㄒㄧㄢˋ,chè jīn zhǒu xiàn
4395.0,銳未可當,ㄖㄨㄟˋ　ㄨㄟˋ　ㄎㄜˇ　ㄉㄤˇ,ruì wèi kě dǎng
4396.0,皓齒星眸,ㄏㄠˋ　ㄔˇ　ㄒㄧㄥ　ㄇㄡˊ,hào chǐ xīng móu
4397.0,循循誘人,ㄒㄩㄣˊ　ㄒㄩㄣˊ　ㄧㄡˋ　ㄖㄣˊ,xún xún yòu rén
4398.0,孳孳不倦,ㄗ　ㄗ　ㄅㄨˋ　ㄐㄩㄢˋ　（變）　ㄗ　ㄗ　ㄅㄨˊ　ㄐㄩㄢˋ,zī zī bù juàn （變） zī zī bú juàn
4399.0,裝模做樣,ㄓㄨㄤ　ㄇㄛˊ　ㄗㄨㄛˋ　ㄧㄤˋ,zhuāng mó zuò yàng
4400.0,善賈而沽,ㄕㄢˋ　ㄐㄧㄚˋ　ㄦˊ　ㄍㄨ,shàn jià ér gū
4401.0,短兵接戰,ㄉㄨㄢˇ　ㄅㄧㄥ　ㄐㄧㄝ　ㄓㄢˋ,duǎn bīng jiē zhàn
4402.0,循次而進,ㄒㄩㄣˊ　ㄘˋ　ㄦˊ　ㄐㄧㄣˋ,xún cì ér jìn
4403.0,裝腔做勢,ㄓㄨㄤ　ㄑㄧㄤ　ㄗㄨㄛˋ　ㄕˋ,zhuāng qiāng zuò shì
4404.0,遺臭千年,ㄧˊ　ㄔㄡˋ　ㄑㄧㄢ　ㄋㄧㄢˊ,yí chòu qiān nián
4405.0,遺臭萬代,ㄧˊ　ㄔㄡˋ　ㄨㄢˋ　ㄉㄞˋ,yí chòu wàn dài
4406.0,緩步代車,ㄏㄨㄢˇ　ㄅㄨˋ　ㄉㄞˋ　ㄐㄩ,huǎn bù dài jū
4407.0,感激流涕,ㄍㄢˇ　ㄐㄧ　ㄌㄧㄡˊ　ㄊㄧˋ,gǎn jī liú tì
4408.0,感激涕泗,ㄍㄢˇ　ㄐㄧ　ㄊㄧˋ　ㄙˋ,gǎn jī tì sì
4409.0,摸棱兩可,ㄇㄛˊ　ㄌㄥˊ　ㄌㄧㄤˇ　ㄎㄜˇ,mó léng liǎng kě
4410.0,暗箭中人,ㄢˋ　ㄐㄧㄢˋ　ㄓㄨㄥˋ　ㄖㄣˊ,àn jiàn zhòng rén
