編號,成語,注音,漢語拼音
1164.0,殫精竭慮,ㄉㄢ　ㄐㄧㄥ　ㄐㄧㄝˊ　ㄌㄩˋ,dān jīng jié lǜ
1165.0,衣冠楚楚,ㄧ　ㄍㄨㄢ　ㄔㄨˇ　ㄔㄨˇ,yī guān chǔ chǔ
1166.0,光風霽月,ㄍㄨㄤ　ㄈㄥ　ㄐㄧˋ　ㄩㄝˋ,guāng fēng jì yuè 
1167.0,少不更事,ㄕㄠˋ　ㄅㄨˋ　ㄍㄥ　ㄕˋ,shào bù gēng shì
1168.0,回頭是岸,ㄏㄨㄟˊ　ㄊㄡˊ　ㄕˋ　ㄢˋ,huí tóu shì àn
1169.0,回心轉意,ㄏㄨㄟˊ　ㄒㄧㄣ　ㄓㄨㄢˇ　ㄧˋ,huí xīn zhuǎn yì
1170.0,獨當一面,ㄉㄨˊ　ㄉㄤ　ㄧ　ㄇㄧㄢˋ　（變）　ㄉㄨˊ　ㄉㄤ　ㄧˊ　ㄇㄧㄢˋ,dú dāng yī miàn （變） dú dāng yí miàn
1171.0,興師問罪,ㄒㄧㄥ　ㄕ　ㄨㄣˋ　ㄗㄨㄟˋ,xīng shī wèn zuì
1172.0,目不交睫,ㄇㄨˋ　ㄅㄨˋ　ㄐㄧㄠ　ㄐㄧㄝˊ,mù bù jiāo jié
1173.0,寥若晨星,ㄌㄧㄠˊ　ㄖㄨㄛˋ　ㄔㄣˊ　ㄒㄧㄥ,liáo ruò chén xīng
1174.0,針鋒相對,ㄓㄣ　ㄈㄥ　ㄒㄧㄤ　ㄉㄨㄟˋ,zhēn fēng xiāng duì
1175.0,吉人天相,ㄐㄧˊ　ㄖㄣˊ　ㄊㄧㄢ　ㄒㄧㄤˋ,jí rén tiān xiàng
1176.0,安貧樂道,ㄢ　ㄆㄧㄣˊ　ㄌㄜˋ　ㄉㄠˋ,ān pín lè dào
1177.0,安居樂業,ㄢ　ㄐㄩ　ㄌㄜˋ　ㄧㄝˋ,ān jū lè yè
1178.0,不識抬舉,ㄅㄨˋ　ㄕˋ　ㄊㄞˊ　ㄐㄩˇ　（變）　ㄅㄨˊ　ㄕˋ　ㄊㄞˊ　ㄐㄩˇ,bù shì tái jǔ （變） bú shì tái jǔ
1179.0,餘音繞梁,ㄩˊ　ㄧㄣ　ㄖㄠˋ　ㄌㄧㄤˊ,yú yīn rào liáng
1180.0,輕描淡寫,ㄑㄧㄥ　ㄇㄧㄠˊ　ㄉㄢˋ　ㄒㄧㄝˇ,qīng miáo dàn xiě
1181.0,彈丸之地,ㄉㄢˋ　ㄨㄢˊ　ㄓ　ㄉㄧˋ,dàn wán zhī dì
1182.0,自欺欺人,ㄗˋ　ㄑㄧ　ㄑㄧ　ㄖㄣˊ,zì qī qī rén
1183.0,有始無終,ㄧㄡˇ　ㄕˇ　ㄨˊ　ㄓㄨㄥ,yǒu shǐ wú zhōng
1184.0,刎頸之交,ㄨㄣˇ　ㄐㄧㄥˇ　ㄓ　ㄐㄧㄠ,wěn jǐng zhī jiāo
1185.0,改頭換面,ㄍㄞˇ　ㄊㄡˊ　ㄏㄨㄢˋ　ㄇㄧㄢˋ,gǎi tóu huàn miàn
1186.0,意氣用事,ㄧˋ　ㄑㄧˋ　ㄩㄥˋ　ㄕˋ,yì qì yòng shì
1187.0,路不拾遺,ㄌㄨˋ　ㄅㄨˋ　ㄕˊ　ㄧˊ,lù bù shí yí
1188.0,群龍無首,ㄑㄩㄣˊ　ㄌㄨㄥˊ　ㄨˊ　ㄕㄡˇ,qún lóng wú shǒu
1189.0,妙手空空,ㄇㄧㄠˋ　ㄕㄡˇ　ㄎㄨㄥ　ㄎㄨㄥ,miào shǒu kōng kōng
1190.0,求全責備,ㄑㄧㄡˊ　ㄑㄩㄢˊ　ㄗㄜˊ　ㄅㄟˋ,qiú quán zé bèi
1191.0,滔滔不絕,ㄊㄠ　ㄊㄠ　ㄅㄨˋ　ㄐㄩㄝˊ,tāo tāo bù jué
1192.0,逐臭之夫,ㄓㄨˊ　ㄔㄡˋ　ㄓ　ㄈㄨ,zhú chòu zhī fū
1193.0,道聽塗說,ㄉㄠˋ　ㄊㄧㄥ　ㄊㄨˊ　ㄕㄨㄛ,dào tīng tú shuō
1194.0,楚楚可憐,ㄔㄨˇ　ㄔㄨˇ　ㄎㄜˇ　ㄌㄧㄢˊ,chǔ chǔ kě lián
1195.0,無濟於事,ㄨˊ　ㄐㄧˋ　ㄩˊ　ㄕˋ,wú jì yú shì
1196.0,忠心耿耿,ㄓㄨㄥ　ㄒㄧㄣ　ㄍㄥˇ　ㄍㄥˇ,zhōng xīn gěng gěng
1197.0,陽春白雪,ㄧㄤˊ　ㄔㄨㄣ　ㄅㄞˊ　ㄒㄩㄝˇ,yáng chūn bái xuě
1198.0,絡繹不絕,ㄌㄨㄛˋ　ㄧˋ　ㄅㄨˋ　ㄐㄩㄝˊ,luò yì bù jué
1199.0,合浦珠還,ㄏㄜˊ　ㄆㄨˇ　ㄓㄨ　ㄏㄨㄢˊ,hé pǔ zhū huán
1200.0,信手拈來,ㄒㄧㄣˋ　ㄕㄡˇ　ㄋㄧㄢˊ　ㄌㄞˊ,xìn shǒu nián lái 
1201.0,順手牽羊,ㄕㄨㄣˋ　ㄕㄡˇ　ㄑㄧㄢ　ㄧㄤˊ,shùn shǒu qiān yáng
1202.0,無獨有偶,ㄨˊ　ㄉㄨˊ　ㄧㄡˇ　ㄡˇ,wú dú yǒu ǒu
1203.0,盛氣凌人,ㄕㄥˋ　ㄑㄧˋ　ㄌㄧㄥˊ　ㄖㄣˊ,shèng qì líng rén
1204.0,爭先恐後,ㄓㄥ　ㄒㄧㄢ　ㄎㄨㄥˇ　ㄏㄡˋ,zhēng xiān kǒng hòu
1205.0,發人深省,ㄈㄚ　ㄖㄣˊ　ㄕㄣ　ㄒㄧㄥˇ,fā rén shēn xǐng
1206.0,朋比為奸,ㄆㄥˊ　ㄅㄧˋ　ㄨㄟˊ　ㄐㄧㄢ,péng bì wéi jiān
1207.0,惴惴不安,ㄓㄨㄟˋ　ㄓㄨㄟˋ　ㄅㄨˋ　ㄢ,zhuì zhuì bù ān
1208.0,隨心所欲,ㄙㄨㄟˊ　ㄒㄧㄣ　ㄙㄨㄛˇ　ㄩˋ,suí xīn suǒ yù
1209.0,惜墨如金,ㄒㄧˊ　ㄇㄛˋ　ㄖㄨˊ　ㄐㄧㄣ,xí mò rú jīn
1210.0,若無其事,ㄖㄨㄛˋ　ㄨˊ　ㄑㄧˊ　ㄕˋ,ruò wú qí shì
1211.0,苦盡甘來,ㄎㄨˇ　ㄐㄧㄣˋ　ㄍㄢ　ㄌㄞˊ,kǔ jìn gān lái
1212.0,津津有味,ㄐㄧㄣ　ㄐㄧㄣ　ㄧㄡˇ　ㄨㄟˋ,jīn jīn yǒu wèi 
1213.0,花天酒地,ㄏㄨㄚ　ㄊㄧㄢ　ㄐㄧㄡˇ　ㄉㄧˋ,huā tiān jiǔ dì
1214.0,席不暇暖,ㄒㄧˊ　ㄅㄨˋ　ㄒㄧㄚˊ　ㄋㄨㄢˇ,xí bù xiá nuǎn 
1215.0,奄奄一息,ㄧㄢ　ㄧㄢ　ㄧ　ㄒㄧˊ　（變）　ㄧㄢ　ㄧㄢ　ㄧˋ　ㄒㄧˊ,yān yān yī xí （變） yān yān yì xí 
1216.0,玩世不恭,ㄨㄢˋ　ㄕˋ　ㄅㄨˋ　ㄍㄨㄥ,wàn shì bù gōng
1217.0,街談巷議,ㄐㄧㄝ　ㄊㄢˊ　ㄒㄧㄤˋ　ㄧˋ,jiē tán xiàng yì
1218.0,顧名思義,ㄍㄨˋ　ㄇㄧㄥˊ　ㄙ　ㄧˋ,gù míng sī yì
1219.0,馬耳東風,ㄇㄚˇ　ㄦˇ　ㄉㄨㄥ　ㄈㄥ,mǎ ěr dōng fēng
1220.0,歡欣鼓舞,ㄏㄨㄢ　ㄒㄧㄣ　ㄍㄨˇ　ㄨˇ,huān xīn gǔ wǔ
1221.0,面紅耳赤,ㄇㄧㄢˋ　ㄏㄨㄥˊ　ㄦˇ　ㄔˋ,miàn hóng ěr chì
1222.0,閉月羞花,ㄅㄧˋ　ㄩㄝˋ　ㄒㄧㄡ　ㄏㄨㄚ,bì yuè xiū huā
1223.0,欲速不達,ㄩˋ　ㄙㄨˋ　ㄅㄨˋ　ㄉㄚˊ,yù sù bù dá
1224.0,前事不忘，後事之師,ㄑㄧㄢˊ　ㄕˋ　ㄅㄨˋ　ㄨㄤˋ　ㄏㄡˋ　ㄕˋ　ㄓ　ㄕ　（變）　ㄑㄧㄢˊ　ㄕˋ　ㄅㄨˊ　ㄨㄤˋ　ㄏㄡˋ　ㄕˋ　ㄓ　ㄕ,qián shì bù wàng hòu shì zhī shī （變） qián shì bú wàng hòu shì zhī shī
1225.0,懲前毖後,ㄔㄥˊ　ㄑㄧㄢˊ　ㄅㄧˋ　ㄏㄡˋ,chéng qián bì hòu
1226.0,五日京兆,ㄨˇ　ㄖˋ　ㄐㄧㄥ　ㄓㄠˋ,wǔ rì jīng zhào
1227.0,無可奈何,ㄨˊ　ㄎㄜˇ　ㄋㄞˋ　ㄏㄜˊ,wú kě nài hé
1228.0,改弦更張,ㄍㄞˇ　ㄒㄧㄢˊ　ㄍㄥ　ㄓㄤ,gǎi xián gēng zhāng
1229.0,少見多怪,ㄕㄠˇ　ㄐㄧㄢˋ　ㄉㄨㄛ　ㄍㄨㄞˋ,shǎo jiàn duō guài
1230.0,知難而退,ㄓ　ㄋㄢˊ　ㄦˊ　ㄊㄨㄟˋ,zhī nán ér tuì
1231.0,始作俑者,ㄕˇ　ㄗㄨㄛˋ　ㄩㄥˇ　ㄓㄜˇ,shǐ zuò yǒng zhě
1232.0,撥亂反正,ㄅㄛ　ㄌㄨㄢˋ　ㄈㄢˇ　ㄓㄥˋ,bō luàn fǎn zhèng
1233.0,醉翁之意不在酒,ㄗㄨㄟˋ　ㄨㄥ　ㄓ　ㄧˋ　ㄅㄨˋ　ㄗㄞˋ　ㄐㄧㄡˇ　（變）　ㄗㄨㄟˋ　ㄨㄥ　ㄓ　ㄧˋ　ㄅㄨˊ　ㄗㄞˋ　ㄐㄧㄡˇ,zuì wēng zhī yì bù zài jiǔ （變） zuì wēng zhī yì bú zài jiǔ
1234.0,精衛填海,ㄐㄧㄥ　ㄨㄟˋ　ㄊㄧㄢˊ　ㄏㄞˇ,jīng wèi tián hǎi
1235.0,實事求是,ㄕˊ　ㄕˋ　ㄑㄧㄡˊ　ㄕˋ,shí shì qiú shì
1236.0,聞一知十,ㄨㄣˊ　ㄧ　ㄓ　ㄕˊ,wén yī zhī shí
1237.0,倚馬可待,ㄧˇ　ㄇㄚˇ　ㄎㄜˇ　ㄉㄞˋ,yǐ mǎ kě dài 
1238.0,多難興邦,ㄉㄨㄛ　ㄋㄢˋ　ㄒㄧㄥ　ㄅㄤ,duō nàn xīng bāng
1239.0,為人作嫁,ㄨㄟˋ　ㄖㄣˊ　ㄗㄨㄛˋ　ㄐㄧㄚˋ,wèi rén zuò jià
1240.0,風燭殘年,ㄈㄥ　ㄓㄨˊ　ㄘㄢˊ　ㄋㄧㄢˊ,fēng zhú cán nián
1241.0,要言不煩,ㄧㄠˋ　ㄧㄢˊ　ㄅㄨˋ　ㄈㄢˊ,yào yán bù fán
1242.0,米珠薪桂,ㄇㄧˇ　ㄓㄨ　ㄒㄧㄣ　ㄍㄨㄟˋ,mǐ zhū xīn guì
1243.0,自以為是,ㄗˋ　ㄧˇ　ㄨㄟˊ　ㄕˋ,zì yǐ wéi shì
1244.0,豺狼當道,ㄔㄞˊ　ㄌㄤˊ　ㄉㄤ　ㄉㄠˋ,chái láng dāng dào
1245.0,談何容易,ㄊㄢˊ　ㄏㄜˊ　ㄖㄨㄥˊ　ㄧˋ,tán hé róng yì
1246.0,問道於盲,ㄨㄣˋ　ㄉㄠˋ　ㄩˊ　ㄇㄤˊ,wèn dào yú máng
1247.0,英雄無用武之地,ㄧㄥ　ㄒㄩㄥˊ　ㄨˊ　ㄩㄥˋ　ㄨˇ　ㄓ　ㄉㄧˋ,yīng xióng wú yòng wǔ zhī dì
1248.0,城下之盟,ㄔㄥˊ　ㄒㄧㄚˋ　ㄓ　ㄇㄥˊ,chéng xià zhī méng
1249.0,弄璋之喜,ㄋㄨㄥˋ　ㄓㄤ　ㄓ　ㄒㄧˇ,nòng zhāng zhī xǐ 
1250.0,如虎添翼,ㄖㄨˊ　ㄏㄨˇ　ㄊㄧㄢ　ㄧˋ,rú hǔ tiān yì 
1251.0,叱吒風雲,ㄔˋ　ㄓㄚˋ　ㄈㄥ　ㄩㄣˊ,chì zhà fēng yún
1252.0,一朝一夕,ㄧ　ㄓㄠ　ㄧ　ㄒㄧˋ　（變）　ㄧˋ　ㄓㄠ　ㄧˊ　ㄒㄧˋ,yī zhāo yī xì （變） yì zhāo yí xì
1253.0,格殺勿論,ㄍㄜˊ　ㄕㄚ　ㄨˋ　ㄌㄨㄣˋ,gé shā wù lùn
1254.0,一場春夢,ㄧ　ㄔㄤˇ　ㄔㄨㄣ　ㄇㄥˋ,yī chǎng chūn mèng
1255.0,借題發揮,ㄐㄧㄝˋ　ㄊㄧˊ　ㄈㄚ　ㄏㄨㄟ,jiè tí fā huī
1256.0,英雄氣短,ㄧㄥ　ㄒㄩㄥˊ　ㄑㄧˋ　ㄉㄨㄢˇ,yīng xióng qì duǎn
1257.0,神出鬼沒,ㄕㄣˊ　ㄔㄨ　ㄍㄨㄟˇ　ㄇㄛˋ,shén chū guǐ mò
1258.0,高風亮節,ㄍㄠ　ㄈㄥ　ㄌㄧㄤˋ　ㄐㄧㄝˊ,gāo fēng liàng jié
1259.0,眉開眼笑,ㄇㄟˊ　ㄎㄞ　ㄧㄢˇ　ㄒㄧㄠˋ,méi kāi yǎn xiào
1260.0,寅吃卯糧,ㄧㄣˊ　ㄔ　ㄇㄠˇ　ㄌㄧㄤˊ,yín chī mǎo liáng
1261.0,涓滴歸公,ㄐㄩㄢ　ㄉㄧ　ㄍㄨㄟ　ㄍㄨㄥ,juān dī guī gōng
1262.0,根深蒂固,ㄍㄣ　ㄕㄣ　ㄉㄧˋ　ㄍㄨˋ,gēn shēn dì gù
1263.0,烽火連天,ㄈㄥ　ㄏㄨㄛˇ　ㄌㄧㄢˊ　ㄊㄧㄢ,fēng huǒ lián tiān
1264.0,望而卻步,ㄨㄤˋ　ㄦˊ　ㄑㄩㄝˋ　ㄅㄨˋ,wàng ér què bù
1265.0,一念之差,ㄧ　ㄋㄧㄢˋ　ㄓ　ㄔㄚ　（變）　ㄧˊ　ㄋㄧㄢˋ　ㄓ　ㄔㄚ,yī niàn zhī chā （變） yí niàn zhī chā
1266.0,同室操戈,ㄊㄨㄥˊ　ㄕˋ　ㄘㄠ　ㄍㄜ,tóng shì cāo gē
1267.0,率由舊章,ㄕㄨㄞˋ　ㄧㄡˊ　ㄐㄧㄡˋ　ㄓㄤ,shuài yóu jiù zhāng
1268.0,明眸皓齒,ㄇㄧㄥˊ　ㄇㄡˊ　ㄏㄠˋ　ㄔˇ,míng móu hào chǐ
1269.0,獨木難支,ㄉㄨˊ　ㄇㄨˋ　ㄋㄢˊ　ㄓ,dú mù nán zhī
1270.0,不時之需,ㄅㄨˋ　ㄕˊ　ㄓ　ㄒㄩ,bù shí zhī xū
1271.0,赤地千里,ㄔˋ　ㄉㄧˋ　ㄑㄧㄢ　ㄌㄧˇ,chì dì qiān lǐ
1272.0,貪贓枉法,ㄊㄢ　ㄗㄤ　ㄨㄤˇ　ㄈㄚˇ,tān zāng wǎng fǎ
1273.0,逍遙法外,ㄒㄧㄠ　ㄧㄠˊ　ㄈㄚˇ　ㄨㄞˋ,xiāo yáo fǎ wài
1274.0,長驅直入,ㄔㄤˊ　ㄑㄩ　ㄓˊ　ㄖㄨˋ,cháng qū zhí rù
1275.0,見仁見智,ㄐㄧㄢˋ　ㄖㄣˊ　ㄐㄧㄢˋ　ㄓˋ,jiàn rén jiàn zhì
1276.0,博古通今,ㄅㄛˊ　ㄍㄨˇ　ㄊㄨㄥ　ㄐㄧㄣ,bó gǔ tōng jīn
1277.0,欺世盜名,ㄑㄧ　ㄕˋ　ㄉㄠˋ　ㄇㄧㄥˊ,qī shì dào míng
1278.0,惱羞成怒,ㄋㄠˇ　ㄒㄧㄡ　ㄔㄥˊ　ㄋㄨˋ,nǎo xiū chéng nù
1279.0,椎心泣血,ㄓㄨㄟ　ㄒㄧㄣ　ㄑㄧˋ　ㄒㄧㄝˇ,zhuī xīn qì xiě
1280.0,驚濤駭浪,ㄐㄧㄥ　ㄊㄠˊ　ㄏㄞˋ　ㄌㄤˋ,jīng táo hài làng
1281.0,鞭辟入裡,ㄅㄧㄢ　ㄅㄧˋ　ㄖㄨˋ　ㄌㄧˇ,biān bì rù lǐ 
1282.0,一團和氣,ㄧ　ㄊㄨㄢˊ　ㄏㄜˊ　ㄑㄧˋ　（變）　ㄧˋ　ㄊㄨㄢˊ　ㄏㄜˊ　ㄑㄧˋ,yī tuán hé qì （變） yì tuán hé qì
1283.0,傷天害理,ㄕㄤ　ㄊㄧㄢ　ㄏㄞˋ　ㄌㄧˇ,shāng tiān hài lǐ
1284.0,明鏡高懸,ㄇㄧㄥˊ　ㄐㄧㄥˋ　ㄍㄠ　ㄒㄩㄢˊ,míng jìng gāo xuán
1285.0,高山流水,ㄍㄠ　ㄕㄢ　ㄌㄧㄡˊ　ㄕㄨㄟˇ,gāo shān liú shuǐ
1286.0,花團錦簇,ㄏㄨㄚ　ㄊㄨㄢˊ　ㄐㄧㄣˇ　ㄘㄨˋ,huā tuán jǐn cù
1287.0,不二法門,ㄅㄨˋ　ㄦˋ　ㄈㄚˇ　ㄇㄣˊ　（變）　ㄅㄨˊ　ㄦˋ　ㄈㄚˇ　ㄇㄣˊ,bù èr fǎ mén （變） bú èr fǎ mén
1288.0,無懈可擊,ㄨˊ　ㄒㄧㄝˋ　ㄎㄜˇ　ㄐㄧˊ,wú xiè kě jí
1289.0,大書特書,ㄉㄚˋ　ㄕㄨ　ㄊㄜˋ　ㄕㄨ,dà shū tè shū
1290.0,亡命之徒,ㄨㄤˊ　ㄇㄧㄥˋ　ㄓ　ㄊㄨˊ,wáng mìng zhī tú
1291.0,兔死狐悲,ㄊㄨˋ　ㄙˇ　ㄏㄨˊ　ㄅㄟ,tù sǐ hú bēi
1292.0,感激涕零,ㄍㄢˇ　ㄐㄧ　ㄊㄧˋ　ㄌㄧㄥˊ,gǎn jī tì líng
1293.0,赤手空拳,ㄔˋ　ㄕㄡˇ　ㄎㄨㄥ　ㄑㄩㄢˊ,chì shǒu kōng quán
1294.0,拍案叫絕,ㄆㄞ　ㄢˋ　ㄐㄧㄠˋ　ㄐㄩㄝˊ,pāi àn jiào jué
1295.0,別有天地,ㄅㄧㄝˊ　ㄧㄡˇ　ㄊㄧㄢ　ㄉㄧˋ,bié yǒu tiān dì
1296.0,遇人不淑,ㄩˋ　ㄖㄣˊ　ㄅㄨˋ　ㄕㄨˊ,yù rén bù shú 
1297.0,暗度陳倉,ㄢˋ　ㄉㄨˋ　ㄔㄣˊ　ㄘㄤ,àn dù chén cāng
1298.0,耳目一新,ㄦˇ　ㄇㄨˋ　ㄧ　ㄒㄧㄣ　（變）　ㄦˇ　ㄇㄨˋ　ㄧˋ　ㄒㄧㄣ,ěr mù yī xīn （變） ěr mù yì xīn
1299.0,當務之急,ㄉㄤ　ㄨˋ　ㄓ　ㄐㄧˊ,dāng wù zhī jí
1300.0,福至心靈,ㄈㄨˊ　ㄓˋ　ㄒㄧㄣ　ㄌㄧㄥˊ,fú zhì xīn líng
1301.0,衣冠禽獸,ㄧ　ㄍㄨㄢ　ㄑㄧㄣˊ　ㄕㄡˋ,yī guān qín shòu
1302.0,死心塌地,ㄙˇ　ㄒㄧㄣ　ㄊㄚ　ㄉㄧˋ,sǐ xīn tā dì
1303.0,新陳代謝,ㄒㄧㄣ　ㄔㄣˊ　ㄉㄞˋ　ㄒㄧㄝˋ,xīn chén dài xiè
1304.0,搖旗吶喊,ㄧㄠˊ　ㄑㄧˊ　ㄋㄚˋ　ㄏㄢˇ,yáo qí nà hǎn
1305.0,搖搖欲墜,ㄧㄠˊ　ㄧㄠˊ　ㄩˋ　ㄓㄨㄟˋ,yáo yáo yù zhuì
1306.0,有教無類,ㄧㄡˇ　ㄐㄧㄠˋ　ㄨˊ　ㄌㄟˋ,yǒu jiào wú lèi
1307.0,有名無實,ㄧㄡˇ　ㄇㄧㄥˊ　ㄨˊ　ㄕˊ,yǒu míng wú shí
1308.0,槁木死灰,ㄍㄠˇ　ㄇㄨˋ　ㄙˇ　ㄏㄨㄟ,gǎo mù sǐ huī
1309.0,有目共睹,ㄧㄡˇ　ㄇㄨˋ　ㄍㄨㄥˋ　ㄉㄨˇ,yǒu mù gòng dǔ
1310.0,慘不忍睹,ㄘㄢˇ　ㄅㄨˋ　ㄖㄣˇ　ㄉㄨˇ,cǎn bù rěn dǔ
1311.0,小巧玲瓏,ㄒㄧㄠˇ　ㄑㄧㄠˇ　ㄌㄧㄥˊ　ㄌㄨㄥˊ,xiǎo qiǎo líng lóng
1312.0,憐香惜玉,ㄌㄧㄢˊ　ㄒㄧㄤ　ㄒㄧˊ　ㄩˋ,lián xiāng xí yù 
1313.0,耳鬢廝磨,ㄦˇ　ㄅㄧㄣˋ　ㄙ　ㄇㄛˊ,ěr bìn sī mó
1314.0,寡不敵眾,ㄍㄨㄚˇ　ㄅㄨˋ　ㄉㄧˊ　ㄓㄨㄥˋ,guǎ bù dí zhòng
1315.0,語無倫次,ㄩˇ　ㄨˊ　ㄌㄨㄣˊ　ㄘˋ,yǔ wú lún cì
1316.0,寥寥無幾,ㄌㄧㄠˊ　ㄌㄧㄠˊ　ㄨˊ　ㄐㄧˇ,liáo liáo wú jǐ
1317.0,目瞪口呆,ㄇㄨˋ　ㄉㄥˋ　ㄎㄡˇ　ㄉㄞ,mù dèng kǒu dāi
1318.0,生殺予奪,ㄕㄥ　ㄕㄚ　ㄩˇ　ㄉㄨㄛˊ,shēng shā yǔ duó
1319.0,摩頂放踵,ㄇㄛˊ　ㄉㄧㄥˇ　ㄈㄤˇ　ㄓㄨㄥˇ,mó dǐng fǎng zhǒng 
1320.0,珠聯璧合,ㄓㄨ　ㄌㄧㄢˊ　ㄅㄧˋ　ㄏㄜˊ,zhū lián bì hé
1321.0,未卜先知,ㄨㄟˋ　ㄅㄨˇ　ㄒㄧㄢ　ㄓ,wèi bǔ xiān zhī
1322.0,火樹銀花,ㄏㄨㄛˇ　ㄕㄨˋ　ㄧㄣˊ　ㄏㄨㄚ,huǒ shù yín huā
1323.0,半推半就,ㄅㄢˋ　ㄊㄨㄟ　ㄅㄢˋ　ㄐㄧㄡˋ,bàn tuī bàn jiù
1324.0,平地風波,ㄆㄧㄥˊ　ㄉㄧˋ　ㄈㄥ　ㄅㄛ,píng dì fēng bō
1325.0,調虎離山,ㄉㄧㄠˋ　ㄏㄨˇ　ㄌㄧˊ　ㄕㄢ,diào hǔ lí shān
1326.0,瞠乎其後,ㄔㄥ　ㄏㄨ　ㄑㄧˊ　ㄏㄡˋ,chēng hū qí hòu
1327.0,天馬行空,ㄊㄧㄢ　ㄇㄚˇ　ㄒㄧㄥˊ　ㄎㄨㄥ,tiān mǎ xíng kōng
1328.0,烏煙瘴氣,ㄨ　ㄧㄢ　ㄓㄤˋ　ㄑㄧˋ,wū yān zhàng qì
1329.0,參差不齊,ㄘㄣ　ㄘ　ㄅㄨˋ　ㄑㄧˊ,cēn cī bù qí
1330.0,噬臍莫及,ㄕˋ　ㄑㄧˊ　ㄇㄛˋ　ㄐㄧˊ,shì qí mò jí
1331.0,賠了夫人又折兵,ㄆㄟˊ　˙ㄌㄜ　ㄈㄨ　ㄖㄣˊ　ㄧㄡˋ　ㄓㄜˊ　ㄅㄧㄥ,péi le fū rén yòu zhé bīng
1332.0,天誅地滅,ㄊㄧㄢ　ㄓㄨ　ㄉㄧˋ　ㄇㄧㄝˋ,tiān zhū dì miè
1333.0,天羅地網,ㄊㄧㄢ　ㄌㄨㄛˊ　ㄉㄧˋ　ㄨㄤˇ,tiān luó dì wǎng
1334.0,龍蟠虎踞,ㄌㄨㄥˊ　ㄆㄢˊ　ㄏㄨˇ　ㄐㄩˋ,lóng pán hǔ jù
1335.0,切膚之痛,ㄑㄧㄝˋ　ㄈㄨ　ㄓ　ㄊㄨㄥˋ,qiè fū zhī tòng
1336.0,手忙腳亂,ㄕㄡˇ　ㄇㄤˊ　ㄐㄧㄠˇ　ㄌㄨㄢˋ,shǒu máng jiǎo luàn
1337.0,聳人聽聞,ㄙㄨㄥˇ　ㄖㄣˊ　ㄊㄧㄥ　ㄨㄣˊ,sǒng rén tīng wén
1338.0,一五一十,ㄧ　ㄨˇ　ㄧ　ㄕˊ,yī wǔ yī shí
1339.0,氣宇軒昂,ㄑㄧˋ　ㄩˇ　ㄒㄩㄢ　ㄤˊ,qì yǔ xuān áng
1340.0,隱惡揚善,ㄧㄣˇ　ㄜˋ　ㄧㄤˊ　ㄕㄢˋ,yǐn è yáng shàn
1341.0,軒然大波,ㄒㄩㄢ　ㄖㄢˊ　ㄉㄚˋ　ㄅㄛ,xuān rán dà bō
1342.0,出口成章,ㄔㄨ　ㄎㄡˇ　ㄔㄥˊ　ㄓㄤ,chū kǒu chéng zhāng
1343.0,雞皮鶴髮,ㄐㄧ　ㄆㄧˊ　ㄏㄜˋ　ㄈㄚˇ,jī pí hè fǎ
1344.0,人去樓空,ㄖㄣˊ　ㄑㄩˋ　ㄌㄡˊ　ㄎㄨㄥ,rén qù lóu kōng
1345.0,三頭六臂,ㄙㄢ　ㄊㄡˊ　ㄌㄧㄡˋ　ㄅㄧˋ,sān tóu liù bì
1346.0,出水芙蓉,ㄔㄨ　ㄕㄨㄟˇ　ㄈㄨˊ　ㄖㄨㄥˊ,chū shuǐ fú róng
1347.0,觸景生情,ㄔㄨˋ　ㄐㄧㄥˇ　ㄕㄥ　ㄑㄧㄥˊ,chù jǐng shēng qíng
1348.0,黃袍加身,ㄏㄨㄤˊ　ㄆㄠˊ　ㄐㄧㄚ　ㄕㄣ,huáng páo jiā shēn
1349.0,一箭雙雕,ㄧ　ㄐㄧㄢˋ　ㄕㄨㄤ　ㄉㄧㄠ　（變）　ㄧˊ　ㄐㄧㄢˋ　ㄕㄨㄤ　ㄉㄧㄠ,yī jiàn shuāng diāo （變） yí jiàn shuāng diāo
1350.0,三寸不爛之舌,ㄙㄢ　ㄘㄨㄣˋ　ㄅㄨˋ　ㄌㄢˋ　ㄓ　ㄕㄜˊ　（變）　ㄙㄢ　ㄘㄨㄣˋ　ㄅㄨˊ　ㄌㄢˋ　ㄓ　ㄕㄜˊ,sān cùn bù làn zhī shé （變） sān cùn bú làn zhī shé
1351.0,捨本逐末,ㄕㄜˇ　ㄅㄣˇ　ㄓㄨˊ　ㄇㄛˋ,shě běn zhú mò
1352.0,一心一意,ㄧ　ㄒㄧㄣ　ㄧ　ㄧˋ　（變）　ㄧˋ　ㄒㄧㄣ　ㄧˊ　ㄧˋ,yī xīn yī yì （變） yì xīn yí yì
1353.0,韋編三絕,ㄨㄟˊ　ㄅㄧㄢ　ㄙㄢ　ㄐㄩㄝˊ,wéi biān sān jué
1354.0,一了百了,ㄧ　ㄌㄧㄠˇ　ㄅㄞˇ　ㄌㄧㄠˇ　（變）　ㄧˋ　ㄌㄧㄠˇ　ㄅㄞˇ　ㄌㄧㄠˇ,yī liǎo bǎi liǎo （變） yì liǎo bǎi liǎo
1355.0,腰纏萬貫,ㄧㄠ　ㄔㄢˊ　ㄨㄢˋ　ㄍㄨㄢˋ,yāo chán wàn guàn
1356.0,額手稱慶,ㄜˊ　ㄕㄡˇ　ㄔㄥ　ㄑㄧㄥˋ,é shǒu chēng qìng
1357.0,一無所有,ㄧ　ㄨˊ　ㄙㄨㄛˇ　ㄧㄡˇ　（變）　ㄧˋ　ㄨˊ　ㄙㄨㄛˇ　ㄧㄡˇ,yī wú suǒ yǒu （變） yì wú suǒ yǒu
1358.0,文不對題,ㄨㄣˊ　ㄅㄨˋ　ㄉㄨㄟˋ　ㄊㄧˊ　（變）　ㄨㄣˊ　ㄅㄨˊ　ㄉㄨㄟˋ　ㄊㄧˊ,wén bù duì tí （變） wén bú duì tí
1359.0,心驚膽戰,ㄒㄧㄣ　ㄐㄧㄥ　ㄉㄢˇ　ㄓㄢˋ,xīn jīng dǎn zhàn
1360.0,水性楊花,ㄕㄨㄟˇ　ㄒㄧㄥˋ　ㄧㄤˊ　ㄏㄨㄚ,shuǐ xìng yáng huā 
1361.0,心煩意亂,ㄒㄧㄣ　ㄈㄢˊ　ㄧˋ　ㄌㄨㄢˋ,xīn fán yì luàn
1362.0,文不加點,ㄨㄣˊ　ㄅㄨˋ　ㄐㄧㄚ　ㄉㄧㄢˇ,wén bù jiā diǎn
1363.0,以貌取人,ㄧˇ　ㄇㄠˋ　ㄑㄩˇ　ㄖㄣˊ,yǐ mào qǔ rén
1364.0,寸步不離,ㄘㄨㄣˋ　ㄅㄨˋ　ㄅㄨˋ　ㄌㄧˊ,cùn bù bù lí
1365.0,大聲疾呼,ㄉㄚˋ　ㄕㄥ　ㄐㄧˊ　ㄏㄨ,dà shēng jí hū
1366.0,不置可否,ㄅㄨˋ　ㄓˋ　ㄎㄜˇ　ㄈㄡˇ　（變）　ㄅㄨˊ　ㄓˋ　ㄎㄜˇ　ㄈㄡˇ,bù zhì kě fǒu （變） bú zhì kě fǒu
1367.0,打退堂鼓,ㄉㄚˇ　ㄊㄨㄟˋ　ㄊㄤˊ　ㄍㄨˇ,dǎ tuì táng gǔ
1368.0,四通八達,ㄙˋ　ㄊㄨㄥ　ㄅㄚ　ㄉㄚˊ,sì tōng bā dá
1369.0,無妄之災,ㄨˊ　ㄨㄤˋ　ㄓ　ㄗㄞ,wú wàng zhī zāi
1370.0,甘之如飴,ㄍㄢ　ㄓ　ㄖㄨˊ　ㄧˊ,gān zhī rú yí
1371.0,不約而同,ㄅㄨˋ　ㄩㄝ　ㄦˊ　ㄊㄨㄥˊ,bù yuē ér tóng
1372.0,名韁利鎖,ㄇㄧㄥˊ　ㄐㄧㄤ　ㄌㄧˋ　ㄙㄨㄛˇ,míng jiāng lì suǒ
1373.0,付之一笑,ㄈㄨˋ　ㄓ　ㄧ　ㄒㄧㄠˋ　（變）　ㄈㄨˋ　ㄓ　ㄧˊ　ㄒㄧㄠˋ,fù zhī yī xiào （變） fù zhī yí xiào
1374.0,因小失大,ㄧㄣ　ㄒㄧㄠˇ　ㄕ　ㄉㄚˋ,yīn xiǎo shī dà
1375.0,因時制宜,ㄧㄣ　ㄕˊ　ㄓˋ　ㄧˊ,yīn shí zhì yí
1376.0,不識之無,ㄅㄨˋ　ㄕˋ　ㄓ　ㄨˊ　（變）　ㄅㄨˊ　ㄕˋ　ㄓ　ㄨˊ,bù shì zhī wú （變） bú shì zhī wú
1377.0,支吾其詞,ㄓ　ㄨˊ　ㄑㄧˊ　ㄘˊ,zhī wú qí cí
1378.0,禍不單行,ㄏㄨㄛˋ　ㄅㄨˋ　ㄉㄢ　ㄒㄧㄥˊ,huò bù dān xíng
1379.0,現身說法,ㄒㄧㄢˋ　ㄕㄣ　ㄕㄨㄛ　ㄈㄚˇ,xiàn shēn shuō fǎ
1380.0,設身處地,ㄕㄜˋ　ㄕㄣ　ㄔㄨˇ　ㄉㄧˋ,shè shēn chǔ dì
1381.0,光天化日,ㄍㄨㄤ　ㄊㄧㄢ　ㄏㄨㄚˋ　ㄖˋ,guāng tiān huà rì
1382.0,每況愈下,ㄇㄟˇ　ㄎㄨㄤˋ　ㄩˋ　ㄒㄧㄚˋ,měi kuàng yù xià
1383.0,鐘鳴鼎食,ㄓㄨㄥ　ㄇㄧㄥˊ　ㄉㄧㄥˇ　ㄕˊ,zhōng míng dǐng shí
1384.0,鐵石心腸,ㄊㄧㄝˇ　ㄕˊ　ㄒㄧㄣ　ㄔㄤˊ,tiě shí xīn cháng
1385.0,安身立命,ㄢ　ㄕㄣ　ㄌㄧˋ　ㄇㄧㄥˋ,ān shēn lì mìng
1386.0,安然無恙,ㄢ　ㄖㄢˊ　ㄨˊ　ㄧㄤˋ,ān rán wú yàng
1387.0,廬山真面目,ㄌㄨˊ　ㄕㄢ　ㄓㄣ　ㄇㄧㄢˋ　ㄇㄨˋ,lú shān zhēn miàn mù
1388.0,深思熟慮,ㄕㄣ　ㄙ　ㄕㄡˊ　ㄌㄩˋ,shēn sī shóu lǜ
1389.0,平分秋色,ㄆㄧㄥˊ　ㄈㄣ　ㄑㄧㄡ　ㄙㄜˋ,píng fēn qiū sè
1390.0,躍躍欲試,ㄩㄝˋ　ㄩㄝˋ　ㄩˋ　ㄕˋ,yuè yuè yù shì
1391.0,自強不息,ㄗˋ　ㄑㄧㄤˊ　ㄅㄨˋ　ㄒㄧˊ,zì qiáng bù xí
1392.0,掩人耳目,ㄧㄢˇ　ㄖㄣˊ　ㄦˇ　ㄇㄨˋ,yǎn rén ěr mù
1393.0,耳熟能詳,ㄦˇ　ㄕㄡˊ　ㄋㄥˊ　ㄒㄧㄤˊ,ěr shóu néng xiáng
1394.0,自食其力,ㄗˋ　ㄕˊ　ㄑㄧˊ　ㄌㄧˋ,zì shí qí lì
1395.0,老驥伏櫪,ㄌㄠˇ　ㄐㄧˋ　ㄈㄨˊ　ㄌㄧˋ,lǎo jì fú lì 
1396.0,行雲流水,ㄒㄧㄥˊ　ㄩㄣˊ　ㄌㄧㄡˊ　ㄕㄨㄟˇ,xíng yún liú shuǐ
1397.0,安分守己,ㄢ　ㄈㄣˋ　ㄕㄡˇ　ㄐㄧˇ,ān fèn shǒu jǐ
1398.0,瞠目結舌,ㄔㄥ　ㄇㄨˋ　ㄐㄧㄝˊ　ㄕㄜˊ,chēng mù jié shé
1399.0,臨深履薄,ㄌㄧㄣˊ　ㄕㄣ　ㄌㄩˇ　ㄅㄛˊ,lín shēn lǚ bó
1400.0,忍無可忍,ㄖㄣˇ　ㄨˊ　ㄎㄜˇ　ㄖㄣˇ,rěn wú kě rěn
1401.0,捷足先登,ㄐㄧㄝˊ　ㄗㄨˊ　ㄒㄧㄢ　ㄉㄥ,jié zú xiān dēng
1402.0,李代桃僵,ㄌㄧˇ　ㄉㄞˋ　ㄊㄠˊ　ㄐㄧㄤ,lǐ dài táo jiāng
1403.0,隱姓埋名,ㄧㄣˇ　ㄒㄧㄥˋ　ㄇㄞˊ　ㄇㄧㄥˊ,yǐn xìng mái míng
1404.0,輾轉反側,ㄓㄢˇ　ㄓㄨㄢˇ　ㄈㄢˇ　ㄘㄜˋ,zhǎn zhuǎn fǎn cè
1405.0,冷嘲熱諷,ㄌㄥˇ　ㄔㄠˊ　ㄖㄜˋ　ㄈㄥˋ,lěng cháo rè fèng
1406.0,張口結舌,ㄓㄤ　ㄎㄡˇ　ㄐㄧㄝˊ　ㄕㄜˊ,zhāng kǒu jié shé
1407.0,安如泰山,ㄢ　ㄖㄨˊ　ㄊㄞˋ　ㄕㄢ,ān rú tài shān
1408.0,百聞不如一見,ㄅㄞˇ　ㄨㄣˊ　ㄅㄨˋ　ㄖㄨˊ　ㄧ　ㄐㄧㄢˋ　（變）　ㄅㄞˇ　ㄨㄣˊ　ㄅㄨˋ　ㄖㄨˊ　ㄧˊ　ㄐㄧㄢˋ,bǎi wén bù rú yī jiàn （變） bǎi wén bù rú yí jiàn
1409.0,魂飛魄散,ㄏㄨㄣˊ　ㄈㄟ　ㄆㄛˋ　ㄙㄢˋ,hún fēi pò sàn
1410.0,細水長流,ㄒㄧˋ　ㄕㄨㄟˇ　ㄔㄤˊ　ㄌㄧㄡˊ,xì shuǐ cháng liú
1411.0,養尊處優,ㄧㄤˇ　ㄗㄨㄣ　ㄔㄨˇ　ㄧㄡ,yǎng zūn chǔ yōu
1412.0,難能可貴,ㄋㄢˊ　ㄋㄥˊ　ㄎㄜˇ　ㄍㄨㄟˋ,nán néng kě guì
1413.0,脫胎換骨,ㄊㄨㄛ　ㄊㄞ　ㄏㄨㄢˋ　ㄍㄨˇ,tuō tāi huàn gǔ
1414.0,奮不顧身,ㄈㄣˋ　ㄅㄨˋ　ㄍㄨˋ　ㄕㄣ　（變）　ㄈㄣˋ　ㄅㄨˊ　ㄍㄨˋ　ㄕㄣ,fèn bù gù shēn （變） fèn bú gù shēn
1415.0,身敗名裂,ㄕㄣ　ㄅㄞˋ　ㄇㄧㄥˊ　ㄌㄧㄝˋ,shēn bài míng liè
1416.0,潛移默化,ㄑㄧㄢˊ　ㄧˊ　ㄇㄛˋ　ㄏㄨㄚˋ,qián yí mò huà 
1417.0,捷足先得,ㄐㄧㄝˊ　ㄗㄨˊ　ㄒㄧㄢ　ㄉㄜˊ,jié zú xiān dé
1418.0,輕而易舉,ㄑㄧㄥ　ㄦˊ　ㄧˋ　ㄐㄩˇ,qīng ér yì jǔ
1419.0,漠不關心,ㄇㄛˋ　ㄅㄨˋ　ㄍㄨㄢ　ㄒㄧㄣ,mò bù guān xīn
1420.0,笑逐顏開,ㄒㄧㄠˋ　ㄓㄨˊ　ㄧㄢˊ　ㄎㄞ,xiào zhú yán kāi
1421.0,牛衣對泣,ㄋㄧㄡˊ　ㄧ　ㄉㄨㄟˋ　ㄑㄧˋ,niú yī duì qì
1422.0,舞文弄墨,ㄨˇ　ㄨㄣˊ　ㄋㄨㄥˋ　ㄇㄛˋ,wǔ wén nòng mò
1423.0,披肝瀝膽,ㄆㄧ　ㄍㄢ　ㄌㄧˋ　ㄉㄢˇ,pī gān lì dǎn
1424.0,事與願違,ㄕˋ　ㄩˇ　ㄩㄢˋ　ㄨㄟˊ,shì yǔ yuàn wéi
1425.0,暢所欲言,ㄔㄤˋ　ㄙㄨㄛˇ　ㄩˋ　ㄧㄢˊ,chàng suǒ yù yán
1426.0,目不見睫,ㄇㄨˋ　ㄅㄨˋ　ㄐㄧㄢˋ　ㄐㄧㄝˊ　（變）　ㄇㄨˋ　ㄅㄨˊ　ㄐㄧㄢˋ　ㄐㄧㄝˊ,mù bù jiàn jié （變） mù bú jiàn jié
1427.0,兩面三刀,ㄌㄧㄤˇ　ㄇㄧㄢˋ　ㄙㄢ　ㄉㄠ,liǎng miàn sān dāo
1428.0,拋頭露面,ㄆㄠ　ㄊㄡˊ　ㄌㄨˋ　ㄇㄧㄢˋ,pāo tóu lù miàn 
1429.0,雨後春筍,ㄩˇ　ㄏㄡˋ　ㄔㄨㄣ　ㄙㄨㄣˇ,yǔ hòu chūn sǔn
1430.0,盡忠報國,ㄐㄧㄣˋ　ㄓㄨㄥ　ㄅㄠˋ　ㄍㄨㄛˊ,jìn zhōng bào guó 
1431.0,金城湯池,ㄐㄧㄣ　ㄔㄥˊ　ㄊㄤ　ㄔˊ,jīn chéng tāng chí
1432.0,戮力同心,ㄌㄨˋ　ㄌㄧˋ　ㄊㄨㄥˊ　ㄒㄧㄣ,lù lì tóng xīn
1433.0,枉費心機,ㄨㄤˇ　ㄈㄟˋ　ㄒㄧㄣ　ㄐㄧ,wǎng fèi xīn jī
1434.0,輕車熟路,ㄑㄧㄥ　ㄐㄩ　ㄕㄡˊ　ㄌㄨˋ,qīng jū shóu lù
1435.0,以毒攻毒,ㄧˇ　ㄉㄨˊ　ㄍㄨㄥ　ㄉㄨˊ,yǐ dú gōng dú
1436.0,目無全牛,ㄇㄨˋ　ㄨˊ　ㄑㄩㄢˊ　ㄋㄧㄡˊ,mù wú quán niú
1437.0,金戈鐵馬,ㄐㄧㄣ　ㄍㄜ　ㄊㄧㄝˇ　ㄇㄚˇ,jīn gē tiě mǎ
1438.0,近水樓臺,ㄐㄧㄣˋ　ㄕㄨㄟˇ　ㄌㄡˊ　ㄊㄞˊ,jìn shuǐ lóu tái
1439.0,四分五裂,ㄙˋ　ㄈㄣ　ㄨˇ　ㄌㄧㄝˋ,sì fēn wǔ liè
1440.0,壽比南山,ㄕㄡˋ　ㄅㄧˇ　ㄋㄢˊ　ㄕㄢ,shòu bǐ nán shān
1441.0,美中不足,ㄇㄟˇ　ㄓㄨㄥ　ㄅㄨˋ　ㄗㄨˊ,měi zhōng bù zú
1442.0,枯木逢春,ㄎㄨ　ㄇㄨˋ　ㄈㄥˊ　ㄔㄨㄣ,kū mù féng chūn
1443.0,腹背受敵,ㄈㄨˋ　ㄅㄟˋ　ㄕㄡˋ　ㄉㄧˊ,fù bèi shòu dí
1444.0,過猶不及,ㄍㄨㄛˋ　ㄧㄡˊ　ㄅㄨˋ　ㄐㄧˊ,guò yóu bù jí
1445.0,咬牙切齒,ㄧㄠˇ　ㄧㄚˊ　ㄑㄧㄝˋ　ㄔˇ,yǎo yá qiè chǐ
1446.0,威風凜凜,ㄨㄟ　ㄈㄥ　ㄌㄧㄣˇ　ㄌㄧㄣˇ,wēi fēng lǐn lǐn
1447.0,身無長物,ㄕㄣ　ㄨˊ　ㄓㄤˋ　ㄨˋ,shēn wú zhàng wù
1448.0,裝模作樣,ㄓㄨㄤ　ㄇㄛˊ　ㄗㄨㄛˋ　ㄧㄤˋ,zhuāng mó zuò yàng
1449.0,裝腔作勢,ㄓㄨㄤ　ㄑㄧㄤ　ㄗㄨㄛˋ　ㄕˋ,zhuāng qiāng zuò shì
1450.0,愁眉苦臉,ㄔㄡˊ　ㄇㄟˊ　ㄎㄨˇ　ㄌㄧㄢˇ,chóu méi kǔ liǎn
1451.0,枵腹從公,ㄒㄧㄠ　ㄈㄨˋ　ㄘㄨㄥˊ　ㄍㄨㄥ,xiāo fù cóng gōng
1452.0,入室操戈,ㄖㄨˋ　ㄕˋ　ㄘㄠ　ㄍㄜ,rù shì cāo gē
1453.0,趁火打劫,ㄔㄣˋ　ㄏㄨㄛˇ　ㄉㄚˇ　ㄐㄧㄝˊ,chèn huǒ dǎ jié
