編號,成語,注音,漢語拼音
2337.0,擲鼠忌器,ㄓˊ　ㄕㄨˇ　ㄐㄧˋ　ㄑㄧˋ,zhí shǔ jì qì
2338.0,換日偷天,ㄏㄨㄢˋ　ㄖˋ　ㄊㄡ　ㄊㄧㄢ,huàn rì tōu tiān
2339.0,盛氣臨人,ㄕㄥˋ　ㄑㄧˋ　ㄌㄧㄣˊ　ㄖㄣˊ,shèng qì lín rén
2340.0,日新月盛,ㄖˋ　ㄒㄧㄣ　ㄩㄝˋ　ㄕㄥˋ,rì xīn yuè shèng
2341.0,蹈矩循規,ㄉㄠˋ　ㄐㄩˇ　ㄒㄩㄣˊ　ㄍㄨㄟ,dào jǔ xún guī
2342.0,另開生面,ㄌㄧㄥˋ　ㄎㄞ　ㄕㄥ　ㄇㄧㄢˋ,lìng kāi shēng miàn
2343.0,未知所措,ㄨㄟˋ　ㄓ　ㄙㄨㄛˇ　ㄘㄨㄛˋ,wèi zhī suǒ cuò
2344.0,足高氣揚,ㄗㄨˊ　ㄍㄠ　ㄑㄧˋ　ㄧㄤˊ,zú gāo qì yáng
2345.0,另眼相待,ㄌㄧㄥˋ　ㄧㄢˇ　ㄒㄧㄤ　ㄉㄞˋ,lìng yǎn xiāng dài
2346.0,蹈湯赴火,ㄉㄠˋ　ㄊㄤ　ㄈㄨˋ　ㄏㄨㄛˇ,dào tāng fù huǒ
2347.0,聽天任命,ㄊㄧㄥˋ　ㄊㄧㄢ　ㄖㄣˋ　ㄇㄧㄥˋ,tìng tiān rèn mìng
2348.0,目牛無全,ㄇㄨˋ　ㄋㄧㄡˊ　ㄨˊ　ㄑㄩㄢˊ,mù niú wú quán
2349.0,目空四海,ㄇㄨˋ　ㄎㄨㄥ　ㄙˋ　ㄏㄞˇ,mù kōng sì hǎi
2350.0,足食豐衣,ㄗㄨˊ　ㄕˊ　ㄈㄥ　ㄧ,zú shí fēng yī
2351.0,星羅雲布,ㄒㄧㄥ　ㄌㄨㄛˊ　ㄩㄣˊ　ㄅㄨˋ,xīng luó yún bù
2352.0,易俗移風,ㄧˋ　ㄙㄨˊ　ㄧˊ　ㄈㄥ,yì sú yí fēng
2353.0,目睜口呆,ㄇㄨˋ　ㄓㄥ　ㄎㄡˇ　ㄉㄞ,mù zhēng kǒu dāi
2354.0,星移物換,ㄒㄧㄥ　ㄧˊ　ㄨˋ　ㄏㄨㄢˋ,xīng yí wù huàn
2355.0,易如翻掌,ㄧˋ　ㄖㄨˊ　ㄈㄢ　ㄓㄤˇ,yì rú fān zhǎng
2356.0,目空一世,ㄇㄨˋ　ㄎㄨㄥ　ㄧ　ㄕˋ　（變）　ㄇㄨˋ　ㄎㄨㄥ　ㄧˊ　ㄕˋ,mù kōng yī shì （變） mù kōng yí shì
2357.0,唾手可取,ㄊㄨㄛˋ　ㄕㄡˇ　ㄎㄜˇ　ㄑㄩˇ,tuò shǒu kě qǔ
2358.0,回生起死,ㄏㄨㄟˊ　ㄕㄥ　ㄑㄧˇ　ㄙˇ,huí shēng qǐ sǐ
2359.0,跋扈飛揚,ㄅㄚˊ　ㄏㄨˋ　ㄈㄟ　ㄧㄤˊ,bá hù fēi yáng
2360.0,顧後瞻前,ㄍㄨˋ　ㄏㄡˋ　ㄓㄢ　ㄑㄧㄢˊ,gù hòu zhān qián
2361.0,薪桂米珠,ㄒㄧㄣ　ㄍㄨㄟˋ　ㄇㄧˇ　ㄓㄨ,xīn guì mǐ zhū
2362.0,噬臍無及,ㄕˋ　ㄑㄧˊ　ㄨˊ　ㄐㄧˊ,shì qí wú jí
2363.0,膠柱調瑟,ㄐㄧㄠ　ㄓㄨˋ　ㄊㄧㄠˊ　ㄙㄜˋ,jiāo zhù tiáo sè
2364.0,換骨脫胎,ㄏㄨㄢˋ　ㄍㄨˇ　ㄊㄨㄛ　ㄊㄞ,huàn gǔ tuō tāi
2365.0,明珠入掌,ㄇㄧㄥˊ　ㄓㄨ　ㄖㄨˋ　ㄓㄤˇ,míng zhū rù zhǎng
2366.0,吹毛求瑕,ㄔㄨㄟ　ㄇㄠˊ　ㄑㄧㄡˊ　ㄒㄧㄚˊ,chuī máo qiú xiá
2367.0,璧合珠連,ㄅㄧˋ　ㄏㄜˊ　ㄓㄨ　ㄌㄧㄢˊ,bì hé zhū lián
2368.0,嘯吒風雲,ㄒㄧㄠˋ　ㄓㄚˋ　ㄈㄥ　ㄩㄣˊ,xiào zhà fēng yún
2369.0,口似懸河,ㄎㄡˇ　ㄙˋ　ㄒㄩㄢˊ　ㄏㄜˊ,kǒu sì xuán hé
2370.0,黷武窮兵,ㄉㄨˊ　ㄨˇ　ㄑㄩㄥˊ　ㄅㄧㄥ,dú wǔ qióng bīng
2371.0,剛褊自用,ㄍㄤ　ㄅㄧㄢˇ　ㄗˋ　ㄩㄥˋ,gāng biǎn zì yòng
2372.0,整襟危坐,ㄓㄥˇ　ㄐㄧㄣ　ㄨㄟˊ　ㄗㄨㄛˋ,zhěng jīn wéi zuò
2373.0,隳肝瀝膽,ㄏㄨㄟ　ㄍㄢ　ㄌㄧˋ　ㄉㄢˇ,huī gān lì dǎn
2374.0,陸離光怪,ㄌㄨˋ　ㄌㄧˊ　ㄍㄨㄤ　ㄍㄨㄞˋ,lù lí guāng guài
2375.0,見慣司空,ㄐㄧㄢˋ　ㄍㄨㄢˋ　ㄙ　ㄎㄨㄥ,jiàn guàn sī kōng
2376.0,隨波漂流,ㄙㄨㄟˊ　ㄅㄛ　ㄆㄧㄠ　ㄌㄧㄡˊ,suí bō piāo liú
2377.0,風馬不接,ㄈㄥ　ㄇㄚˇ　ㄅㄨˋ　ㄐㄧㄝ,fēng mǎ bù jiē
2378.0,鳳舞龍飛,ㄈㄥˋ　ㄨˇ　ㄌㄨㄥˊ　ㄈㄟ,fèng wǔ lóng fēi
2379.0,夙夜不懈,ㄙㄨˋ　ㄧㄝˋ　ㄅㄨˋ　ㄒㄧㄝˋ　（變）　ㄙㄨˋ　ㄧㄝˋ　ㄅㄨˊ　ㄒㄧㄝˋ,sù yè bù xiè （變） sù yè bú xiè
2380.0,反掌之易,ㄈㄢˇ　ㄓㄤˇ　ㄓ　ㄧˋ,fǎn zhǎng zhī yì
2381.0,風行雷厲,ㄈㄥ　ㄒㄧㄥˊ　ㄌㄟˊ　ㄌㄧˋ,fēng xíng léi lì
2382.0,隨寓而安,ㄙㄨㄟˊ　ㄩˋ　ㄦˊ　ㄢ,suí yù ér ān
2383.0,履薄臨深,ㄌㄩˇ　ㄅㄛˊ　ㄌㄧㄣˊ　ㄕㄣ,lǚ bó lín shēn
2384.0,氣忍聲吞,ㄑㄧˋ　ㄖㄣˇ　ㄕㄥ　ㄊㄨㄣ,qì rěn shēng tūn
2385.0,八兩半斤,ㄅㄚ　ㄌㄧㄤˇ　ㄅㄢˋ　ㄐㄧㄣ,bā liǎng bàn jīn
2386.0,居安慮危,ㄐㄩ　ㄢ　ㄌㄩˋ　ㄨㄟˊ,jū ān lǜ wéi
2387.0,人不聊生,ㄖㄣˊ　ㄅㄨˋ　ㄌㄧㄠˊ　ㄕㄥ,rén bù liáo shēng
2388.0,氣壓山河,ㄑㄧˋ　ㄧㄚ　ㄕㄢ　ㄏㄜˊ,qì yā shān hé
2389.0,公正無私,ㄍㄨㄥ　ㄓㄥˋ　ㄨˊ　ㄙ,gōng zhèng wú sī
2390.0,懸河注水,ㄒㄩㄢˊ　ㄏㄜˊ　ㄓㄨˋ　ㄕㄨㄟˇ,xuán hé zhù shuǐ
2391.0,首施兩端,ㄕㄡˇ　ㄕ　ㄌㄧㄤˇ　ㄉㄨㄢ,shǒu shī liǎng duān
2392.0,八門五花,ㄅㄚ　ㄇㄣˊ　ㄨˇ　ㄏㄨㄚ,bā mén wǔ huā
2393.0,脫殼金蟬,ㄊㄨㄛ　ㄎㄜˊ　ㄐㄧㄣ　ㄔㄢˊ,tuō ké jīn chán
2394.0,拿腔作勢,ㄋㄚˊ　ㄑㄧㄤ　ㄗㄨㄛˋ　ㄕˋ,ná qiāng zuò shì
2395.0,盡美盡善,ㄐㄧㄣˋ　ㄇㄟˇ　ㄐㄧㄣˋ　ㄕㄢˋ,jìn měi jìn shàn
2396.0,眾盲摸象,ㄓㄨㄥˋ　ㄇㄤˊ　ㄇㄛ　ㄒㄧㄤˋ,zhòng máng mō xiàng
2397.0,貪贓壞法,ㄊㄢ　ㄗㄤ　ㄏㄨㄞˋ　ㄈㄚˇ,tān zāng huài fǎ
2398.0,臥旗息鼓,ㄨㄛˋ　ㄑㄧˊ　ㄒㄧˊ　ㄍㄨˇ,wò qí xí gǔ
2399.0,眾望所依,ㄓㄨㄥˋ　ㄨㄤˋ　ㄙㄨㄛˇ　ㄧ,zhòng wàng suǒ yī
2400.0,氣壯河山,ㄑㄧˋ　ㄓㄨㄤˋ　ㄏㄜˊ　ㄕㄢ,qì zhuàng hé shān
2401.0,樂而忘歸,ㄌㄜˋ　ㄦˊ　ㄨㄤˋ　ㄍㄨㄟ,lè ér wàng guī
2402.0,後來之秀,ㄏㄡˋ　ㄌㄞˊ　ㄓ　ㄒㄧㄡˋ,hòu lái zhī xiù
2403.0,錯節盤根,ㄘㄨㄛˋ　ㄐㄧㄝˊ　ㄆㄢˊ　ㄍㄣ,cuò jié pán gēn
2404.0,罔知所措,ㄨㄤˇ　ㄓ　ㄙㄨㄛˇ　ㄘㄨㄛˋ,wǎng zhī suǒ cuò
2405.0,合浦還珠,ㄏㄜˊ　ㄆㄨˇ　ㄏㄨㄢˊ　ㄓㄨ,hé pǔ huán zhū
2406.0,從風而靡,ㄘㄨㄥˊ　ㄈㄥ　ㄦˊ　ㄇㄧˇ,cóng fēng ér mǐ
2407.0,眾望攸歸,ㄓㄨㄥˋ　ㄨㄤˋ　ㄧㄡ　ㄍㄨㄟ,zhòng wàng yōu guī
2408.0,當門對戶,ㄉㄤ　ㄇㄣˊ　ㄉㄨㄟˋ　ㄏㄨˋ,dāng mén duì hù
2409.0,針芥相投,ㄓㄣ　ㄐㄧㄝˋ　ㄒㄧㄤ　ㄊㄡˊ,zhēn jiè xiāng tóu
2410.0,鐵心石腸,ㄊㄧㄝˇ　ㄒㄧㄣ　ㄕˊ　ㄔㄤˊ,tiě xīn shí cháng
2411.0,鐵馬金戈,ㄊㄧㄝˇ　ㄇㄚˇ　ㄐㄧㄣ　ㄍㄜ,tiě mǎ jīn gē
2412.0,繁文縟禮,ㄈㄢˊ　ㄨㄣˊ　ㄖㄨˋ　ㄌㄧˇ,fán wén rù lǐ
2413.0,少不經事,ㄕㄠˋ　ㄅㄨˋ　ㄐㄧㄥ　ㄕˋ,shào bù jīng shì
2414.0,矯枉過直,ㄐㄧㄠˇ　ㄨㄤˇ　ㄍㄨㄛˋ　ㄓˊ,jiǎo wǎng guò zhí
2415.0,矯枉過中,ㄐㄧㄠˇ　ㄨㄤˇ　ㄍㄨㄛˋ　ㄓㄨㄥ,jiǎo wǎng guò zhōng
2416.0,矯邪歸正,ㄐㄧㄠˇ　ㄒㄧㄝˊ　ㄍㄨㄟ　ㄓㄥˋ,jiǎo xié guī zhèng
2417.0,含血噀人,ㄏㄢˊ　ㄒㄧㄝˇ　ㄒㄩㄣˋ　ㄖㄣˊ,hán xiě xùn rén
2418.0,憤氣填膺,ㄈㄣˋ　ㄑㄧˋ　ㄊㄧㄢˊ　ㄧㄥ,fèn qì tián yīng
2419.0,爛額焦頭,ㄌㄢˋ　ㄜˊ　ㄐㄧㄠ　ㄊㄡˊ,làn é jiāo tóu
2420.0,悅近來遠,ㄩㄝˋ　ㄐㄧㄣˋ　ㄌㄞˊ　ㄩㄢˇ,yuè jìn lái yuǎn
2421.0,半路修行,ㄅㄢˋ　ㄌㄨˋ　ㄒㄧㄡ　ㄒㄧㄥˊ,bàn lù xiū xíng
2422.0,燒眉之急,ㄕㄠ　ㄇㄟˊ　ㄓ　ㄐㄧˊ,shāo méi zhī jí
2423.0,舍本事末,ㄕㄜˇ　ㄅㄣˇ　ㄕˋ　ㄇㄛˋ,shě běn shì mò
2424.0,情不自勝,ㄑㄧㄥˊ　ㄅㄨˋ　ㄗˋ　ㄕㄥ　（變）　ㄑㄧㄥˊ　ㄅㄨˊ　ㄗˋ　ㄕㄥ,qíng bù zì shēng （變） qíng bú zì shēng
2425.0,火樹琪花,ㄏㄨㄛˇ　ㄕㄨˋ　ㄑㄧˊ　ㄏㄨㄚ,huǒ shù qí huā
2426.0,炎涼世態,ㄧㄢˊ　ㄌㄧㄤˊ　ㄕˋ　ㄊㄞˋ,yán liáng shì tài
2427.0,獸心人面,ㄕㄡˋ　ㄒㄧㄣ　ㄖㄣˊ　ㄇㄧㄢˋ,shòu xīn rén miàn
2428.0,恂恂善誘,ㄒㄩㄣˊ　ㄒㄩㄣˊ　ㄕㄢˋ　ㄧㄡˋ,xún xún shàn yòu
2429.0,卷旗息鼓,ㄐㄩㄢˇ　ㄑㄧˊ　ㄒㄧˊ　ㄍㄨˇ,juǎn qí xí gǔ
2430.0,嘗膽臥薪,ㄔㄤˊ　ㄉㄢˇ　ㄨㄛˋ　ㄒㄧㄣ,cháng dǎn wò xīn
2431.0,情投意洽,ㄑㄧㄥˊ　ㄊㄡˊ　ㄧˋ　ㄑㄧㄚˋ,qíng tóu yì qià
2432.0,兵不厭權,ㄅㄧㄥ　ㄅㄨˋ　ㄧㄢˋ　ㄑㄩㄢˊ　（變）　ㄅㄧㄥ　ㄅㄨˊ　ㄧㄢˋ　ㄑㄩㄢˊ,bīng bù yàn quán （變） bīng bú yàn quán
2433.0,釣名欺世,ㄉㄧㄠˋ　ㄇㄧㄥˊ　ㄑㄧ　ㄕˋ,diào míng qī shì
2434.0,樂禍幸災,ㄌㄜˋ　ㄏㄨㄛˋ　ㄒㄧㄥˋ　ㄗㄞ,lè huò xìng zāi
2435.0,大逆無道,ㄉㄚˋ　ㄋㄧˋ　ㄨˊ　ㄉㄠˋ,dà nì wú dào
2436.0,風馳電逝,ㄈㄥ　ㄔˊ　ㄉㄧㄢˋ　ㄕˋ,fēng chí diàn shì
2437.0,無脛而行,ㄨˊ　ㄐㄧㄥˋ　ㄦˊ　ㄒㄧㄥˊ,wú jìng ér xíng
2438.0,瓦解冰銷,ㄨㄚˇ　ㄐㄧㄝˇ　ㄅㄧㄥ　ㄒㄧㄠ,wǎ jiě bīng xiāo
2439.0,秀外惠中,ㄒㄧㄡˋ　ㄨㄞˋ　ㄏㄨㄟˋ　ㄓㄨㄥ,xiù wài huì zhōng
2440.0,國色天姿,ㄍㄨㄛˊ　ㄙㄜˋ　ㄊㄧㄢ　ㄗ,guó sè tiān zī
2441.0,如芒刺背,ㄖㄨˊ　ㄇㄤˊ　ㄘˋ　ㄅㄟˋ,rú máng cì bèi
2442.0,拔群出類,ㄅㄚˊ　ㄑㄩㄣˊ　ㄔㄨ　ㄌㄟˋ,bá qún chū lèi
2443.0,衣冠齊楚,ㄧ　ㄍㄨㄢ　ㄐㄧˇ　ㄔㄨˇ,yī guān jǐ chǔ
2444.0,眾口爍金,ㄓㄨㄥˋ　ㄎㄡˇ　ㄕㄨㄛˋ　ㄐㄧㄣ,zhòng kǒu shuò jīn
2445.0,年高德邵,ㄋㄧㄢˊ　ㄍㄠ　ㄉㄜˊ　ㄕㄠˋ,nián gāo dé shào
2446.0,半籌不納,ㄅㄢˋ　ㄔㄡˊ　ㄅㄨˋ　ㄋㄚˋ　（變）　ㄅㄢˋ　ㄔㄡˊ　ㄅㄨˊ　ㄋㄚˋ,bàn chóu bù nà （變） bàn chóu bú nà
2447.0,東風射馬耳,ㄉㄨㄥ　ㄈㄥ　ㄕㄜˋ　ㄇㄚˇ　ㄦˇ,dōng fēng shè mǎ ěr
2448.0,孤苦零丁,ㄍㄨ　ㄎㄨˇ　ㄌㄧㄥˊ　ㄉㄧㄥ,gū kǔ líng dīng
2449.0,魯魚帝虎,ㄌㄨˇ　ㄩˊ　ㄉㄧˋ　ㄏㄨˇ,lǔ yú dì hǔ
2450.0,錙銖較量,ㄗ　ㄓㄨ　ㄐㄧㄠˋ　ㄌㄧㄤˋ,zī zhū jiào liàng
2451.0,德隆望尊,ㄉㄜˊ　ㄌㄨㄥˊ　ㄨㄤˋ　ㄗㄨㄣ,dé lóng wàng zūn
2452.0,鞭辟近裡,ㄅㄧㄢ　ㄅㄧˋ　ㄐㄧㄣˋ　ㄌㄧˇ,biān bì jìn lǐ
2453.0,見仁見知,ㄐㄧㄢˋ　ㄖㄣˊ　ㄐㄧㄢˋ　ㄓˋ,jiàn rén jiàn zhì
2454.0,胸中無墨,ㄒㄩㄥ　ㄓㄨㄥ　ㄨˊ　ㄇㄛˋ,xiōng zhōng wú mò
2455.0,弊帚千金,ㄅㄧˋ　ㄓㄡˇ　ㄑㄧㄢ　ㄐㄧㄣ,bì zhǒu qiān jīn
2456.0,沈舟破釜,ㄔㄣˊ　ㄓㄡ　ㄆㄛˋ　ㄈㄨˇ,chén zhōu pò fǔ
2457.0,露肘捉襟,ㄌㄨˋ　ㄓㄡˇ　ㄓㄨㄛ　ㄐㄧㄣ,lù zhǒu zhuō jīn
2458.0,雪月風花,ㄒㄩㄝˇ　ㄩㄝˋ　ㄈㄥ　ㄏㄨㄚ,xuě yuè fēng huā
2459.0,一介不苟,ㄧ　ㄐㄧㄝˋ　ㄅㄨˋ　ㄍㄡˇ　（變）　ㄧˊ　ㄐㄧㄝˋ　ㄅㄨˋ　ㄍㄡˇ,yī jiè bù gǒu （變） yí jiè bù gǒu
2460.0,三人市虎,ㄙㄢ　ㄖㄣˊ　ㄕˋ　ㄏㄨˇ,sān rén shì hǔ
2461.0,天空海闊,ㄊㄧㄢ　ㄎㄨㄥ　ㄏㄞˇ　ㄎㄨㄛˋ,tiān kōng hǎi kuò
2462.0,馬龍車水,ㄇㄚˇ　ㄌㄨㄥˊ　ㄔㄜ　ㄕㄨㄟˇ,mǎ lóng chē shuǐ
2463.0,弓影杯蛇,ㄍㄨㄥ　ㄧㄥˇ　ㄅㄟ　ㄕㄜˊ,gōng yǐng bēi shé
2464.0,川流不舍,ㄔㄨㄢ　ㄌㄧㄡˊ　ㄅㄨˋ　ㄕㄜˇ,chuān liú bù shě
2465.0,緩步當車,ㄏㄨㄢˇ　ㄅㄨˋ　ㄉㄤ　ㄐㄩ,huǎn bù dāng jū
2466.0,傳聞不如親見,ㄔㄨㄢˊ　ㄨㄣˊ　ㄅㄨˋ　ㄖㄨˊ　ㄑㄧㄣ　ㄐㄧㄢˋ,chuán wén bù rú qīn jiàn
2467.0,價重連城,ㄐㄧㄚˋ　ㄓㄨㄥˋ　ㄌㄧㄢˊ　ㄔㄥˊ,jià zhòng lián chéng
2468.0,汗出沾背,ㄏㄢˋ　ㄔㄨ　ㄓㄢ　ㄅㄟˋ,hàn chū zhān bèi
2469.0,決雌雄,ㄐㄩㄝˊ　ㄘ　ㄒㄩㄥˊ,jué cī xióng
2470.0,頭藏尾露,ㄊㄡˊ　ㄘㄤˊ　ㄨㄟˇ　ㄌㄡˋ,tóu cáng wěi lòu
2471.0,狐死兔悲,ㄏㄨˊ　ㄙˇ　ㄊㄨˋ　ㄅㄟ,hú sǐ tù bēi
2472.0,暮楚朝秦,ㄇㄨˋ　ㄔㄨˇ　ㄓㄠ　ㄑㄧㄣˊ,mù chǔ zhāo qín
2473.0,事與心違,ㄕˋ　ㄩˇ　ㄒㄧㄣ　ㄨㄟˊ,shì yǔ xīn wéi
2474.0,置身無地,ㄓˋ　ㄕㄣ　ㄨˊ　ㄉㄧˋ,zhì shēn wú dì
2475.0,日異月新,ㄖˋ　ㄧˋ　ㄩㄝˋ　ㄒㄧㄣ,rì yì yuè xīn
2476.0,搜章摘句,ㄙㄡ　ㄓㄤ　ㄓㄞ　ㄐㄩˋ,sōu zhāng zhāi jù
2477.0,報怨以德,ㄅㄠˋ　ㄩㄢˋ　ㄧˇ　ㄉㄜˊ,bào yuàn yǐ dé
2478.0,提綱振領,ㄊㄧˊ　ㄍㄤ　ㄓㄣˋ　ㄌㄧㄥˇ,tí gāng zhèn lǐng
2479.0,四分五剖,ㄙˋ　ㄈㄣ　ㄨˇ　ㄆㄡˇ,sì fēn wǔ pǒu
2480.0,公平無私,ㄍㄨㄥ　ㄆㄧㄥˊ　ㄨˊ　ㄙ,gōng píng wú sī
2481.0,小異大同,ㄒㄧㄠˇ　ㄧˋ　ㄉㄚˋ　ㄊㄨㄥˊ,xiǎo yì dà tóng
2482.0,一顧傾城,ㄧ　ㄍㄨˋ　ㄑㄧㄥ　ㄔㄥˊ　（變）　ㄧˊ　ㄍㄨˋ　ㄑㄧㄥ　ㄔㄥˊ,yī gù qīng chéng （變） yí gù qīng chéng
2483.0,口如懸河,ㄎㄡˇ　ㄖㄨˊ　ㄒㄩㄢˊ　ㄏㄜˊ,kǒu rú xuán hé
2484.0,三寸之舌,ㄙㄢ　ㄘㄨㄣˋ　ㄓ　ㄕㄜˊ,sān cùn zhī shé
2485.0,手腳無措,ㄕㄡˇ　ㄐㄧㄠˇ　ㄨˊ　ㄘㄨㄛˋ,shǒu jiǎo wú cuò
2486.0,目擩耳染,ㄇㄨˋ　ㄖㄨˋ　ㄦˇ　ㄖㄢˇ,mù rù ěr rǎn
2487.0,東家效顰,ㄉㄨㄥ　ㄐㄧㄚ　ㄒㄧㄠˋ　ㄆㄧㄣˊ,dōng jiā xiào pín
2488.0,樂極悲來,ㄌㄜˋ　ㄐㄧˊ　ㄅㄟ　ㄌㄞˊ,lè jí bēi lái
2489.0,樂極悲生,ㄌㄜˋ　ㄐㄧˊ　ㄅㄟ　ㄕㄥ,lè jí bēi shēng
2490.0,多多益辦,ㄉㄨㄛ　ㄉㄨㄛ　ㄧˋ　ㄅㄢˋ,duō duō yì bàn
2491.0,沒法沒天,ㄇㄟˊ　ㄈㄚˇ　ㄇㄟˊ　ㄊㄧㄢ,méi fǎ méi tiān
2492.0,良莠不分,ㄌㄧㄤˊ　ㄧㄡˋ　ㄅㄨˋ　ㄈㄣ,liáng yòu bù fēn
2493.0,披星帶月,ㄆㄧ　ㄒㄧㄥ　ㄉㄞˋ　ㄩㄝˋ,pī xīng dài yuè
2494.0,拭目以俟,ㄕˋ　ㄇㄨˋ　ㄧˇ　ㄙˋ,shì mù yǐ sì
2495.0,帶月披星,ㄉㄞˋ　ㄩㄝˋ　ㄆㄧ　ㄒㄧㄥ,dài yuè pī xīng
2496.0,繞梁之音,ㄖㄠˋ　ㄌㄧㄤˊ　ㄓ　ㄧㄣ,rào liáng zhī yīn
2497.0,咫尺萬里,ㄓˇ　ㄔˇ　ㄨㄢˋ　ㄌㄧˇ,zhǐ chǐ wàn lǐ
2498.0,罷於奔命,ㄆㄧˊ　ㄩˊ　ㄅㄣ　ㄇㄧㄥˋ,pí yú bēn mìng
2499.0,流血漂鹵,ㄌㄧㄡˊ　ㄒㄧㄝˇ　ㄆㄧㄠ　ㄌㄨˇ,liú xiě piāo lǔ
2500.0,秣馬利兵,ㄇㄛˋ　ㄇㄚˇ　ㄌㄧˋ　ㄅㄧㄥ,mò mǎ lì bīng
2501.0,漸至佳境,ㄐㄧㄢˋ　ㄓˋ　ㄐㄧㄚ　ㄐㄧㄥˋ,jiàn zhì jiā jìng
2502.0,藍田出玉,ㄌㄢˊ　ㄊㄧㄢˊ　ㄔㄨ　ㄩˋ,lán tián chū yù
2503.0,暴躁如雷,ㄅㄠˋ　ㄗㄠˋ　ㄖㄨˊ　ㄌㄟˊ,bào zào rú léi
2504.0,爆燥如雷,ㄅㄠˋ　ㄗㄠˋ　ㄖㄨˊ　ㄌㄟˊ,bào zào rú léi
2505.0,七張八嘴,ㄑㄧ　ㄓㄤ　ㄅㄚ　ㄗㄨㄟˇ,qī zhāng bā zuǐ
2506.0,披肝露膽,ㄆㄧ　ㄍㄢ　ㄌㄡˋ　ㄉㄢˇ,pī gān lòu dǎn
2507.0,冷言諷語,ㄌㄥˇ　ㄧㄢˊ　ㄈㄥˋ　ㄩˇ,lěng yán fèng yǔ
2508.0,指鹿道馬,ㄓˇ　ㄌㄨˋ　ㄉㄠˋ　ㄇㄚˇ,zhǐ lù dào mǎ
2509.0,飛黃騰踏,ㄈㄟ　ㄏㄨㄤˊ　ㄊㄥˊ　ㄊㄚˋ,fēi huáng téng tà
2510.0,狽因狼突,ㄅㄟˋ　ㄧㄣ　ㄌㄤˊ　ㄊㄨˊ,bèi yīn láng tú
2511.0,殫精極慮,ㄉㄢ　ㄐㄧㄥ　ㄐㄧˊ　ㄌㄩˋ,dān jīng jí lǜ
2512.0,塗不拾遺,ㄊㄨˊ　ㄅㄨˋ　ㄕˊ　ㄧˊ,tú bù shí yí
2513.0,戮力壹心,ㄌㄨˋ　ㄌㄧˋ　ㄧ　ㄒㄧㄣ,lù lì yī xīn
2514.0,方以類聚,ㄈㄤ　ㄧˇ　ㄌㄟˋ　ㄐㄩˋ,fāng yǐ lèi jù
2515.0,啣環結草,ㄒㄧㄢˊ　ㄏㄨㄢˊ　ㄐㄧㄝˊ　ㄘㄠˇ,xián huán jié cǎo
2516.0,叱咤風雲,ㄔˋ　ㄓㄚˋ　ㄈㄥ　ㄩㄣˊ,chì zhà fēng yún
2517.0,腹便便,ㄈㄨˋ　ㄆㄧㄢˊ　ㄆㄧㄢˊ,fù pián pián
2518.0,打草蛇驚,ㄉㄚˇ　ㄘㄠˇ　ㄕㄜˊ　ㄐㄧㄥ,dǎ cǎo shé jīng
2519.0,絕韋編,ㄐㄩㄝˊ　ㄨㄟˊ　ㄅㄧㄢ,jué wéi biān
2520.0,為法自斃,ㄨㄟˊ　ㄈㄚˇ　ㄗˋ　ㄅㄧˋ,wéi fǎ zì bì
2521.0,五行並下,ㄨˇ　ㄏㄤˊ　ㄅㄧㄥˋ　ㄒㄧㄚˋ,wǔ háng bìng xià
2522.0,玉石同碎,ㄩˋ　ㄕˊ　ㄊㄨㄥˊ　ㄙㄨㄟˋ,yù shí tóng suì
2523.0,春花秋實,ㄔㄨㄣ　ㄏㄨㄚ　ㄑㄧㄡ　ㄕˊ,chūn huā qiū shí
2524.0,杯盤狼籍,ㄅㄟ　ㄆㄢˊ　ㄌㄤˊ　ㄐㄧˊ,bēi pán láng jí
2525.0,廣益集思,ㄍㄨㄤˇ　ㄧˋ　ㄐㄧˊ　ㄙ,guǎng yì jí sī
2526.0,亭亭而立,ㄊㄧㄥˊ　ㄊㄧㄥˊ　ㄦˊ　ㄌㄧˋ,tíng tíng ér lì
2527.0,廣眾之庭,ㄍㄨㄤˇ　ㄓㄨㄥˋ　ㄓ　ㄊㄧㄥˊ,guǎng zhòng zhī tíng
2528.0,痛減思痛,ㄊㄨㄥˋ　ㄐㄧㄢˇ　ㄙ　ㄊㄨㄥˋ,tòng jiǎn sī tòng
2529.0,疾入膏肓,ㄐㄧˊ　ㄖㄨˋ　ㄍㄠ　ㄏㄨㄤ,jí rù gāo huāng
2530.0,靡靡之聲,ㄇㄧˇ　ㄇㄧˇ　ㄓ　ㄕㄥ,mǐ mǐ zhī shēng
2531.0,靡微不周,ㄇㄧˊ　ㄨㄟˊ　ㄅㄨˋ　ㄓㄡ,mí wéi bù zhōu
2532.0,疾聲遽色,ㄐㄧˊ　ㄕㄥ　ㄐㄩˋ　ㄙㄜˋ,jí shēng jù sè
2533.0,應手從心,ㄧㄥˋ　ㄕㄡˇ　ㄘㄨㄥˊ　ㄒㄧㄣ,yìng shǒu cóng xīn
2534.0,廬山之真,ㄌㄨˊ　ㄕㄢ　ㄓ　ㄓㄣ,lú shān zhī zhēn
2535.0,廣大神通,ㄍㄨㄤˇ　ㄉㄚˋ　ㄕㄣˊ　ㄊㄨㄥ,guǎng dà shén tōng
2536.0,應風披靡,ㄧㄥˋ　ㄈㄥ　ㄆㄧ　ㄇㄧˇ,yìng fēng pī mǐ
2537.0,廣思集益,ㄍㄨㄤˇ　ㄙ　ㄐㄧˊ　ㄧˋ,guǎng sī jí yì
2538.0,應答如注,ㄧㄥˋ　ㄉㄚˊ　ㄖㄨˊ　ㄓㄨˋ,yìng dá rú zhù
2539.0,靡靡之響,ㄇㄧˇ　ㄇㄧˇ　ㄓ　ㄒㄧㄤˇ,mǐ mǐ zhī xiǎng
2540.0,亭亭獨立,ㄊㄧㄥˊ　ㄊㄧㄥˊ　ㄉㄨˊ　ㄌㄧˋ,tíng tíng dú lì
2541.0,立馬萬言,ㄌㄧˋ　ㄇㄚˇ　ㄨㄢˋ　ㄧㄢˊ,lì mǎ wàn yán
2542.0,方昌未艾,ㄈㄤ　ㄔㄤ　ㄨㄟˋ　ㄞˋ,fāng chāng wèi ài
2543.0,病風喪心,ㄅㄧㄥˋ　ㄈㄥ　ㄙㄤˋ　ㄒㄧㄣ,bìng fēng sàng xīn
2544.0,帝虎魯魚,ㄉㄧˋ　ㄏㄨˇ　ㄌㄨˇ　ㄩˊ,dì hǔ lǔ yú
2545.0,充棟折軸,ㄔㄨㄥ　ㄉㄨㄥˋ　ㄓㄜˊ　ㄓㄡˊ,chōng dòng zhé zhóu
2546.0,方剛血氣,ㄈㄤ　ㄍㄤ　ㄒㄧㄝˇ　ㄑㄧˋ,fāng gāng xiě qì
2547.0,慾令智昏,ㄩˋ　ㄌㄧㄥˋ　ㄓˋ　ㄏㄨㄣ,yù lìng zhì hūn
2548.0,亮節高風,ㄌㄧㄤˋ　ㄐㄧㄝˊ　ㄍㄠ　ㄈㄥ,liàng jié gāo fēng
2549.0,應病與藥,ㄧㄥˋ　ㄅㄧㄥˋ　ㄩˇ　ㄧㄠˋ,yìng bìng yǔ yào
2550.0,應變隨機,ㄧㄥˋ　ㄅㄧㄢˋ　ㄙㄨㄟˊ　ㄐㄧ,yìng biàn suí jī
2551.0,高風大節,ㄍㄠ　ㄈㄥ　ㄉㄚˋ　ㄐㄧㄝˊ,gāo fēng dà jié
2552.0,高懸明鏡,ㄍㄠ　ㄒㄩㄢˊ　ㄇㄧㄥˊ　ㄐㄧㄥˋ,gāo xuán míng jìng
2553.0,離鄉別井,ㄌㄧˊ　ㄒㄧㄤ　ㄅㄧㄝˊ　ㄐㄧㄥˇ,lí xiāng bié jǐng
2554.0,廓落晨星,ㄎㄨㄛˋ　ㄌㄨㄛˋ　ㄔㄣˊ　ㄒㄧㄥ,kuò luò chén xīng
2555.0,意回心轉,ㄧˋ　ㄏㄨㄟˊ　ㄒㄧㄣ　ㄓㄨㄢˇ,yì huí xīn zhuǎn
2556.0,意同情合,ㄧˋ　ㄊㄨㄥˊ　ㄑㄧㄥˊ　ㄏㄜˊ,yì tóng qíng hé
2557.0,度外置之,ㄉㄨˋ　ㄨㄞˋ　ㄓˋ　ㄓ,dù wài zhì zhī
2558.0,摩肩繼踵,ㄇㄛˊ　ㄐㄧㄢ　ㄐㄧˋ　ㄓㄨㄥˇ,mó jiān jì zhǒng
2559.0,方盛未艾,ㄈㄤ　ㄕㄥˋ　ㄨㄟˋ　ㄞˋ,fāng shèng wèi ài
2560.0,康莊之衢,ㄎㄤ　ㄓㄨㄤ　ㄓ　ㄑㄩˊ,kāng zhuāng zhī qú
2561.0,康莊大逵,ㄎㄤ　ㄓㄨㄤ　ㄉㄚˋ　ㄎㄨㄟˊ,kāng zhuāng dà kuí
2562.0,文人人殊,ㄨㄣˊ　ㄖㄣˊ　ㄖㄣˊ　ㄕㄨ,wén rén rén shū
2563.0,忘年之契,ㄨㄤˋ　ㄋㄧㄢˊ　ㄓ　ㄑㄧˋ,wàng nián zhī qì
2564.0,衣帶一江,ㄧ　ㄉㄞˋ　ㄧ　ㄐㄧㄤ　（變）　ㄧ　ㄉㄞˋ　ㄧˋ　ㄐㄧㄤ,yī dài yī jiāng （變） yī dài yì jiāng
2565.0,衣帶水,ㄧ　ㄉㄞˋ　ㄕㄨㄟˇ,yī dài shuǐ
2566.0,言簡意足,ㄧㄢˊ　ㄐㄧㄢˇ　ㄧˋ　ㄗㄨˊ,yán jiǎn yì zú
2567.0,忘形得意,ㄨㄤˋ　ㄒㄧㄥˊ　ㄉㄜˊ　ㄧˋ,wàng xíng dé yì
2568.0,忘筌得魚,ㄨㄤˋ　ㄑㄩㄢˊ　ㄉㄜˊ　ㄩˊ,wàng quán dé yú
2569.0,齊量等觀,ㄑㄧˊ　ㄌㄧㄤˋ　ㄉㄥˇ　ㄍㄨㄢ,qí liàng děng guān
2570.0,言笑不苟,ㄧㄢˊ　ㄒㄧㄠˋ　ㄅㄨˋ　ㄍㄡˇ,yán xiào bù gǒu
2571.0,康莊之路,ㄎㄤ　ㄓㄨㄤ　ㄓ　ㄌㄨˋ,kāng zhuāng zhī lù
2572.0,忘年交好,ㄨㄤˋ　ㄋㄧㄢˊ　ㄐㄧㄠ　ㄏㄠˇ,wàng nián jiāo hǎo
2573.0,庋之高閣,ㄐㄧˇ　ㄓ　ㄍㄠ　ㄍㄜˊ,jǐ zhī gāo gé
2574.0,言簡意深,ㄧㄢˊ　ㄐㄧㄢˇ　ㄧˋ　ㄕㄣ,yán jiǎn yì shēn
2575.0,刻骨銘肌,ㄎㄜˋ　ㄍㄨˇ　ㄇㄧㄥˊ　ㄐㄧ,kè gǔ míng jī
2576.0,交融水乳,ㄐㄧㄠ　ㄖㄨㄥˊ　ㄕㄨㄟˇ　ㄖㄨˇ,jiāo róng shuǐ rǔ
2577.0,就輕避重,ㄐㄧㄡˋ　ㄑㄧㄥ　ㄅㄧˋ　ㄓㄨㄥˋ,jiù qīng bì zhòng
2578.0,望之卻步,ㄨㄤˋ　ㄓ　ㄑㄩㄝˋ　ㄅㄨˋ,wàng zhī què bù
2579.0,言淚俱下,ㄧㄢˊ　ㄌㄟˋ　ㄐㄩˋ　ㄒㄧㄚˋ,yán lèi jù xià
2580.0,率由舊典,ㄕㄨㄞˋ　ㄧㄡˊ　ㄐㄧㄡˋ　ㄉㄧㄢˇ,shuài yóu jiù diǎn
2581.0,望洋而嘆,ㄨㄤˋ　ㄧㄤˊ　ㄦˊ　ㄊㄢˋ,wàng yáng ér tàn
2582.0,望洋之嘆,ㄨㄤˋ　ㄧㄤˊ　ㄓ　ㄊㄢˋ,wàng yáng zhī tàn
2583.0,言何容易,ㄧㄢˊ　ㄏㄜˊ　ㄖㄨㄥˊ　ㄧˋ,yán hé róng yì
2584.0,望眼穿,ㄨㄤˋ　ㄧㄢˇ　ㄔㄨㄢ,wàng yǎn chuān
2585.0,望眼應穿,ㄨㄤˋ　ㄧㄢˇ　ㄧㄥ　ㄔㄨㄢ,wàng yǎn yīng chuān
2586.0,言無倫次,ㄧㄢˊ　ㄨˊ　ㄌㄨㄣˊ　ㄘˋ,yán wú lún cì
2587.0,施教因材,ㄕ　ㄐㄧㄠˋ　ㄧㄣ　ㄘㄞˊ,shī jiào yīn cái
2588.0,妄尊自大,ㄨㄤˋ　ㄗㄨㄣ　ㄗˋ　ㄉㄚˋ,wàng zūn zì dà
2589.0,放虎遺患,ㄈㄤˋ　ㄏㄨˇ　ㄧˊ　ㄏㄨㄢˋ,fàng hǔ yí huàn
2590.0,妄指鹿馬,ㄨㄤˋ　ㄓˇ　ㄌㄨˋ　ㄇㄚˇ,wàng zhǐ lù mǎ
2591.0,京師紙貴,ㄐㄧㄥ　ㄕ　ㄓˇ　ㄍㄨㄟˋ,jīng shī zhǐ guì
2592.0,一齊眾楚,ㄧ　ㄑㄧˊ　ㄓㄨㄥˋ　ㄔㄨˇ　（變）　ㄧˋ　ㄑㄧˊ　ㄓㄨㄥˋ　ㄔㄨˇ,yī qí zhòng chǔ （變） yì qí zhòng chǔ
2593.0,放達不羈,ㄈㄤˋ　ㄉㄚˊ　ㄅㄨˋ　ㄐㄧ,fàng dá bù jī
2594.0,棄筆從戎,ㄑㄧˋ　ㄅㄧˇ　ㄘㄨㄥˊ　ㄖㄨㄥˊ,qì bǐ cóng róng
2595.0,棄本就末,ㄑㄧˋ　ㄅㄣˇ　ㄐㄧㄡˋ　ㄇㄛˋ,qì běn jiù mò
2596.0,端本澄源,ㄉㄨㄢ　ㄅㄣˇ　ㄔㄥˊ　ㄩㄢˊ,duān běn chéng yuán
2597.0,敦本正源,ㄉㄨㄣ　ㄅㄣˇ　ㄓㄥˋ　ㄩㄢˊ,dūn běn zhèng yuán
2598.0,端然無恙,ㄉㄨㄢ　ㄖㄢˊ　ㄨˊ　ㄧㄤˋ,duān rán wú yàng
2599.0,剖腹藏寶,ㄆㄡˇ　ㄈㄨˋ　ㄘㄤˊ　ㄅㄠˇ,pǒu fù cáng bǎo
2600.0,一毫不苟,ㄧ　ㄏㄠˊ　ㄅㄨˋ　ㄍㄡˇ　（變）　ㄧˋ　ㄏㄠˊ　ㄅㄨˋ　ㄍㄡˇ,yī háo bù gǒu （變） yì háo bù gǒu
2601.0,一齊眾咻,ㄧ　ㄑㄧˊ　ㄓㄨㄥˋ　ㄒㄧㄡ　（變）　ㄧˋ　ㄑㄧˊ　ㄓㄨㄥˋ　ㄒㄧㄡ,yī qí zhòng xiū （變） yì qí zhòng xiū
2602.0,妄作胡為,ㄨㄤˋ　ㄗㄨㄛˋ　ㄏㄨˊ　ㄨㄟˊ,wàng zuò hú wéi
2603.0,刻船求劍,ㄎㄜˋ　ㄔㄨㄢˊ　ㄑㄧㄡˊ　ㄐㄧㄢˋ,kè chuán qiú jiàn
2604.0,妄稱尊大,ㄨㄤˋ　ㄔㄥ　ㄗㄨㄣ　ㄉㄚˋ,wàng chēng zūn dà
2605.0,一現曇花,ㄧ　ㄒㄧㄢˋ　ㄊㄢˊ　ㄏㄨㄚ　（變）　ㄧˊ　ㄒㄧㄢˋ　ㄊㄢˊ　ㄏㄨㄚ,yī xiàn tán huā （變） yí xiàn tán huā
2606.0,妄自尊,ㄨㄤˋ　ㄗˋ　ㄗㄨㄣ,wàng zì zūn
2607.0,一刀見血,ㄧ　ㄉㄠ　ㄐㄧㄢˋ　ㄒㄧㄝˇ　（變）　ㄧˋ　ㄉㄠ　ㄐㄧㄢˋ　ㄒㄧㄝˇ,yī dāo jiàn xiě （變） yì dāo jiàn xiě
2608.0,一毫不拔,ㄧ　ㄏㄠˊ　ㄅㄨˋ　ㄅㄚˊ　（變）　ㄧˋ　ㄏㄠˊ　ㄅㄨˋ　ㄅㄚˊ,yī háo bù bá （變） yì háo bù bá
2609.0,一新耳目,ㄧ　ㄒㄧㄣ　ㄦˇ　ㄇㄨˋ　（變）　ㄧˋ　ㄒㄧㄣ　ㄦˇ　ㄇㄨˋ,yī xīn ěr mù （變） yì xīn ěr mù
2610.0,妄畫蛇足,ㄨㄤˋ　ㄏㄨㄚˋ　ㄕㄜˊ　ㄗㄨˊ,wàng huà shé zú
2611.0,辯如懸河,ㄅㄧㄢˋ　ㄖㄨˊ　ㄒㄩㄢˊ　ㄏㄜˊ,biàn rú xuán hé
2612.0,一無事事,ㄧ　ㄨˊ　ㄕˋ　ㄕˋ　（變）　ㄧˋ　ㄨˊ　ㄕˋ　ㄕˋ,yī wú shì shì （變） yì wú shì shì
2613.0,享帚自珍,ㄒㄧㄤˇ　ㄓㄡˇ　ㄗˋ　ㄓㄣ,xiǎng zhǒu zì zhēn
2614.0,一律千篇,ㄧ　ㄌㄩˋ　ㄑㄧㄢ　ㄆㄧㄢ　（變）　ㄧˊ　ㄌㄩˋ　ㄑㄧㄢ　ㄆㄧㄢ,yī lǜ qiān piān （變） yí lǜ qiān piān
2615.0,一覽了然,ㄧ　ㄌㄢˇ　ㄌㄧㄠˇ　ㄖㄢˊ　（變）　ㄧˋ　ㄌㄢˇ　ㄌㄧㄠˇ　ㄖㄢˊ,yī lǎn liǎo rán （變） yì lǎn liǎo rán
2616.0,一縷千鈞,ㄧ　ㄌㄩˇ　ㄑㄧㄢ　ㄐㄩㄣ　（變）　ㄧˋ　ㄌㄩˇ　ㄑㄧㄢ　ㄐㄩㄣ,yī lǚ qiān jūn （變） yì lǚ qiān jūn
2617.0,就熟駕輕,ㄐㄧㄡˋ　ㄕㄡˊ　ㄐㄧㄚˋ　ㄑㄧㄥ,jiù shóu jià qīng
2618.0,一字百金,ㄧ　ㄗˋ　ㄅㄞˇ　ㄐㄧㄣ　（變）　ㄧˊ　ㄗˋ　ㄅㄞˇ　ㄐㄧㄣ,yī zì bǎi jīn （變） yí zì bǎi jīn
2619.0,就毒攻毒,ㄐㄧㄡˋ　ㄉㄨˊ　ㄍㄨㄥ　ㄉㄨˊ,jiù dú gōng dú
2620.0,一語九鼎,ㄧ　ㄩˇ　ㄐㄧㄡˇ　ㄉㄧㄥˇ　（變）　ㄧˋ　ㄩˇ　ㄐㄧㄡˇ　ㄉㄧㄥˇ,yī yǔ jiǔ dǐng （變） yì yǔ jiǔ dǐng
2621.0,妄動輕為,ㄨㄤˋ　ㄉㄨㄥˋ　ㄑㄧㄥ　ㄨㄟˊ,wàng dòng qīng wéi
2622.0,一視之仁,ㄧ　ㄕˋ　ㄓ　ㄖㄣˊ　（變）　ㄧˊ　ㄕˋ　ㄓ　ㄖㄣˊ,yī shì zhī rén （變） yí shì zhī rén
2623.0,一十一五,ㄧ　ㄕˊ　ㄧ　ㄨˇ,yī shí yī wǔ
2624.0,一手障天,ㄧ　ㄕㄡˇ　ㄓㄤˋ　ㄊㄧㄢ　（變）　ㄧˋ　ㄕㄡˇ　ㄓㄤˋ　ㄊㄧㄢ,yī shǒu zhàng tiān （變） yì shǒu zhàng tiān
2625.0,一籌不吐,ㄧ　ㄔㄡˊ　ㄅㄨˋ　ㄊㄨˇ　（變）　ㄧˋ　ㄔㄡˊ　ㄅㄨˋ　ㄊㄨˇ,yī chóu bù tǔ （變） yì chóu bù tǔ
2626.0,一念之誤,ㄧ　ㄋㄧㄢˋ　ㄓ　ㄨˋ　（變）　ㄧˊ　ㄋㄧㄢˋ　ㄓ　ㄨˋ,yī niàn zhī wù （變） yí niàn zhī wù
